audio_id,video_id,segment_id,segment_file,transcript_file,start,end,duration,text,transcript_source,transcript_status,vad_status,source_url,title
yt_qs3vbS7RXRQ,qs3vbS7RXRQ,yt_qs3vbS7RXRQ__sent000401,/data/processed/segments/auto_20260615_101148/yt_qs3vbS7RXRQ/yt_qs3vbS7RXRQ__sent000401.wav,/data/processed/segments/auto_20260615_101148/yt_qs3vbS7RXRQ/yt_qs3vbS7RXRQ__sent000401.txt,3870.9,3881.01,10.11,mà có. Nhìn thấy con nằm một mình trong căn phòng vắng mà Thúy nghe đau đớn trong lòng. Tuấn nằm co im thim thí.,vtt,ready,aligned,https://www.youtube.com/watch?v=qs3vbS7RXRQ,Tuyển Tập Giọng Đọc Vàng của Đài Tiếng Nói Việt Nam - NSUT Kim Cúc - Đọc Truyện Đêm Khuya Hay Nhất
yt_qs3vbS7RXRQ,qs3vbS7RXRQ,yt_qs3vbS7RXRQ__sent000402,/data/processed/segments/auto_20260615_101148/yt_qs3vbS7RXRQ/yt_qs3vbS7RXRQ__sent000402.wav,/data/processed/segments/auto_20260615_101148/yt_qs3vbS7RXRQ/yt_qs3vbS7RXRQ__sent000402.txt,3880.82,3883.77,2.95,Thúy hỏi mãi Tuấn cũng không trả lời.,vtt,ready,aligned,https://www.youtube.com/watch?v=qs3vbS7RXRQ,Tuyển Tập Giọng Đọc Vàng của Đài Tiếng Nói Việt Nam - NSUT Kim Cúc - Đọc Truyện Đêm Khuya Hay Nhất
yt_qs3vbS7RXRQ,qs3vbS7RXRQ,yt_qs3vbS7RXRQ__sent000403,/data/processed/segments/auto_20260615_101148/yt_qs3vbS7RXRQ/yt_qs3vbS7RXRQ__sent000403.wav,/data/processed/segments/auto_20260615_101148/yt_qs3vbS7RXRQ/yt_qs3vbS7RXRQ__sent000403.txt,3883.58,3893.33,9.75,Thúy biết con chỉ giả vờ ngủ để tự tìm ra những thắc mắc ở trong lòng. Những thắc mắc đó Thúy thấy quá lớn so với lứa,vtt,ready,aligned,https://www.youtube.com/watch?v=qs3vbS7RXRQ,Tuyển Tập Giọng Đọc Vàng của Đài Tiếng Nói Việt Nam - NSUT Kim Cúc - Đọc Truyện Đêm Khuya Hay Nhất
yt_qs3vbS7RXRQ,qs3vbS7RXRQ,yt_qs3vbS7RXRQ__sent000404,/data/processed/segments/auto_20260615_101148/yt_qs3vbS7RXRQ/yt_qs3vbS7RXRQ__sent000404.wav,/data/processed/segments/auto_20260615_101148/yt_qs3vbS7RXRQ/yt_qs3vbS7RXRQ__sent000404.txt,3893.14,3903.169,10.029,tuổi thơ dại của con. Đã bao lần cô muốn giải thích cho con hiểu nhưng không biết phải nói sao và bắt đầu như thế nào.,vtt,ready,aligned,https://www.youtube.com/watch?v=qs3vbS7RXRQ,Tuyển Tập Giọng Đọc Vàng của Đài Tiếng Nói Việt Nam - NSUT Kim Cúc - Đọc Truyện Đêm Khuya Hay Nhất
yt_qs3vbS7RXRQ,qs3vbS7RXRQ,yt_qs3vbS7RXRQ__sent000405,/data/processed/segments/auto_20260615_101148/yt_qs3vbS7RXRQ/yt_qs3vbS7RXRQ__sent000405.wav,/data/processed/segments/auto_20260615_101148/yt_qs3vbS7RXRQ/yt_qs3vbS7RXRQ__sent000405.txt,3902.968,3908.369,5.401,Thúy không muốn lòng con bị tổn hại vì chuyện của người lớn.,vtt,ready,aligned,https://www.youtube.com/watch?v=qs3vbS7RXRQ,Tuyển Tập Giọng Đọc Vàng của Đài Tiếng Nói Việt Nam - NSUT Kim Cúc - Đọc Truyện Đêm Khuya Hay Nhất
yt_qs3vbS7RXRQ,qs3vbS7RXRQ,yt_qs3vbS7RXRQ__sent000406,/data/processed/segments/auto_20260615_101148/yt_qs3vbS7RXRQ/yt_qs3vbS7RXRQ__sent000406.wav,/data/processed/segments/auto_20260615_101148/yt_qs3vbS7RXRQ/yt_qs3vbS7RXRQ__sent000406.txt,3908.056,3918.178,10.122,Ngày trước phải chi Thúy Giáng chịu đựng khuyên nhủ không lạnh nhạt với chồng thì chắc đâu xảy ra chuyện nông nỗi như ngày hôm,vtt,ready,aligned,https://www.youtube.com/watch?v=qs3vbS7RXRQ,Tuyển Tập Giọng Đọc Vàng của Đài Tiếng Nói Việt Nam - NSUT Kim Cúc - Đọc Truyện Đêm Khuya Hay Nhất
yt_qs3vbS7RXRQ,qs3vbS7RXRQ,yt_qs3vbS7RXRQ__sent000407,/data/processed/segments/auto_20260615_101148/yt_qs3vbS7RXRQ/yt_qs3vbS7RXRQ__sent000407.wav,/data/processed/segments/auto_20260615_101148/yt_qs3vbS7RXRQ/yt_qs3vbS7RXRQ__sent000407.txt,3918.424,3927.57,9.146,"nay. Thúy thấy có lỗi với con, có lỗi với lòng vì không thực hiện tròn lời hứa làm người vợ, người mẹ tốt giống như đức",vtt,ready,aligned,https://www.youtube.com/watch?v=qs3vbS7RXRQ,Tuyển Tập Giọng Đọc Vàng của Đài Tiếng Nói Việt Nam - NSUT Kim Cúc - Đọc Truyện Đêm Khuya Hay Nhất
yt_qs3vbS7RXRQ,qs3vbS7RXRQ,yt_qs3vbS7RXRQ__sent000408,/data/processed/segments/auto_20260615_101148/yt_qs3vbS7RXRQ/yt_qs3vbS7RXRQ__sent000408.wav,/data/processed/segments/auto_20260615_101148/yt_qs3vbS7RXRQ/yt_qs3vbS7RXRQ__sent000408.txt,3927.38,3939.01,11.63,"hiy sinh cao cả của mẹ chồng. Ngày Thúy chấp nhận về sống chung với sĩ cũng vì biết được bà Trầm có đức tính nhân hậu hơn người, một người mẹ mà từ lâu cô",vtt,ready,aligned,https://www.youtube.com/watch?v=qs3vbS7RXRQ,Tuyển Tập Giọng Đọc Vàng của Đài Tiếng Nói Việt Nam - NSUT Kim Cúc - Đọc Truyện Đêm Khuya Hay Nhất
yt_qs3vbS7RXRQ,qs3vbS7RXRQ,yt_qs3vbS7RXRQ__sent000409,/data/processed/segments/auto_20260615_101148/yt_qs3vbS7RXRQ/yt_qs3vbS7RXRQ__sent000409.wav,/data/processed/segments/auto_20260615_101148/yt_qs3vbS7RXRQ/yt_qs3vbS7RXRQ__sent000409.txt,3938.82,3949.77,10.95,ngưỡng mộ. Chuyện xảy ra đã hơn 6 năm mà Thúy cứu ngỡ như mới ngày hôm qua. Ngày ấy Thúy quen sĩ trong dịp đến,vtt,ready,aligned,https://www.youtube.com/watch?v=qs3vbS7RXRQ,Tuyển Tập Giọng Đọc Vàng của Đài Tiếng Nói Việt Nam - NSUT Kim Cúc - Đọc Truyện Đêm Khuya Hay Nhất
yt_qs3vbS7RXRQ,qs3vbS7RXRQ,yt_qs3vbS7RXRQ__sent000410,/data/processed/segments/auto_20260615_101148/yt_qs3vbS7RXRQ/yt_qs3vbS7RXRQ__sent000410.wav,/data/processed/segments/auto_20260615_101148/yt_qs3vbS7RXRQ/yt_qs3vbS7RXRQ__sent000410.txt,3949.58,3959.209,9.629,"chơi nhà người chị ruột. Trong số bạn bè chơi chung, Sĩ là người nổi trội hơn ai hết. ăn mặt bành bao, nói năng lưu loát,",vtt,ready,aligned,https://www.youtube.com/watch?v=qs3vbS7RXRQ,Tuyển Tập Giọng Đọc Vàng của Đài Tiếng Nói Việt Nam - NSUT Kim Cúc - Đọc Truyện Đêm Khuya Hay Nhất
yt_qs3vbS7RXRQ,qs3vbS7RXRQ,yt_qs3vbS7RXRQ__sent000411,/data/processed/segments/auto_20260615_101148/yt_qs3vbS7RXRQ/yt_qs3vbS7RXRQ__sent000411.wav,/data/processed/segments/auto_20260615_101148/yt_qs3vbS7RXRQ/yt_qs3vbS7RXRQ__sent000411.txt,3959.019,3968.209,9.19,"ra vẻ trầm tĩnh như một người anh. Là một cô gái mới lớn, Thúy nhanh chóng xao lòng trước vẻ lịch lãm của Sĩ. Sau vài",vtt,ready,aligned,https://www.youtube.com/watch?v=qs3vbS7RXRQ,Tuyển Tập Giọng Đọc Vàng của Đài Tiếng Nói Việt Nam - NSUT Kim Cúc - Đọc Truyện Đêm Khuya Hay Nhất
yt_qs3vbS7RXRQ,qs3vbS7RXRQ,yt_qs3vbS7RXRQ__sent000412,/data/processed/segments/auto_20260615_101148/yt_qs3vbS7RXRQ/yt_qs3vbS7RXRQ__sent000412.wav,/data/processed/segments/auto_20260615_101148/yt_qs3vbS7RXRQ/yt_qs3vbS7RXRQ__sent000412.txt,3968.019,3978.33,10.311,"lần dẫn Thúy về nhà chơi, Sĩ thúc giục mẹ nhờ người mai mối để cho anh cưới Thúy. Thấy Thúy tính tình điềm đạm nết",vtt,ready,aligned,https://www.youtube.com/watch?v=qs3vbS7RXRQ,Tuyển Tập Giọng Đọc Vàng của Đài Tiếng Nói Việt Nam - NSUT Kim Cúc - Đọc Truyện Đêm Khuya Hay Nhất
yt_qs3vbS7RXRQ,qs3vbS7RXRQ,yt_qs3vbS7RXRQ__sent000413,/data/processed/segments/auto_20260615_101148/yt_qs3vbS7RXRQ/yt_qs3vbS7RXRQ__sent000413.wav,/data/processed/segments/auto_20260615_101148/yt_qs3vbS7RXRQ/yt_qs3vbS7RXRQ__sent000413.txt,3978.14,3987.33,9.19,"na, bà Trầm vui thầm trong bụng. Còn Thúy sau vài lần tiếp xúc cũng hết lòng quý mến mẹ chồng tương [âm nhạc]",vtt,ready,aligned,https://www.youtube.com/watch?v=qs3vbS7RXRQ,Tuyển Tập Giọng Đọc Vàng của Đài Tiếng Nói Việt Nam - NSUT Kim Cúc - Đọc Truyện Đêm Khuya Hay Nhất
yt_qs3vbS7RXRQ,qs3vbS7RXRQ,yt_qs3vbS7RXRQ__sent000414,/data/processed/segments/auto_20260615_101148/yt_qs3vbS7RXRQ/yt_qs3vbS7RXRQ__sent000414.wav,/data/processed/segments/auto_20260615_101148/yt_qs3vbS7RXRQ/yt_qs3vbS7RXRQ__sent000414.txt,3987.179,3999.09,11.911,lai. Thế nhưng cuộc sống vốn nhiều nỗi trái ngang đã không cho Thúy có được những điều như mong ước. Ngày về nhà chồng là ngày cuộc đời Thúy sẽ sang con,vtt,ready,aligned,https://www.youtube.com/watch?v=qs3vbS7RXRQ,Tuyển Tập Giọng Đọc Vàng của Đài Tiếng Nói Việt Nam - NSUT Kim Cúc - Đọc Truyện Đêm Khuya Hay Nhất
yt_qs3vbS7RXRQ,qs3vbS7RXRQ,yt_qs3vbS7RXRQ__sent000415,/data/processed/segments/auto_20260615_101148/yt_qs3vbS7RXRQ/yt_qs3vbS7RXRQ__sent000415.wav,/data/processed/segments/auto_20260615_101148/yt_qs3vbS7RXRQ/yt_qs3vbS7RXRQ__sent000415.txt,3998.9,4004.05,5.15,đường khác mà lòng cô không ngờ tới bao giờ.,vtt,ready,aligned,https://www.youtube.com/watch?v=qs3vbS7RXRQ,Tuyển Tập Giọng Đọc Vàng của Đài Tiếng Nói Việt Nam - NSUT Kim Cúc - Đọc Truyện Đêm Khuya Hay Nhất
yt_qs3vbS7RXRQ,qs3vbS7RXRQ,yt_qs3vbS7RXRQ__sent000416,/data/processed/segments/auto_20260615_101148/yt_qs3vbS7RXRQ/yt_qs3vbS7RXRQ__sent000416.wav,/data/processed/segments/auto_20260615_101148/yt_qs3vbS7RXRQ/yt_qs3vbS7RXRQ__sent000416.txt,4003.768,4014.97,11.202,"Rước dâu về làm lễ xong, sĩ lao và nhậu nhẹt. Cuộc vui từ sáng đến tận chiều hôm, ngoài những người bạn đi chơi chung, còn có cả mấy",vtt,ready,aligned,https://www.youtube.com/watch?v=qs3vbS7RXRQ,Tuyển Tập Giọng Đọc Vàng của Đài Tiếng Nói Việt Nam - NSUT Kim Cúc - Đọc Truyện Đêm Khuya Hay Nhất
yt_qs3vbS7RXRQ,qs3vbS7RXRQ,yt_qs3vbS7RXRQ__sent000417,/data/processed/segments/auto_20260615_101148/yt_qs3vbS7RXRQ/yt_qs3vbS7RXRQ__sent000417.wav,/data/processed/segments/auto_20260615_101148/yt_qs3vbS7RXRQ/yt_qs3vbS7RXRQ__sent000417.txt,4014.78,4024.409,9.629,"đứa con gái choai choai ở ngoài chợ huyện. Với sĩ, dường như đám cưới là dịp để họp mặt bạn bè nhậu nhẹt, anh chẳng",vtt,ready,aligned,https://www.youtube.com/watch?v=qs3vbS7RXRQ,Tuyển Tập Giọng Đọc Vàng của Đài Tiếng Nói Việt Nam - NSUT Kim Cúc - Đọc Truyện Đêm Khuya Hay Nhất
yt_qs3vbS7RXRQ,qs3vbS7RXRQ,yt_qs3vbS7RXRQ__sent000418,/data/processed/segments/auto_20260615_101148/yt_qs3vbS7RXRQ/yt_qs3vbS7RXRQ__sent000418.wav,/data/processed/segments/auto_20260615_101148/yt_qs3vbS7RXRQ/yt_qs3vbS7RXRQ__sent000418.txt,4024.219,4030.85,6.631,"lo gì, cứ để mặc cho mẹ và người vợ trẻ tất bật lo toan mọi việc.",vtt,ready,aligned,https://www.youtube.com/watch?v=qs3vbS7RXRQ,Tuyển Tập Giọng Đọc Vàng của Đài Tiếng Nói Việt Nam - NSUT Kim Cúc - Đọc Truyện Đêm Khuya Hay Nhất
yt_qs3vbS7RXRQ,qs3vbS7RXRQ,yt_qs3vbS7RXRQ__sent000419,/data/processed/segments/auto_20260615_101148/yt_qs3vbS7RXRQ/yt_qs3vbS7RXRQ__sent000419.wav,/data/processed/segments/auto_20260615_101148/yt_qs3vbS7RXRQ/yt_qs3vbS7RXRQ__sent000419.txt,4030.66,4042.05,11.39,"Đêm tân hôn, Thúy buồn ra nước mắt. Nghe tiếng lá rơi xào sạc, tiếng côn trùng rên dị trong đêm. Thúy nhớ quê nhà ra",vtt,ready,aligned,https://www.youtube.com/watch?v=qs3vbS7RXRQ,Tuyển Tập Giọng Đọc Vàng của Đài Tiếng Nói Việt Nam - NSUT Kim Cúc - Đọc Truyện Đêm Khuya Hay Nhất
yt_qs3vbS7RXRQ,qs3vbS7RXRQ,yt_qs3vbS7RXRQ__sent000420,/data/processed/segments/auto_20260615_101148/yt_qs3vbS7RXRQ/yt_qs3vbS7RXRQ__sent000420.wav,/data/processed/segments/auto_20260615_101148/yt_qs3vbS7RXRQ/yt_qs3vbS7RXRQ__sent000420.txt,4041.86,4053.33,11.47,giết. Thúy thấy tiếc vì đã nhanh chóng bỏ qua tuổi đôi mươi về sống chung với Sĩ để giờ nhận lấy nỗi thất vọng khôn,vtt,ready,aligned,https://www.youtube.com/watch?v=qs3vbS7RXRQ,Tuyển Tập Giọng Đọc Vàng của Đài Tiếng Nói Việt Nam - NSUT Kim Cúc - Đọc Truyện Đêm Khuya Hay Nhất
yt_qs3vbS7RXRQ,qs3vbS7RXRQ,yt_qs3vbS7RXRQ__sent000421,/data/processed/segments/auto_20260615_101148/yt_qs3vbS7RXRQ/yt_qs3vbS7RXRQ__sent000421.wav,/data/processed/segments/auto_20260615_101148/yt_qs3vbS7RXRQ/yt_qs3vbS7RXRQ__sent000421.txt,4053.14,4059.81,6.67,"cùng. Những ngày về sống chung, Thúy thấy Sĩ thay đổi gần như hoàn toàn.",vtt,ready,aligned,https://www.youtube.com/watch?v=qs3vbS7RXRQ,Tuyển Tập Giọng Đọc Vàng của Đài Tiếng Nói Việt Nam - NSUT Kim Cúc - Đọc Truyện Đêm Khuya Hay Nhất
yt_qs3vbS7RXRQ,qs3vbS7RXRQ,yt_qs3vbS7RXRQ__sent000422,/data/processed/segments/auto_20260615_101148/yt_qs3vbS7RXRQ/yt_qs3vbS7RXRQ__sent000422.wav,/data/processed/segments/auto_20260615_101148/yt_qs3vbS7RXRQ/yt_qs3vbS7RXRQ__sent000422.txt,4059.512,4067.81,8.298,Không biết tính chuyên quyền độc đoán bảo thủ ở anh có từ khi nào mà giờ đây Thúy thấy nó ngày càng lộ,vtt,ready,aligned,https://www.youtube.com/watch?v=qs3vbS7RXRQ,Tuyển Tập Giọng Đọc Vàng của Đài Tiếng Nói Việt Nam - NSUT Kim Cúc - Đọc Truyện Đêm Khuya Hay Nhất
yt_qs3vbS7RXRQ,qs3vbS7RXRQ,yt_qs3vbS7RXRQ__sent000423,/data/processed/segments/auto_20260615_101148/yt_qs3vbS7RXRQ/yt_qs3vbS7RXRQ__sent000423.wav,/data/processed/segments/auto_20260615_101148/yt_qs3vbS7RXRQ/yt_qs3vbS7RXRQ__sent000423.txt,4067.66,4077.929,10.269,"rõ. Sĩ luôn thích tự do. Cái tự do không hề có khuôn khổ hay giới hạn. Anh muốn làm gì thì làm, không ai",vtt,ready,aligned,https://www.youtube.com/watch?v=qs3vbS7RXRQ,Tuyển Tập Giọng Đọc Vàng của Đài Tiếng Nói Việt Nam - NSUT Kim Cúc - Đọc Truyện Đêm Khuya Hay Nhất
yt_qs3vbS7RXRQ,qs3vbS7RXRQ,yt_qs3vbS7RXRQ__sent000424,/data/processed/segments/auto_20260615_101148/yt_qs3vbS7RXRQ/yt_qs3vbS7RXRQ__sent000424.wav,/data/processed/segments/auto_20260615_101148/yt_qs3vbS7RXRQ/yt_qs3vbS7RXRQ__sent000424.txt,4077.739,4087.01,9.271,được quyền có ý kiến hoặc can ngăn. Dù làm việc sai nhưng sĩ không bao giờ thừa nhận mà ngược lại anh luôn đổ thừa cho,vtt,ready,aligned,https://www.youtube.com/watch?v=qs3vbS7RXRQ,Tuyển Tập Giọng Đọc Vàng của Đài Tiếng Nói Việt Nam - NSUT Kim Cúc - Đọc Truyện Đêm Khuya Hay Nhất
yt_qs3vbS7RXRQ,qs3vbS7RXRQ,yt_qs3vbS7RXRQ__sent000425,/data/processed/segments/auto_20260615_101148/yt_qs3vbS7RXRQ/yt_qs3vbS7RXRQ__sent000425.wav,/data/processed/segments/auto_20260615_101148/yt_qs3vbS7RXRQ/yt_qs3vbS7RXRQ__sent000425.txt,4086.82,4090.49,3.67,"lý do này, lý do nọ.",vtt,ready,aligned,https://www.youtube.com/watch?v=qs3vbS7RXRQ,Tuyển Tập Giọng Đọc Vàng của Đài Tiếng Nói Việt Nam - NSUT Kim Cúc - Đọc Truyện Đêm Khuya Hay Nhất
yt_qs3vbS7RXRQ,qs3vbS7RXRQ,yt_qs3vbS7RXRQ__sent000426,/data/processed/segments/auto_20260615_101148/yt_qs3vbS7RXRQ/yt_qs3vbS7RXRQ__sent000426.wav,/data/processed/segments/auto_20260615_101148/yt_qs3vbS7RXRQ/yt_qs3vbS7RXRQ__sent000426.txt,4090.232,4102.09,11.858,Ngay cả cái việc hàng ngày anh tụ tập bạn bè đi chơi bời nhậu nhẹt như lúc còn trai trẻ thì anh cũng cho đó là mối quan hệ không thể chối từ. Anh không thể bỏ,vtt,ready,aligned,https://www.youtube.com/watch?v=qs3vbS7RXRQ,Tuyển Tập Giọng Đọc Vàng của Đài Tiếng Nói Việt Nam - NSUT Kim Cúc - Đọc Truyện Đêm Khuya Hay Nhất
yt_qs3vbS7RXRQ,qs3vbS7RXRQ,yt_qs3vbS7RXRQ__sent000427,/data/processed/segments/auto_20260615_101148/yt_qs3vbS7RXRQ/yt_qs3vbS7RXRQ__sent000427.wav,/data/processed/segments/auto_20260615_101148/yt_qs3vbS7RXRQ/yt_qs3vbS7RXRQ__sent000427.txt,4101.9,4112.409,10.509,hết những thói quen trước đây. Vì làm thế bạn bè sẽ nói là sợ vợ. Chính vì rượu trẻ bê bết nên sĩ ngày,vtt,ready,aligned,https://www.youtube.com/watch?v=qs3vbS7RXRQ,Tuyển Tập Giọng Đọc Vàng của Đài Tiếng Nói Việt Nam - NSUT Kim Cúc - Đọc Truyện Đêm Khuya Hay Nhất
yt_qs3vbS7RXRQ,qs3vbS7RXRQ,yt_qs3vbS7RXRQ__sent000428,/data/processed/segments/auto_20260615_101148/yt_qs3vbS7RXRQ/yt_qs3vbS7RXRQ__sent000428.wav,/data/processed/segments/auto_20260615_101148/yt_qs3vbS7RXRQ/yt_qs3vbS7RXRQ__sent000428.txt,4112.219,4122.73,10.511,"càng nói năng thô lỗ. Thúy luôn phập phồng lao sợ mỗi khi anh có tiệc tùng khách khứa. Thúy sợ ánh mắt của đám bạn anh,",vtt,ready,aligned,https://www.youtube.com/watch?v=qs3vbS7RXRQ,Tuyển Tập Giọng Đọc Vàng của Đài Tiếng Nói Việt Nam - NSUT Kim Cúc - Đọc Truyện Đêm Khuya Hay Nhất
yt_qs3vbS7RXRQ,qs3vbS7RXRQ,yt_qs3vbS7RXRQ__sent000429,/data/processed/segments/auto_20260615_101148/yt_qs3vbS7RXRQ/yt_qs3vbS7RXRQ__sent000429.wav,/data/processed/segments/auto_20260615_101148/yt_qs3vbS7RXRQ/yt_qs3vbS7RXRQ__sent000429.txt,4122.54,4133.57,11.03,"sợ những lời trêu đùa quá mức. Rồi khi đêm về, cô lại tiếp tục sợ cái giọng nói lè nhè trong cơn say của chồng. Sợ cái",vtt,ready,aligned,https://www.youtube.com/watch?v=qs3vbS7RXRQ,Tuyển Tập Giọng Đọc Vàng của Đài Tiếng Nói Việt Nam - NSUT Kim Cúc - Đọc Truyện Đêm Khuya Hay Nhất
yt_qs3vbS7RXRQ,qs3vbS7RXRQ,yt_qs3vbS7RXRQ__sent000430,/data/processed/segments/auto_20260615_101148/yt_qs3vbS7RXRQ/yt_qs3vbS7RXRQ__sent000430.wav,/data/processed/segments/auto_20260615_101148/yt_qs3vbS7RXRQ/yt_qs3vbS7RXRQ__sent000430.txt,4133.38,4136.61,3.23,mùi hôi nồng của men rượu và thuốc lá.,vtt,ready,aligned,https://www.youtube.com/watch?v=qs3vbS7RXRQ,Tuyển Tập Giọng Đọc Vàng của Đài Tiếng Nói Việt Nam - NSUT Kim Cúc - Đọc Truyện Đêm Khuya Hay Nhất
yt_qs3vbS7RXRQ,qs3vbS7RXRQ,yt_qs3vbS7RXRQ__sent000431,/data/processed/segments/auto_20260615_101148/yt_qs3vbS7RXRQ/yt_qs3vbS7RXRQ__sent000431.wav,/data/processed/segments/auto_20260615_101148/yt_qs3vbS7RXRQ/yt_qs3vbS7RXRQ__sent000431.txt,4136.42,4146.49,10.07,"Sợ lúc gần gũi với anh, anh tục tằn thô lỗ. Anh vồ vợp như đã từng sồn nén cơn thèm khát. Từ bao giờ? Thúy yếu đuối",vtt,ready,aligned,https://www.youtube.com/watch?v=qs3vbS7RXRQ,Tuyển Tập Giọng Đọc Vàng của Đài Tiếng Nói Việt Nam - NSUT Kim Cúc - Đọc Truyện Đêm Khuya Hay Nhất
yt_qs3vbS7RXRQ,qs3vbS7RXRQ,yt_qs3vbS7RXRQ__sent000432,/data/processed/segments/auto_20260615_101148/yt_qs3vbS7RXRQ/yt_qs3vbS7RXRQ__sent000432.wav,/data/processed/segments/auto_20260615_101148/yt_qs3vbS7RXRQ/yt_qs3vbS7RXRQ__sent000432.txt,4146.3,4155.53,9.23,chấp nhận sự dày vò của chồng trong nỗi đớn đau thất vọng ê trề. Dù chẳng dám nói ra nhưng trong lòng Thúy muốn lắm.,vtt,ready,aligned,https://www.youtube.com/watch?v=qs3vbS7RXRQ,Tuyển Tập Giọng Đọc Vàng của Đài Tiếng Nói Việt Nam - NSUT Kim Cúc - Đọc Truyện Đêm Khuya Hay Nhất
yt_qs3vbS7RXRQ,qs3vbS7RXRQ,yt_qs3vbS7RXRQ__sent000433,/data/processed/segments/auto_20260615_101148/yt_qs3vbS7RXRQ/yt_qs3vbS7RXRQ__sent000433.wav,/data/processed/segments/auto_20260615_101148/yt_qs3vbS7RXRQ/yt_qs3vbS7RXRQ__sent000433.txt,4155.34,4164.929,9.589,Cái vuốt ve vỗ về âu yếm. Thúy mong mời được nghe những lời lẽ yêu thương nồng cháy như ban đầu. Cuộc sống của,vtt,ready,aligned,https://www.youtube.com/watch?v=qs3vbS7RXRQ,Tuyển Tập Giọng Đọc Vàng của Đài Tiếng Nói Việt Nam - NSUT Kim Cúc - Đọc Truyện Đêm Khuya Hay Nhất
yt_qs3vbS7RXRQ,qs3vbS7RXRQ,yt_qs3vbS7RXRQ__sent000434,/data/processed/segments/auto_20260615_101148/yt_qs3vbS7RXRQ/yt_qs3vbS7RXRQ__sent000434.wav,/data/processed/segments/auto_20260615_101148/yt_qs3vbS7RXRQ/yt_qs3vbS7RXRQ__sent000434.txt,4164.739,4176.49,11.751,"Thúy cứ vậy mà tiếp diễn và càng ngày cô càng trở nên lạnh lùng, chấp nhận, mặc cho số phận đẩy đưa. Tình cảm sinh hoạt vợ chồng càng",vtt,ready,aligned,https://www.youtube.com/watch?v=qs3vbS7RXRQ,Tuyển Tập Giọng Đọc Vàng của Đài Tiếng Nói Việt Nam - NSUT Kim Cúc - Đọc Truyện Đêm Khuya Hay Nhất
yt_qs3vbS7RXRQ,qs3vbS7RXRQ,yt_qs3vbS7RXRQ__sent000435,/data/processed/segments/auto_20260615_101148/yt_qs3vbS7RXRQ/yt_qs3vbS7RXRQ__sent000435.wav,/data/processed/segments/auto_20260615_101148/yt_qs3vbS7RXRQ/yt_qs3vbS7RXRQ__sent000435.txt,4176.3,4188.21,11.91,xấu hơn kể từ khi Thúy mang thai. Có những đêm Thúy phải ngủ riêng vì không chịu nổi sự dày vò mắng nhếc hoặc cứ lặng im chịu đựng mà thầm cầu mong cho,vtt,ready,aligned,https://www.youtube.com/watch?v=qs3vbS7RXRQ,Tuyển Tập Giọng Đọc Vàng của Đài Tiếng Nói Việt Nam - NSUT Kim Cúc - Đọc Truyện Đêm Khuya Hay Nhất
yt_qs3vbS7RXRQ,qs3vbS7RXRQ,yt_qs3vbS7RXRQ__sent000436,/data/processed/segments/auto_20260615_101148/yt_qs3vbS7RXRQ/yt_qs3vbS7RXRQ__sent000436.wav,/data/processed/segments/auto_20260615_101148/yt_qs3vbS7RXRQ/yt_qs3vbS7RXRQ__sent000436.txt,4188.02,4199.53,11.51,thời gian nhanh chóng trôi qua. Còn bi kịch nào hơn khi cuộc sống của người phụ nữ thiếu vắng tình yêu thì chuyện quan hệ vợ chồng chỉ đơn thuần là quan hệ xác,vtt,ready,aligned,https://www.youtube.com/watch?v=qs3vbS7RXRQ,Tuyển Tập Giọng Đọc Vàng của Đài Tiếng Nói Việt Nam - NSUT Kim Cúc - Đọc Truyện Đêm Khuya Hay Nhất
yt_qs3vbS7RXRQ,qs3vbS7RXRQ,yt_qs3vbS7RXRQ__sent000437,/data/processed/segments/auto_20260615_101148/yt_qs3vbS7RXRQ/yt_qs3vbS7RXRQ__sent000437.wav,/data/processed/segments/auto_20260615_101148/yt_qs3vbS7RXRQ/yt_qs3vbS7RXRQ__sent000437.txt,4199.34,4211.394,12.054,thịt để rồi đọng lại sau đó là nỗi đớn đau. Là phụ nữ bà Trầm biết được điều đó đã nhiều lần bà khuyên con nhưng sĩ chẳng thèm,vtt,ready,aligned,https://www.youtube.com/watch?v=qs3vbS7RXRQ,Tuyển Tập Giọng Đọc Vàng của Đài Tiếng Nói Việt Nam - NSUT Kim Cúc - Đọc Truyện Đêm Khuya Hay Nhất
yt_qs3vbS7RXRQ,qs3vbS7RXRQ,yt_qs3vbS7RXRQ__sent000438,/data/processed/segments/auto_20260615_101148/yt_qs3vbS7RXRQ/yt_qs3vbS7RXRQ__sent000438.wav,/data/processed/segments/auto_20260615_101148/yt_qs3vbS7RXRQ/yt_qs3vbS7RXRQ__sent000438.txt,4211.64,4215.09,3.45,nghe. Chuyện vợ chồng tôi để tôi tính.,vtt,ready,aligned,https://www.youtube.com/watch?v=qs3vbS7RXRQ,Tuyển Tập Giọng Đọc Vàng của Đài Tiếng Nói Việt Nam - NSUT Kim Cúc - Đọc Truyện Đêm Khuya Hay Nhất
yt_qs3vbS7RXRQ,qs3vbS7RXRQ,yt_qs3vbS7RXRQ__sent000439,/data/processed/segments/auto_20260615_101148/yt_qs3vbS7RXRQ/yt_qs3vbS7RXRQ__sent000439.wav,/data/processed/segments/auto_20260615_101148/yt_qs3vbS7RXRQ/yt_qs3vbS7RXRQ__sent000439.txt,4214.9,4221.01,6.11,Bà nói giết tôi bỏ nhà đi à? Sống chung trong nhà thấy vậy làm sao tao chịu nổi.,vtt,ready,aligned,https://www.youtube.com/watch?v=qs3vbS7RXRQ,Tuyển Tập Giọng Đọc Vàng của Đài Tiếng Nói Việt Nam - NSUT Kim Cúc - Đọc Truyện Đêm Khuya Hay Nhất
yt_qs3vbS7RXRQ,qs3vbS7RXRQ,yt_qs3vbS7RXRQ__sent000440,/data/processed/segments/auto_20260615_101148/yt_qs3vbS7RXRQ/yt_qs3vbS7RXRQ__sent000440.wav,/data/processed/segments/auto_20260615_101148/yt_qs3vbS7RXRQ/yt_qs3vbS7RXRQ__sent000440.txt,4220.82,4230.61,9.79,"Thả tao chết đi lúc đó mới hết lo. Anh à, mình sắp có con rồi, anh phải sửa đổi tính tình. Anh nhậu nhẹt như vậy",vtt,ready,aligned,https://www.youtube.com/watch?v=qs3vbS7RXRQ,Tuyển Tập Giọng Đọc Vàng của Đài Tiếng Nói Việt Nam - NSUT Kim Cúc - Đọc Truyện Đêm Khuya Hay Nhất
yt_qs3vbS7RXRQ,qs3vbS7RXRQ,yt_qs3vbS7RXRQ__sent000441,/data/processed/segments/auto_20260615_101148/yt_qs3vbS7RXRQ/yt_qs3vbS7RXRQ__sent000441.wav,/data/processed/segments/auto_20260615_101148/yt_qs3vbS7RXRQ/yt_qs3vbS7RXRQ__sent000441.txt,4230.42,4237.01,6.59,"hoài làm sao em chịu nổi chứ? Tôi là như vậy đó, không chịu nổi thì thôi.",vtt,ready,aligned,https://www.youtube.com/watch?v=qs3vbS7RXRQ,Tuyển Tập Giọng Đọc Vàng của Đài Tiếng Nói Việt Nam - NSUT Kim Cúc - Đọc Truyện Đêm Khuya Hay Nhất
yt_qs3vbS7RXRQ,qs3vbS7RXRQ,yt_qs3vbS7RXRQ__sent000442,/data/processed/segments/auto_20260615_101148/yt_qs3vbS7RXRQ/yt_qs3vbS7RXRQ__sent000442.wav,/data/processed/segments/auto_20260615_101148/yt_qs3vbS7RXRQ/yt_qs3vbS7RXRQ__sent000442.txt,4236.728,4246.73,10.002,"Ờ thôi thì thôi, tôi cũng chịu hết nổi rồi. Thúy thốt lên câu ấy. Làm sĩ đùng đùng nổi giận, hất tung cả bàn ăn, lấy",vtt,ready,aligned,https://www.youtube.com/watch?v=qs3vbS7RXRQ,Tuyển Tập Giọng Đọc Vàng của Đài Tiếng Nói Việt Nam - NSUT Kim Cúc - Đọc Truyện Đêm Khuya Hay Nhất
yt_qs3vbS7RXRQ,qs3vbS7RXRQ,yt_qs3vbS7RXRQ__sent000443,/data/processed/segments/auto_20260615_101148/yt_qs3vbS7RXRQ/yt_qs3vbS7RXRQ__sent000443.wav,/data/processed/segments/auto_20260615_101148/yt_qs3vbS7RXRQ/yt_qs3vbS7RXRQ__sent000443.txt,4246.54,4258.01,11.47,"áo phắt lên vai, bước ra đường. Má Tưởng đâu có vợ rồi, nó sửa đổi tính tình nhưng đâu ngờ con ạ. Bà",vtt,ready,aligned,https://www.youtube.com/watch?v=qs3vbS7RXRQ,Tuyển Tập Giọng Đọc Vàng của Đài Tiếng Nói Việt Nam - NSUT Kim Cúc - Đọc Truyện Đêm Khuya Hay Nhất
