audio_id,video_id,title,source,source_url,audio_file_path,translation_file_path,translation_status,duration_sec,sample_rate,channels,format
yt_0Vk09OdkumY,0Vk09OdkumY,SERIES: LỚP HỌC 3 MIỀN TRIỆU VIEW TIKTOK | KIỆT HÀ TỊNH,youtube,https://www.youtube.com/watch?v=0Vk09OdkumY,/data/processed/audio/yt_0Vk09OdkumY.wav,data/processed/translations/yt_0Vk09OdkumY.txt,ready,1080.007,16000,1,wav
yt_xtI_JEZK_7E,xtI_JEZK_7E,"[PHÓNG SỰ] CHƯƠNG TRÌNH ""NGƯỜI DÂN KHÁNH HOÀ NÓI TIẾNG ANH"" LAN TOẢ TÍCH CỰC",youtube,https://www.youtube.com/watch?v=xtI_JEZK_7E,/data/processed/audio/yt_xtI_JEZK_7E.wav,data/processed/translations/yt_xtI_JEZK_7E.txt,ready,227.648,16000,1,wav
yt_zEHgC2U6k2w,zEHgC2U6k2w,cuộc trò chuyện của  người con Ninh Thuận bác ái. giọng raglai🤣🤣😂😂🤣,youtube,https://www.youtube.com/watch?v=zEHgC2U6k2w,/data/processed/audio/yt_zEHgC2U6k2w.wav,data/processed/translations/yt_zEHgC2U6k2w.txt,missing,422.29,16000,1,wav
yt_tI4X2ixrVfk,tI4X2ixrVfk,"Nghe trộm người Bình Thuận nói chuyện, Bắc Nam chắc khỏi nghe luôn",youtube,https://www.youtube.com/watch?v=tI4X2ixrVfk,/data/processed/audio/yt_tI4X2ixrVfk.wav,data/processed/translations/yt_tI4X2ixrVfk.txt,missing,195.036,16000,1,wav
yt_mdTO2hxNCCo,mdTO2hxNCCo,Giọng Miền Trung có dễ thương không?✅,youtube,https://www.youtube.com/watch?v=mdTO2hxNCCo,/data/processed/audio/yt_mdTO2hxNCCo.wav,data/processed/translations/yt_mdTO2hxNCCo.txt,ready,391.732,16000,1,wav
yt_drpXKfVNjJA,drpXKfVNjJA,Nguồn gốc MÔ TÊ RĂNG RỨA: Giọng nói của người MIỀN TRUNG chính là dấu vết của TIẾNG VIỆT CỔ?,youtube,https://www.youtube.com/watch?v=drpXKfVNjJA,/data/processed/audio/yt_drpXKfVNjJA.wav,data/processed/translations/yt_drpXKfVNjJA.txt,ready,5427.595,16000,1,wav
yt_IFa5zN_JcaI,IFa5zN_JcaI,Tâm sự Châu Giang - Người con gái miền Trung | Tại sao lại nói người miền Trung keo kiệt?,youtube,https://www.youtube.com/watch?v=IFa5zN_JcaI,/data/processed/audio/yt_IFa5zN_JcaI.wav,data/processed/translations/yt_IFa5zN_JcaI.txt,ready,430.173,16000,1,wav
yt_Vk6B_UpJOOw,Vk6B_UpJOOw,Dự báo thời tiết đêm nay và ngày mai 11/6 | Miền Bắc tiếp tục mưa dông trước khi nắng nóng cục bộ,youtube,https://www.youtube.com/watch?v=Vk6B_UpJOOw,/data/processed/audio/yt_Vk6B_UpJOOw.wav,data/processed/translations/yt_Vk6B_UpJOOw.txt,ready,522.971,16000,1,wav
yt_0-XhSWoz_wA,0-XhSWoz_wA,Khánh Vy đọc bản tin giọng 3 miền,youtube,https://www.youtube.com/watch?v=0-XhSWoz_wA,/data/processed/audio/yt_0-XhSWoz_wA.wav,data/processed/translations/yt_0-XhSWoz_wA.txt,ready,31.057,16000,1,wav
