audio_id,video_id,segment_id,segment_file,transcript_file,start,end,duration,text,transcript_source,transcript_status,vad_status,source_url,title
yt_qs3vbS7RXRQ,qs3vbS7RXRQ,yt_qs3vbS7RXRQ__sent000104,/data/processed/segments/auto_20260615_101148/yt_qs3vbS7RXRQ/yt_qs3vbS7RXRQ__sent000104.wav,/data/processed/segments/auto_20260615_101148/yt_qs3vbS7RXRQ/yt_qs3vbS7RXRQ__sent000104.txt,1008.792,1020.81,12.018,"Đến cái tuổi này, lão thấy gân cốt đã rão, chẳng còn ham muốn gì nữa, chỉ hy vọng thằng Lình có vợ xây nhà ở làng, rồi nó cùng lão nghĩ cách mà hạ cây gạo xuống.",vtt,ready,aligned,https://www.youtube.com/watch?v=qs3vbS7RXRQ,Tuyển Tập Giọng Đọc Vàng của Đài Tiếng Nói Việt Nam - NSUT Kim Cúc - Đọc Truyện Đêm Khuya Hay Nhất
yt_qs3vbS7RXRQ,qs3vbS7RXRQ,yt_qs3vbS7RXRQ__sent000105,/data/processed/segments/auto_20260615_101148/yt_qs3vbS7RXRQ/yt_qs3vbS7RXRQ__sent000105.wav,/data/processed/segments/auto_20260615_101148/yt_qs3vbS7RXRQ/yt_qs3vbS7RXRQ__sent000105.txt,1020.632,1032.33,11.698,"Có lần nhân lành về dỗ cụ, đang lúc vui vẻ cả nhà, lão Lơ hỏi ông tiến sĩ, ""Này, ở làng người ta đồn cái thuốc anh chế ra chỉ bằng đầu que diêm, lấy cái gò gạo",vtt,ready,aligned,https://www.youtube.com/watch?v=qs3vbS7RXRQ,Tuyển Tập Giọng Đọc Vàng của Đài Tiếng Nói Việt Nam - NSUT Kim Cúc - Đọc Truyện Đêm Khuya Hay Nhất
yt_qs3vbS7RXRQ,qs3vbS7RXRQ,yt_qs3vbS7RXRQ__sent000106,/data/processed/segments/auto_20260615_101148/yt_qs3vbS7RXRQ/yt_qs3vbS7RXRQ__sent000106.wav,/data/processed/segments/auto_20260615_101148/yt_qs3vbS7RXRQ/yt_qs3vbS7RXRQ__sent000106.txt,1032.14,1042.85,10.71,"tan thành bội. Lệnh thấy lão lơ vui cũng đế theo tan một góc làng cơ bố ạ."" Ba mải trợn mắt này, bố con ông nói cái gì",vtt,ready,aligned,https://www.youtube.com/watch?v=qs3vbS7RXRQ,Tuyển Tập Giọng Đọc Vàng của Đài Tiếng Nói Việt Nam - NSUT Kim Cúc - Đọc Truyện Đêm Khuya Hay Nhất
yt_qs3vbS7RXRQ,qs3vbS7RXRQ,yt_qs3vbS7RXRQ__sent000107,/data/processed/segments/auto_20260615_101148/yt_qs3vbS7RXRQ/yt_qs3vbS7RXRQ__sent000107.wav,/data/processed/segments/auto_20260615_101148/yt_qs3vbS7RXRQ/yt_qs3vbS7RXRQ__sent000107.txt,1042.66,1047.37,4.71,đấy? Không sợ Thanh Hong Lang thổ địa vật chết cả nhà.,vtt,ready,aligned,https://www.youtube.com/watch?v=qs3vbS7RXRQ,Tuyển Tập Giọng Đọc Vàng của Đài Tiếng Nói Việt Nam - NSUT Kim Cúc - Đọc Truyện Đêm Khuya Hay Nhất
yt_qs3vbS7RXRQ,qs3vbS7RXRQ,yt_qs3vbS7RXRQ__sent000108,/data/processed/segments/auto_20260615_101148/yt_qs3vbS7RXRQ/yt_qs3vbS7RXRQ__sent000108.wav,/data/processed/segments/auto_20260615_101148/yt_qs3vbS7RXRQ/yt_qs3vbS7RXRQ__sent000108.txt,1047.16,1058.93,11.77,"lểnh về rồi lểnh lại đi, còn chơ lại nỗi buồn khắc hoải của lão Lơ và bà Mi. Cho đến một hôm, lão Lơ có việc phải lên huyện, lúc về trời nắng gắt làm lão khát",vtt,ready,aligned,https://www.youtube.com/watch?v=qs3vbS7RXRQ,Tuyển Tập Giọng Đọc Vàng của Đài Tiếng Nói Việt Nam - NSUT Kim Cúc - Đọc Truyện Đêm Khuya Hay Nhất
yt_qs3vbS7RXRQ,qs3vbS7RXRQ,yt_qs3vbS7RXRQ__sent000109,/data/processed/segments/auto_20260615_101148/yt_qs3vbS7RXRQ/yt_qs3vbS7RXRQ__sent000109.wav,/data/processed/segments/auto_20260615_101148/yt_qs3vbS7RXRQ/yt_qs3vbS7RXRQ__sent000109.txt,1058.74,1070.649,11.909,"nước, thấy cái quán ven đường để chữ Bia Tươi mới về, lão chép miệng ồii rào cái thứ nước nhạt như nước đái bò, uống bao nhiêu cho bỏ. Định bỏ đi thì một tiếng",vtt,ready,aligned,https://www.youtube.com/watch?v=qs3vbS7RXRQ,Tuyển Tập Giọng Đọc Vàng của Đài Tiếng Nói Việt Nam - NSUT Kim Cúc - Đọc Truyện Đêm Khuya Hay Nhất
yt_qs3vbS7RXRQ,qs3vbS7RXRQ,yt_qs3vbS7RXRQ__sent000110,/data/processed/segments/auto_20260615_101148/yt_qs3vbS7RXRQ/yt_qs3vbS7RXRQ__sent000110.wav,/data/processed/segments/auto_20260615_101148/yt_qs3vbS7RXRQ/yt_qs3vbS7RXRQ__sent000110.txt,1070.459,1074.61,4.151,phụ nữ òn ẻn. Ông anh ơi vào đây đã nào.,vtt,ready,aligned,https://www.youtube.com/watch?v=qs3vbS7RXRQ,Tuyển Tập Giọng Đọc Vàng của Đài Tiếng Nói Việt Nam - NSUT Kim Cúc - Đọc Truyện Đêm Khuya Hay Nhất
yt_qs3vbS7RXRQ,qs3vbS7RXRQ,yt_qs3vbS7RXRQ__sent000111,/data/processed/segments/auto_20260615_101148/yt_qs3vbS7RXRQ/yt_qs3vbS7RXRQ__sent000111.wav,/data/processed/segments/auto_20260615_101148/yt_qs3vbS7RXRQ/yt_qs3vbS7RXRQ__sent000111.txt,1074.42,1077.93,3.51,Nắng nôi thế này vào đây với em cho mát.,vtt,ready,aligned,https://www.youtube.com/watch?v=qs3vbS7RXRQ,Tuyển Tập Giọng Đọc Vàng của Đài Tiếng Nói Việt Nam - NSUT Kim Cúc - Đọc Truyện Đêm Khuya Hay Nhất
yt_qs3vbS7RXRQ,qs3vbS7RXRQ,yt_qs3vbS7RXRQ__sent000112,/data/processed/segments/auto_20260615_101148/yt_qs3vbS7RXRQ/yt_qs3vbS7RXRQ__sent000112.wav,/data/processed/segments/auto_20260615_101148/yt_qs3vbS7RXRQ/yt_qs3vbS7RXRQ__sent000112.txt,1077.688,1088.889,11.201,Thấy mùi tai lão xuống xe rẽ vào. Cô chủ quán ngoài 30 tuổi người đẫy đà hai mắt tít như hai sợi chỉ kéo ghế mời lão ngồi. Nâng cốc bia lên lão xốc thẳng vào,vtt,ready,aligned,https://www.youtube.com/watch?v=qs3vbS7RXRQ,Tuyển Tập Giọng Đọc Vàng của Đài Tiếng Nói Việt Nam - NSUT Kim Cúc - Đọc Truyện Đêm Khuya Hay Nhất
yt_qs3vbS7RXRQ,qs3vbS7RXRQ,yt_qs3vbS7RXRQ__sent000113,/data/processed/segments/auto_20260615_101148/yt_qs3vbS7RXRQ/yt_qs3vbS7RXRQ__sent000113.wav,/data/processed/segments/auto_20260615_101148/yt_qs3vbS7RXRQ/yt_qs3vbS7RXRQ__sent000113.txt,1088.699,1098.889,10.19,họng một hơi hai hơi cho đỡ cơn khát. Ờ cũng khá. Lão gật gù rồi định đứng lên trả tiền. Bỗng có tiếng nói của một,vtt,ready,aligned,https://www.youtube.com/watch?v=qs3vbS7RXRQ,Tuyển Tập Giọng Đọc Vàng của Đài Tiếng Nói Việt Nam - NSUT Kim Cúc - Đọc Truyện Đêm Khuya Hay Nhất
yt_qs3vbS7RXRQ,qs3vbS7RXRQ,yt_qs3vbS7RXRQ__sent000114,/data/processed/segments/auto_20260615_101148/yt_qs3vbS7RXRQ/yt_qs3vbS7RXRQ__sent000114.wav,/data/processed/segments/auto_20260615_101148/yt_qs3vbS7RXRQ/yt_qs3vbS7RXRQ__sent000114.txt,1098.699,1101.17,2.471,người ngồi ở bàn bên.,vtt,ready,aligned,https://www.youtube.com/watch?v=qs3vbS7RXRQ,Tuyển Tập Giọng Đọc Vàng của Đài Tiếng Nói Việt Nam - NSUT Kim Cúc - Đọc Truyện Đêm Khuya Hay Nhất
yt_qs3vbS7RXRQ,qs3vbS7RXRQ,yt_qs3vbS7RXRQ__sent000115,/data/processed/segments/auto_20260615_101148/yt_qs3vbS7RXRQ/yt_qs3vbS7RXRQ__sent000115.wav,/data/processed/segments/auto_20260615_101148/yt_qs3vbS7RXRQ/yt_qs3vbS7RXRQ__sent000115.txt,1100.952,1111.49,10.538,"Cứ theo thuyết kế mà làm, bàn cãi làm gì? Tiếng một người khác. Cái thằng này chả hiểu gì cả. Nếu đi theo hướng ấy thì mắc cây gạo ai chặt cho mày? Lại còn",vtt,ready,aligned,https://www.youtube.com/watch?v=qs3vbS7RXRQ,Tuyển Tập Giọng Đọc Vàng của Đài Tiếng Nói Việt Nam - NSUT Kim Cúc - Đọc Truyện Đêm Khuya Hay Nhất
yt_qs3vbS7RXRQ,qs3vbS7RXRQ,yt_qs3vbS7RXRQ__sent000116,/data/processed/segments/auto_20260615_101148/yt_qs3vbS7RXRQ/yt_qs3vbS7RXRQ__sent000116.wav,/data/processed/segments/auto_20260615_101148/yt_qs3vbS7RXRQ/yt_qs3vbS7RXRQ__sent000116.txt,1110.968,1122.61,11.642,"phải vào ủy ban xã làm thủ tục xin phép chặt mà rút kinh nghiệm có nơi người ta ủng hộ, có nơi chặt xong người ta bắt đền rồi kiện cáo lôi thôi lắm. Tao dự đoán a việc này qua mấy tháng nữa cũng",vtt,ready,aligned,https://www.youtube.com/watch?v=qs3vbS7RXRQ,Tuyển Tập Giọng Đọc Vàng của Đài Tiếng Nói Việt Nam - NSUT Kim Cúc - Đọc Truyện Đêm Khuya Hay Nhất
yt_qs3vbS7RXRQ,qs3vbS7RXRQ,yt_qs3vbS7RXRQ__sent000117,/data/processed/segments/auto_20260615_101148/yt_qs3vbS7RXRQ/yt_qs3vbS7RXRQ__sent000117.wav,/data/processed/segments/auto_20260615_101148/yt_qs3vbS7RXRQ/yt_qs3vbS7RXRQ__sent000117.txt,1122.42,1129.45,7.03,chả xong đâu. Thấy nói đến cây gạo tự dưng lão lơ dòng tai nghe.,vtt,ready,aligned,https://www.youtube.com/watch?v=qs3vbS7RXRQ,Tuyển Tập Giọng Đọc Vàng của Đài Tiếng Nói Việt Nam - NSUT Kim Cúc - Đọc Truyện Đêm Khuya Hay Nhất
yt_qs3vbS7RXRQ,qs3vbS7RXRQ,yt_qs3vbS7RXRQ__sent000118,/data/processed/segments/auto_20260615_101148/yt_qs3vbS7RXRQ/yt_qs3vbS7RXRQ__sent000118.wav,/data/processed/segments/auto_20260615_101148/yt_qs3vbS7RXRQ/yt_qs3vbS7RXRQ__sent000118.txt,1129.112,1140.17,11.058,Sau một hồi lão mới biết đây là đội kéo dây cao thế 380 về làng Bái và các xã khác. Đường dây sẽ đi qua gò gạo mà qua,vtt,ready,aligned,https://www.youtube.com/watch?v=qs3vbS7RXRQ,Tuyển Tập Giọng Đọc Vàng của Đài Tiếng Nói Việt Nam - NSUT Kim Cúc - Đọc Truyện Đêm Khuya Hay Nhất
yt_qs3vbS7RXRQ,qs3vbS7RXRQ,yt_qs3vbS7RXRQ__sent000119,/data/processed/segments/auto_20260615_101148/yt_qs3vbS7RXRQ/yt_qs3vbS7RXRQ__sent000119.wav,/data/processed/segments/auto_20260615_101148/yt_qs3vbS7RXRQ/yt_qs3vbS7RXRQ__sent000119.txt,1139.98,1150.73,10.75,gò thì vướng cây gạo. Thế thì phải hạ cây gạo rồi. Phải ưu tiên điện khí hóa nông thôn chứ. Đi họp người ta đả thông mãi rồi. Lão dòng tai nghe rồi lão rùn,vtt,ready,aligned,https://www.youtube.com/watch?v=qs3vbS7RXRQ,Tuyển Tập Giọng Đọc Vàng của Đài Tiếng Nói Việt Nam - NSUT Kim Cúc - Đọc Truyện Đêm Khuya Hay Nhất
yt_qs3vbS7RXRQ,qs3vbS7RXRQ,yt_qs3vbS7RXRQ__sent000120,/data/processed/segments/auto_20260615_101148/yt_qs3vbS7RXRQ/yt_qs3vbS7RXRQ__sent000120.wav,/data/processed/segments/auto_20260615_101148/yt_qs3vbS7RXRQ/yt_qs3vbS7RXRQ__sent000120.txt,1150.54,1162.57,12.03,"cả người. Lão làm như vô tình kéo ghế xích lại đám đông. Ồ thế ra là các bác kéo điện về làng Bái à? Em ở làng Bái đây mừng lắm, mong điện từng ngày các",vtt,ready,aligned,https://www.youtube.com/watch?v=qs3vbS7RXRQ,Tuyển Tập Giọng Đọc Vàng của Đài Tiếng Nói Việt Nam - NSUT Kim Cúc - Đọc Truyện Đêm Khuya Hay Nhất
yt_qs3vbS7RXRQ,qs3vbS7RXRQ,yt_qs3vbS7RXRQ__sent000121,/data/processed/segments/auto_20260615_101148/yt_qs3vbS7RXRQ/yt_qs3vbS7RXRQ__sent000121.wav,/data/processed/segments/auto_20260615_101148/yt_qs3vbS7RXRQ/yt_qs3vbS7RXRQ__sent000121.txt,1162.38,1174.306,11.926,bác ạ. Có gì khó khăn không? Em về vận động bà con giúp gì chứ điện về làng thì khỏi phải nói. Một người đứng tuổi chừng như đội trưởng của nhóm nói luôn một,vtt,ready,aligned,https://www.youtube.com/watch?v=qs3vbS7RXRQ,Tuyển Tập Giọng Đọc Vàng của Đài Tiếng Nói Việt Nam - NSUT Kim Cúc - Đọc Truyện Đêm Khuya Hay Nhất
yt_qs3vbS7RXRQ,qs3vbS7RXRQ,yt_qs3vbS7RXRQ__sent000122,/data/processed/segments/auto_20260615_101148/yt_qs3vbS7RXRQ/yt_qs3vbS7RXRQ__sent000122.wav,/data/processed/segments/auto_20260615_101148/yt_qs3vbS7RXRQ/yt_qs3vbS7RXRQ__sent000122.txt,1173.98,1183.93,9.95,"mạch. Công việc thì thuận ạ, nhưng bây giờ kéo về làng ông phải qua gò gạo, phải hạ cái cây ấy xuống. Làng có cho chặt không? Có người giúp chúng tôi",vtt,ready,aligned,https://www.youtube.com/watch?v=qs3vbS7RXRQ,Tuyển Tập Giọng Đọc Vàng của Đài Tiếng Nói Việt Nam - NSUT Kim Cúc - Đọc Truyện Đêm Khuya Hay Nhất
yt_qs3vbS7RXRQ,qs3vbS7RXRQ,yt_qs3vbS7RXRQ__sent000123,/data/processed/segments/auto_20260615_101148/yt_qs3vbS7RXRQ/yt_qs3vbS7RXRQ__sent000123.wav,/data/processed/segments/auto_20260615_101148/yt_qs3vbS7RXRQ/yt_qs3vbS7RXRQ__sent000123.txt,1183.74,1193.29,9.55,"không? Lại còn phải xin lệnh điều tời với cầu xuống. gay go đấy. Lão Lơ cuống lên. Ô, tưởng chuyện gì? Việc ấy dễ như",vtt,ready,aligned,https://www.youtube.com/watch?v=qs3vbS7RXRQ,Tuyển Tập Giọng Đọc Vàng của Đài Tiếng Nói Việt Nam - NSUT Kim Cúc - Đọc Truyện Đêm Khuya Hay Nhất
yt_qs3vbS7RXRQ,qs3vbS7RXRQ,yt_qs3vbS7RXRQ__sent000124,/data/processed/segments/auto_20260615_101148/yt_qs3vbS7RXRQ/yt_qs3vbS7RXRQ__sent000124.wav,/data/processed/segments/auto_20260615_101148/yt_qs3vbS7RXRQ/yt_qs3vbS7RXRQ__sent000124.txt,1193.1,1203.009,9.909,"bỡn. Cây gạo chả để làm gì. Hàng năm bọn trẻ con hay ra bắt chim sáo, có đứa lộn cổ xuống chết tươi. Có điện về làng là bà con mừng, không có gì phải phân vân",vtt,ready,aligned,https://www.youtube.com/watch?v=qs3vbS7RXRQ,Tuyển Tập Giọng Đọc Vàng của Đài Tiếng Nói Việt Nam - NSUT Kim Cúc - Đọc Truyện Đêm Khuya Hay Nhất
yt_qs3vbS7RXRQ,qs3vbS7RXRQ,yt_qs3vbS7RXRQ__sent000125,/data/processed/segments/auto_20260615_101148/yt_qs3vbS7RXRQ/yt_qs3vbS7RXRQ__sent000125.wav,/data/processed/segments/auto_20260615_101148/yt_qs3vbS7RXRQ/yt_qs3vbS7RXRQ__sent000125.txt,1202.819,1214.53,11.711,"đâu các bác ạ. Bác cứ vào ủy ban nói một tiếng, em huy động người ra chặt, chẳng phải tời tợt cầu kiếc gì đâu."" Thấy bùi tai, ông đội trưởng nói, ""Tiền bồi dưỡng",vtt,ready,aligned,https://www.youtube.com/watch?v=qs3vbS7RXRQ,Tuyển Tập Giọng Đọc Vàng của Đài Tiếng Nói Việt Nam - NSUT Kim Cúc - Đọc Truyện Đêm Khuya Hay Nhất
yt_qs3vbS7RXRQ,qs3vbS7RXRQ,yt_qs3vbS7RXRQ__sent000126,/data/processed/segments/auto_20260615_101148/yt_qs3vbS7RXRQ/yt_qs3vbS7RXRQ__sent000126.wav,/data/processed/segments/auto_20260615_101148/yt_qs3vbS7RXRQ/yt_qs3vbS7RXRQ__sent000126.txt,1214.34,1220.57,6.23,"chỉ độ răm trăm thôi, liệu có xong không? Để tôi về báo cáo với công ty.""",vtt,ready,aligned,https://www.youtube.com/watch?v=qs3vbS7RXRQ,Tuyển Tập Giọng Đọc Vàng của Đài Tiếng Nói Việt Nam - NSUT Kim Cúc - Đọc Truyện Đêm Khuya Hay Nhất
yt_qs3vbS7RXRQ,qs3vbS7RXRQ,yt_qs3vbS7RXRQ__sent000127,/data/processed/segments/auto_20260615_101148/yt_qs3vbS7RXRQ/yt_qs3vbS7RXRQ__sent000127.wav,/data/processed/segments/auto_20260615_101148/yt_qs3vbS7RXRQ/yt_qs3vbS7RXRQ__sent000127.txt,1220.312,1232.009,11.697,"Thấy công việc quá thuận lợi, lão hồn hển không ra tiếng. ""Ôi, chúng em chả xin gì bác, chỉ làm ít củi đun là được rồi. Tiền ấy ta làm bữa liên hoan là xong.""",vtt,ready,aligned,https://www.youtube.com/watch?v=qs3vbS7RXRQ,Tuyển Tập Giọng Đọc Vàng của Đài Tiếng Nói Việt Nam - NSUT Kim Cúc - Đọc Truyện Đêm Khuya Hay Nhất
yt_qs3vbS7RXRQ,qs3vbS7RXRQ,yt_qs3vbS7RXRQ__sent000128,/data/processed/segments/auto_20260615_101148/yt_qs3vbS7RXRQ/yt_qs3vbS7RXRQ__sent000128.wav,/data/processed/segments/auto_20260615_101148/yt_qs3vbS7RXRQ/yt_qs3vbS7RXRQ__sent000128.txt,1231.864,1241.93,10.066,Họ bắt tay giao kèo với lão. Hùng nhận cái giấy cho phép hạ cây gạo có chữ ký của ủy ban xã. Lão lờ mừng,vtt,ready,aligned,https://www.youtube.com/watch?v=qs3vbS7RXRQ,Tuyển Tập Giọng Đọc Vàng của Đài Tiếng Nói Việt Nam - NSUT Kim Cúc - Đọc Truyện Đêm Khuya Hay Nhất
yt_qs3vbS7RXRQ,qs3vbS7RXRQ,yt_qs3vbS7RXRQ__sent000129,/data/processed/segments/auto_20260615_101148/yt_qs3vbS7RXRQ/yt_qs3vbS7RXRQ__sent000129.wav,/data/processed/segments/auto_20260615_101148/yt_qs3vbS7RXRQ/yt_qs3vbS7RXRQ__sent000129.txt,1241.74,1253.49,11.75,"quá, tí nữa thì lậy sống tay đội trưởng kéo đường dê. Tay đội trưởng khoắn khỏa, phải đà thông mãi đấy. Phải đưa công văn của huyện ra. Các bố ở ủy ban bảo cây",vtt,ready,aligned,https://www.youtube.com/watch?v=qs3vbS7RXRQ,Tuyển Tập Giọng Đọc Vàng của Đài Tiếng Nói Việt Nam - NSUT Kim Cúc - Đọc Truyện Đêm Khuya Hay Nhất
yt_qs3vbS7RXRQ,qs3vbS7RXRQ,yt_qs3vbS7RXRQ__sent000130,/data/processed/segments/auto_20260615_101148/yt_qs3vbS7RXRQ/yt_qs3vbS7RXRQ__sent000130.wav,/data/processed/segments/auto_20260615_101148/yt_qs3vbS7RXRQ/yt_qs3vbS7RXRQ__sent000130.txt,1253.3,1263.97,10.67,gạo ấy đáng phải xếp hạng di tích. Nào là cây gạo là địa điểm treo cờ ngày khởi nghĩa. Nào là lễ xuất quân chống càn của đội du kích xã. Nào là tròi gác máy bay,vtt,ready,aligned,https://www.youtube.com/watch?v=qs3vbS7RXRQ,Tuyển Tập Giọng Đọc Vàng của Đài Tiếng Nói Việt Nam - NSUT Kim Cúc - Đọc Truyện Đêm Khuya Hay Nhất
yt_qs3vbS7RXRQ,qs3vbS7RXRQ,yt_qs3vbS7RXRQ__sent000131,/data/processed/segments/auto_20260615_101148/yt_qs3vbS7RXRQ/yt_qs3vbS7RXRQ__sent000131.wav,/data/processed/segments/auto_20260615_101148/yt_qs3vbS7RXRQ/yt_qs3vbS7RXRQ__sent000131.txt,1263.78,1274.33,10.55,"thời trống Mỹ, nào là ông thổ địa làng bái, rồi lại cái gì cái gì ấy, góp vào việc bảo vệ thuần phong mỹ tục nữa. Lắm lý do lắm. Nhưng cuối cùng tôi đưa ra ý",vtt,ready,aligned,https://www.youtube.com/watch?v=qs3vbS7RXRQ,Tuyển Tập Giọng Đọc Vàng của Đài Tiếng Nói Việt Nam - NSUT Kim Cúc - Đọc Truyện Đêm Khuya Hay Nhất
yt_qs3vbS7RXRQ,qs3vbS7RXRQ,yt_qs3vbS7RXRQ__sent000132,/data/processed/segments/auto_20260615_101148/yt_qs3vbS7RXRQ/yt_qs3vbS7RXRQ__sent000132.wav,/data/processed/segments/auto_20260615_101148/yt_qs3vbS7RXRQ/yt_qs3vbS7RXRQ__sent000132.txt,1274.14,1282.69,8.55,kiến là các bác có ủng hộ việc đưa điện về làng không thì các bố ấy mới chịu. Có giấy rồi ông tiến hành sớm nhé. Cẩn thận,vtt,ready,aligned,https://www.youtube.com/watch?v=qs3vbS7RXRQ,Tuyển Tập Giọng Đọc Vàng của Đài Tiếng Nói Việt Nam - NSUT Kim Cúc - Đọc Truyện Đêm Khuya Hay Nhất
yt_qs3vbS7RXRQ,qs3vbS7RXRQ,yt_qs3vbS7RXRQ__sent000133,/data/processed/segments/auto_20260615_101148/yt_qs3vbS7RXRQ/yt_qs3vbS7RXRQ__sent000133.wav,/data/processed/segments/auto_20260615_101148/yt_qs3vbS7RXRQ/yt_qs3vbS7RXRQ__sent000133.txt,1282.5,1292.97,10.47,giữ an toàn đấy. Lão Lơ lấp liếm. Bác khỏi lo. Nhà em năm đời là thợ sơn tràng. Em xin sang tháng là tiến hành.,vtt,ready,aligned,https://www.youtube.com/watch?v=qs3vbS7RXRQ,Tuyển Tập Giọng Đọc Vàng của Đài Tiếng Nói Việt Nam - NSUT Kim Cúc - Đọc Truyện Đêm Khuya Hay Nhất
yt_qs3vbS7RXRQ,qs3vbS7RXRQ,yt_qs3vbS7RXRQ__sent000134,/data/processed/segments/auto_20260615_101148/yt_qs3vbS7RXRQ/yt_qs3vbS7RXRQ__sent000134.wav,/data/processed/segments/auto_20260615_101148/yt_qs3vbS7RXRQ/yt_qs3vbS7RXRQ__sent000134.txt,1292.76,1303.61,10.85,"Rồi chìa hai bàn tay ra vồ lấy bàn tay của người đội trưởng. Chuẩn bị mọi việc xong lão điện cho lềnh về. Khi còn hai bố con ngồi với nhau, lão trịnh trọng,",vtt,ready,aligned,https://www.youtube.com/watch?v=qs3vbS7RXRQ,Tuyển Tập Giọng Đọc Vàng của Đài Tiếng Nói Việt Nam - NSUT Kim Cúc - Đọc Truyện Đêm Khuya Hay Nhất
yt_qs3vbS7RXRQ,qs3vbS7RXRQ,yt_qs3vbS7RXRQ__sent000135,/data/processed/segments/auto_20260615_101148/yt_qs3vbS7RXRQ/yt_qs3vbS7RXRQ__sent000135.wav,/data/processed/segments/auto_20260615_101148/yt_qs3vbS7RXRQ/yt_qs3vbS7RXRQ__sent000135.txt,1303.48,1314.73,11.25,"anh về đợt này là có việc. Bố nhờ anh là người có học hành chữ nghĩa, anh soạn cho bố bài văn tế các cụ sau khi bố đã hạ cây gạo ngoài gò xuống để các cụ yên",vtt,ready,aligned,https://www.youtube.com/watch?v=qs3vbS7RXRQ,Tuyển Tập Giọng Đọc Vàng của Đài Tiếng Nói Việt Nam - NSUT Kim Cúc - Đọc Truyện Đêm Khuya Hay Nhất
yt_qs3vbS7RXRQ,qs3vbS7RXRQ,yt_qs3vbS7RXRQ__sent000136,/data/processed/segments/auto_20260615_101148/yt_qs3vbS7RXRQ/yt_qs3vbS7RXRQ__sent000136.wav,/data/processed/segments/auto_20260615_101148/yt_qs3vbS7RXRQ/yt_qs3vbS7RXRQ__sent000136.txt,1314.54,1326.17,11.63,"lòng. Mọi thứ đã chuẩn bị xong, giấy ủy ban cho phép cẩn thận. Việc có thế thôi, các việc nặng nhọc bọn thanh niên trong họ nó làm, anh không phải động tay.""",vtt,ready,aligned,https://www.youtube.com/watch?v=qs3vbS7RXRQ,Tuyển Tập Giọng Đọc Vàng của Đài Tiếng Nói Việt Nam - NSUT Kim Cúc - Đọc Truyện Đêm Khuya Hay Nhất
yt_qs3vbS7RXRQ,qs3vbS7RXRQ,yt_qs3vbS7RXRQ__sent000137,/data/processed/segments/auto_20260615_101148/yt_qs3vbS7RXRQ/yt_qs3vbS7RXRQ__sent000137.wav,/data/processed/segments/auto_20260615_101148/yt_qs3vbS7RXRQ/yt_qs3vbS7RXRQ__sent000137.txt,1325.944,1335.45,9.506,"Lệnh ngó ra một lát rồi chậm rãi thưa, ""Sao lại phải hạ cây gạo hả bố? Điện không đi hướng này thì có hướng khác.",vtt,ready,aligned,https://www.youtube.com/watch?v=qs3vbS7RXRQ,Tuyển Tập Giọng Đọc Vàng của Đài Tiếng Nói Việt Nam - NSUT Kim Cúc - Đọc Truyện Đêm Khuya Hay Nhất
yt_qs3vbS7RXRQ,qs3vbS7RXRQ,yt_qs3vbS7RXRQ__sent000138,/data/processed/segments/auto_20260615_101148/yt_qs3vbS7RXRQ/yt_qs3vbS7RXRQ__sent000138.wav,/data/processed/segments/auto_20260615_101148/yt_qs3vbS7RXRQ/yt_qs3vbS7RXRQ__sent000138.txt,1335.128,1346.61,11.482,Mấy trăm năm nữa liệu làng có được cây gạo đẹp đến thế không? Nó là hồn cốt của làng. Chuyện các cụ nhà mình con cho đấy là một kỷ niệm buồn nhưng rất đẹp. Cái,vtt,ready,aligned,https://www.youtube.com/watch?v=qs3vbS7RXRQ,Tuyển Tập Giọng Đọc Vàng của Đài Tiếng Nói Việt Nam - NSUT Kim Cúc - Đọc Truyện Đêm Khuya Hay Nhất
yt_qs3vbS7RXRQ,qs3vbS7RXRQ,yt_qs3vbS7RXRQ__sent000139,/data/processed/segments/auto_20260615_101148/yt_qs3vbS7RXRQ/yt_qs3vbS7RXRQ__sent000139.wav,/data/processed/segments/auto_20260615_101148/yt_qs3vbS7RXRQ/yt_qs3vbS7RXRQ__sent000139.txt,1346.42,1357.61,11.19,thời phong kiến cổ hủ ấy nói làm gì? Mặc dù các cụ cũng thủy chung son sắt với nhau nên mới có bố có con. Bây giờ con không ủng hộ chuyện đấy đâu. Lão Lơ nổi,vtt,ready,aligned,https://www.youtube.com/watch?v=qs3vbS7RXRQ,Tuyển Tập Giọng Đọc Vàng của Đài Tiếng Nói Việt Nam - NSUT Kim Cúc - Đọc Truyện Đêm Khuya Hay Nhất
yt_qs3vbS7RXRQ,qs3vbS7RXRQ,yt_qs3vbS7RXRQ__sent000140,/data/processed/segments/auto_20260615_101148/yt_qs3vbS7RXRQ/yt_qs3vbS7RXRQ__sent000140.wav,/data/processed/segments/auto_20260615_101148/yt_qs3vbS7RXRQ/yt_qs3vbS7RXRQ__sent000140.txt,1357.42,1368.29,10.87,cáo đập bàn. Anh là đồ bất hiếu. Hôm ấy lệnh bỏ đi chẳng về ăn cơm trưa. Cơm chiều nữa. Bà Mải ngồi sụt xịt dưới bếp.,vtt,ready,aligned,https://www.youtube.com/watch?v=qs3vbS7RXRQ,Tuyển Tập Giọng Đọc Vàng của Đài Tiếng Nói Việt Nam - NSUT Kim Cúc - Đọc Truyện Đêm Khuya Hay Nhất
yt_qs3vbS7RXRQ,qs3vbS7RXRQ,yt_qs3vbS7RXRQ__sent000141,/data/processed/segments/auto_20260615_101148/yt_qs3vbS7RXRQ/yt_qs3vbS7RXRQ__sent000141.wav,/data/processed/segments/auto_20260615_101148/yt_qs3vbS7RXRQ/yt_qs3vbS7RXRQ__sent000141.txt,1368.088,1380.17,12.082,"Còn hai tiếng nữa là giờ khởi sự. Lão Lơ đứng ngồi không yên. Bọn thanh niên hơn chục đứa trong họ cơm no rượu say ngủ như chết. Thang dây chão, cưa dìu chất",vtt,ready,aligned,https://www.youtube.com/watch?v=qs3vbS7RXRQ,Tuyển Tập Giọng Đọc Vàng của Đài Tiếng Nói Việt Nam - NSUT Kim Cúc - Đọc Truyện Đêm Khuya Hay Nhất
yt_qs3vbS7RXRQ,qs3vbS7RXRQ,yt_qs3vbS7RXRQ__sent000142,/data/processed/segments/auto_20260615_101148/yt_qs3vbS7RXRQ/yt_qs3vbS7RXRQ__sent000142.wav,/data/processed/segments/auto_20260615_101148/yt_qs3vbS7RXRQ/yt_qs3vbS7RXRQ__sent000142.txt,1379.98,1382.369,2.389,đống ngoài sân.,vtt,ready,aligned,https://www.youtube.com/watch?v=qs3vbS7RXRQ,Tuyển Tập Giọng Đọc Vàng của Đài Tiếng Nói Việt Nam - NSUT Kim Cúc - Đọc Truyện Đêm Khuya Hay Nhất
yt_qs3vbS7RXRQ,qs3vbS7RXRQ,yt_qs3vbS7RXRQ__sent000143,/data/processed/segments/auto_20260615_101148/yt_qs3vbS7RXRQ/yt_qs3vbS7RXRQ__sent000143.wav,/data/processed/segments/auto_20260615_101148/yt_qs3vbS7RXRQ/yt_qs3vbS7RXRQ__sent000143.txt,1382.168,1388.889,6.721,"Trời rạng dần, bỗng có tiếng chó sủa gian từ ngoài xóm vào đến nhà lão Lơ.",vtt,ready,aligned,https://www.youtube.com/watch?v=qs3vbS7RXRQ,Tuyển Tập Giọng Đọc Vàng của Đài Tiếng Nói Việt Nam - NSUT Kim Cúc - Đọc Truyện Đêm Khuya Hay Nhất
yt_qs3vbS7RXRQ,qs3vbS7RXRQ,yt_qs3vbS7RXRQ__sent000144,/data/processed/segments/auto_20260615_101148/yt_qs3vbS7RXRQ/yt_qs3vbS7RXRQ__sent000144.wav,/data/processed/segments/auto_20260615_101148/yt_qs3vbS7RXRQ/yt_qs3vbS7RXRQ__sent000144.txt,1388.664,1397.129,8.465,"Một người trong họ xuất hiện, người ấy lắp bắp. Này ông Lơ, ra ngoài gò mà xem.",vtt,ready,aligned,https://www.youtube.com/watch?v=qs3vbS7RXRQ,Tuyển Tập Giọng Đọc Vàng của Đài Tiếng Nói Việt Nam - NSUT Kim Cúc - Đọc Truyện Đêm Khuya Hay Nhất
