audio_id,video_id,segment_id,segment_file,transcript_file,start,end,duration,text,transcript_source,transcript_status,vad_status,source_url,title
yt_qs3vbS7RXRQ,qs3vbS7RXRQ,yt_qs3vbS7RXRQ__sent000231,/data/processed/segments/auto_20260615_101148/yt_qs3vbS7RXRQ/yt_qs3vbS7RXRQ__sent000231.wav,/data/processed/segments/auto_20260615_101148/yt_qs3vbS7RXRQ/yt_qs3vbS7RXRQ__sent000231.txt,2257.82,2269.209,11.389,còn gì. Đổi mới có khác. Cái xóm venê heo hút ngày nào bây giờ nhà cửa đã chen nhau. Nhà ống cái cao cái thấp cái lồi cái thụt như hàm răng lộ xỉ khập kha,vtt,ready,aligned,https://www.youtube.com/watch?v=qs3vbS7RXRQ,Tuyển Tập Giọng Đọc Vàng của Đài Tiếng Nói Việt Nam - NSUT Kim Cúc - Đọc Truyện Đêm Khuya Hay Nhất
yt_qs3vbS7RXRQ,qs3vbS7RXRQ,yt_qs3vbS7RXRQ__sent000232,/data/processed/segments/auto_20260615_101148/yt_qs3vbS7RXRQ/yt_qs3vbS7RXRQ__sent000232.wav,/data/processed/segments/auto_20260615_101148/yt_qs3vbS7RXRQ/yt_qs3vbS7RXRQ__sent000232.txt,2269.019,2279.409,10.39,khập khễnh trông chẳng ra thế nào. Nếu mở được con đường thì mới có cơ mà chỉnh sửa cho nó ra hàng ra lối. Cả mộtn bãi,vtt,ready,aligned,https://www.youtube.com/watch?v=qs3vbS7RXRQ,Tuyển Tập Giọng Đọc Vàng của Đài Tiếng Nói Việt Nam - NSUT Kim Cúc - Đọc Truyện Đêm Khuya Hay Nhất
yt_qs3vbS7RXRQ,qs3vbS7RXRQ,yt_qs3vbS7RXRQ__sent000233,/data/processed/segments/auto_20260615_101148/yt_qs3vbS7RXRQ/yt_qs3vbS7RXRQ__sent000233.wav,/data/processed/segments/auto_20260615_101148/yt_qs3vbS7RXRQ/yt_qs3vbS7RXRQ__sent000233.txt,2279.219,2289.01,9.791,chỉ còn khu vườn nhà ông là chưa xây dựng gì. Một bờ rào bằng cây găng xanh tốt chạy dài mười mấy mét với một cái,vtt,ready,aligned,https://www.youtube.com/watch?v=qs3vbS7RXRQ,Tuyển Tập Giọng Đọc Vàng của Đài Tiếng Nói Việt Nam - NSUT Kim Cúc - Đọc Truyện Đêm Khuya Hay Nhất
yt_qs3vbS7RXRQ,qs3vbS7RXRQ,yt_qs3vbS7RXRQ__sent000234,/data/processed/segments/auto_20260615_101148/yt_qs3vbS7RXRQ/yt_qs3vbS7RXRQ__sent000234.wav,/data/processed/segments/auto_20260615_101148/yt_qs3vbS7RXRQ/yt_qs3vbS7RXRQ__sent000234.txt,2288.82,2300.77,11.95,cổng tre ngắt quãng cái vạn lý tượng rào xây vội như khiêu khích con mắt cúng vợ của bọn cò đất. Chúng nó đi qua đi lại xì sầm với nhau. Thế mà ông Sinh không,vtt,ready,aligned,https://www.youtube.com/watch?v=qs3vbS7RXRQ,Tuyển Tập Giọng Đọc Vàng của Đài Tiếng Nói Việt Nam - NSUT Kim Cúc - Đọc Truyện Đêm Khuya Hay Nhất
yt_qs3vbS7RXRQ,qs3vbS7RXRQ,yt_qs3vbS7RXRQ__sent000235,/data/processed/segments/auto_20260615_101148/yt_qs3vbS7RXRQ/yt_qs3vbS7RXRQ__sent000235.wav,/data/processed/segments/auto_20260615_101148/yt_qs3vbS7RXRQ/yt_qs3vbS7RXRQ__sent000235.txt,2300.58,2311.57,10.99,"hay biết gì cả. Đến cả chuyện mở đường ông có nghe nhưng cũng nghĩ là chuyện ở đâu đâu. Khi nghe nói có một cái mốc ở ngay giữa vườn, ông Sinh mới giật mình.",vtt,ready,aligned,https://www.youtube.com/watch?v=qs3vbS7RXRQ,Tuyển Tập Giọng Đọc Vàng của Đài Tiếng Nói Việt Nam - NSUT Kim Cúc - Đọc Truyện Đêm Khuya Hay Nhất
yt_qs3vbS7RXRQ,qs3vbS7RXRQ,yt_qs3vbS7RXRQ__sent000236,/data/processed/segments/auto_20260615_101148/yt_qs3vbS7RXRQ/yt_qs3vbS7RXRQ__sent000236.wav,/data/processed/segments/auto_20260615_101148/yt_qs3vbS7RXRQ/yt_qs3vbS7RXRQ__sent000236.txt,2311.38,2321.53,10.15,Thế thì đường ở ngay sát nhà mình rồi còn gì. Không phải sát nữa mà là chạy qua nhà ông đấy ạ. Anh cao gầy vừa dựng cái,vtt,ready,aligned,https://www.youtube.com/watch?v=qs3vbS7RXRQ,Tuyển Tập Giọng Đọc Vàng của Đài Tiếng Nói Việt Nam - NSUT Kim Cúc - Đọc Truyện Đêm Khuya Hay Nhất
yt_qs3vbS7RXRQ,qs3vbS7RXRQ,yt_qs3vbS7RXRQ__sent000237,/data/processed/segments/auto_20260615_101148/yt_qs3vbS7RXRQ/yt_qs3vbS7RXRQ__sent000237.wav,/data/processed/segments/auto_20260615_101148/yt_qs3vbS7RXRQ/yt_qs3vbS7RXRQ__sent000237.txt,2321.34,2328.13,6.79,"cọc tiêu vào gần chỗ chân cây hương vừa nói, ""Tim đường đâu như là ở đây này.""",vtt,ready,aligned,https://www.youtube.com/watch?v=qs3vbS7RXRQ,Tuyển Tập Giọng Đọc Vàng của Đài Tiếng Nói Việt Nam - NSUT Kim Cúc - Đọc Truyện Đêm Khuya Hay Nhất
yt_qs3vbS7RXRQ,qs3vbS7RXRQ,yt_qs3vbS7RXRQ__sent000238,/data/processed/segments/auto_20260615_101148/yt_qs3vbS7RXRQ/yt_qs3vbS7RXRQ__sent000238.wav,/data/processed/segments/auto_20260615_101148/yt_qs3vbS7RXRQ/yt_qs3vbS7RXRQ__sent000238.txt,2327.94,2330.689,2.749,Nói rồi anh ta quay sang anh lùn béo.,vtt,ready,aligned,https://www.youtube.com/watch?v=qs3vbS7RXRQ,Tuyển Tập Giọng Đọc Vàng của Đài Tiếng Nói Việt Nam - NSUT Kim Cúc - Đọc Truyện Đêm Khuya Hay Nhất
yt_qs3vbS7RXRQ,qs3vbS7RXRQ,yt_qs3vbS7RXRQ__sent000239,/data/processed/segments/auto_20260615_101148/yt_qs3vbS7RXRQ/yt_qs3vbS7RXRQ__sent000239.wav,/data/processed/segments/auto_20260615_101148/yt_qs3vbS7RXRQ/yt_qs3vbS7RXRQ__sent000239.txt,2330.499,2338.73,8.231,"""Cậu triển khai đo đạt đi xem nào."" Anh lùn béo ôm cái máy ngắm và cái đế ba chân lạch bạch đi ra cửa rồi đi tít ra",vtt,ready,aligned,https://www.youtube.com/watch?v=qs3vbS7RXRQ,Tuyển Tập Giọng Đọc Vàng của Đài Tiếng Nói Việt Nam - NSUT Kim Cúc - Đọc Truyện Đêm Khuya Hay Nhất
yt_qs3vbS7RXRQ,qs3vbS7RXRQ,yt_qs3vbS7RXRQ__sent000240,/data/processed/segments/auto_20260615_101148/yt_qs3vbS7RXRQ/yt_qs3vbS7RXRQ__sent000240.wav,/data/processed/segments/auto_20260615_101148/yt_qs3vbS7RXRQ/yt_qs3vbS7RXRQ__sent000240.txt,2338.54,2348.65,10.11,"xa cách cổng nhà phải đến 50 m và bắt đầu triển khai. Sau một hồi nhe nhe, nhắm nhắm, vẫy tay sang bên phải, vẫy",vtt,ready,aligned,https://www.youtube.com/watch?v=qs3vbS7RXRQ,Tuyển Tập Giọng Đọc Vàng của Đài Tiếng Nói Việt Nam - NSUT Kim Cúc - Đọc Truyện Đêm Khuya Hay Nhất
yt_qs3vbS7RXRQ,qs3vbS7RXRQ,yt_qs3vbS7RXRQ__sent000241,/data/processed/segments/auto_20260615_101148/yt_qs3vbS7RXRQ/yt_qs3vbS7RXRQ__sent000241.wav,/data/processed/segments/auto_20260615_101148/yt_qs3vbS7RXRQ/yt_qs3vbS7RXRQ__sent000241.txt,2348.46,2358.57,10.11,"tay sang bên trái, anh lùn béo kêu to, ""Được rồi."" Trong vườn anh cao gầy lấy một cái nêm gỗ có bô sơn đỏ đóng xuống",vtt,ready,aligned,https://www.youtube.com/watch?v=qs3vbS7RXRQ,Tuyển Tập Giọng Đọc Vàng của Đài Tiếng Nói Việt Nam - NSUT Kim Cúc - Đọc Truyện Đêm Khuya Hay Nhất
yt_qs3vbS7RXRQ,qs3vbS7RXRQ,yt_qs3vbS7RXRQ__sent000242,/data/processed/segments/auto_20260615_101148/yt_qs3vbS7RXRQ/yt_qs3vbS7RXRQ__sent000242.wav,/data/processed/segments/auto_20260615_101148/yt_qs3vbS7RXRQ/yt_qs3vbS7RXRQ__sent000242.txt,2358.38,2369.61,11.23,"chỗ vừa dựng cây cọc tiêu rồi nói, ""Xong rồi ông ạ, con cám ơn ông."" ""Đấy, tìm đường nó ở đây đấy ạ. Ông giữ nguyên cho",vtt,ready,aligned,https://www.youtube.com/watch?v=qs3vbS7RXRQ,Tuyển Tập Giọng Đọc Vàng của Đài Tiếng Nói Việt Nam - NSUT Kim Cúc - Đọc Truyện Đêm Khuya Hay Nhất
yt_qs3vbS7RXRQ,qs3vbS7RXRQ,yt_qs3vbS7RXRQ__sent000243,/data/processed/segments/auto_20260615_101148/yt_qs3vbS7RXRQ/yt_qs3vbS7RXRQ__sent000243.wav,/data/processed/segments/auto_20260615_101148/yt_qs3vbS7RXRQ/yt_qs3vbS7RXRQ__sent000243.txt,2369.42,2371.449,2.029,"chúng con ông nhé.""",vtt,ready,aligned,https://www.youtube.com/watch?v=qs3vbS7RXRQ,Tuyển Tập Giọng Đọc Vàng của Đài Tiếng Nói Việt Nam - NSUT Kim Cúc - Đọc Truyện Đêm Khuya Hay Nhất
yt_qs3vbS7RXRQ,qs3vbS7RXRQ,yt_qs3vbS7RXRQ__sent000244,/data/processed/segments/auto_20260615_101148/yt_qs3vbS7RXRQ/yt_qs3vbS7RXRQ__sent000244.wav,/data/processed/segments/auto_20260615_101148/yt_qs3vbS7RXRQ/yt_qs3vbS7RXRQ__sent000244.txt,2371.16,2376.61,5.45,Nói xong vác cái cọc tiêu ôm cái túi bạt chuồn mất.,vtt,ready,aligned,https://www.youtube.com/watch?v=qs3vbS7RXRQ,Tuyển Tập Giọng Đọc Vàng của Đài Tiếng Nói Việt Nam - NSUT Kim Cúc - Đọc Truyện Đêm Khuya Hay Nhất
yt_qs3vbS7RXRQ,qs3vbS7RXRQ,yt_qs3vbS7RXRQ__sent000245,/data/processed/segments/auto_20260615_101148/yt_qs3vbS7RXRQ/yt_qs3vbS7RXRQ__sent000245.wav,/data/processed/segments/auto_20260615_101148/yt_qs3vbS7RXRQ/yt_qs3vbS7RXRQ__sent000245.txt,2376.216,2388.169,11.953,Ông sinh ra khét khổng rồi quay lại cái chỗ mốc giới nó chỉ cách chân cây hương đâu hơn mét. Lạ nhỉ? Sao lại làm đường vào tận đây thế này? Ông nghĩ chắc bọn,vtt,ready,aligned,https://www.youtube.com/watch?v=qs3vbS7RXRQ,Tuyển Tập Giọng Đọc Vàng của Đài Tiếng Nói Việt Nam - NSUT Kim Cúc - Đọc Truyện Đêm Khuya Hay Nhất
yt_qs3vbS7RXRQ,qs3vbS7RXRQ,yt_qs3vbS7RXRQ__sent000246,/data/processed/segments/auto_20260615_101148/yt_qs3vbS7RXRQ/yt_qs3vbS7RXRQ__sent000246.wav,/data/processed/segments/auto_20260615_101148/yt_qs3vbS7RXRQ/yt_qs3vbS7RXRQ__sent000246.txt,2387.979,2391.65,3.671,này nhầm lẫn thế nào đây. Thôi kệ nó.,vtt,ready,aligned,https://www.youtube.com/watch?v=qs3vbS7RXRQ,Tuyển Tập Giọng Đọc Vàng của Đài Tiếng Nói Việt Nam - NSUT Kim Cúc - Đọc Truyện Đêm Khuya Hay Nhất
yt_qs3vbS7RXRQ,qs3vbS7RXRQ,yt_qs3vbS7RXRQ__sent000247,/data/processed/segments/auto_20260615_101148/yt_qs3vbS7RXRQ/yt_qs3vbS7RXRQ__sent000247.wav,/data/processed/segments/auto_20260615_101148/yt_qs3vbS7RXRQ/yt_qs3vbS7RXRQ__sent000247.txt,2391.46,2403.298,11.838,Đường xá phải có thiết kế đàng hoàng chứ. Cả khi đã được phê duyệt 10 năm sau chắc gì đã có đường. Ông còn lạ gì cái cách quy hoạch quy hiếc ở cái đất này,vtt,ready,aligned,https://www.youtube.com/watch?v=qs3vbS7RXRQ,Tuyển Tập Giọng Đọc Vàng của Đài Tiếng Nói Việt Nam - NSUT Kim Cúc - Đọc Truyện Đêm Khuya Hay Nhất
yt_qs3vbS7RXRQ,qs3vbS7RXRQ,yt_qs3vbS7RXRQ__sent000248,/data/processed/segments/auto_20260615_101148/yt_qs3vbS7RXRQ/yt_qs3vbS7RXRQ__sent000248.wav,/data/processed/segments/auto_20260615_101148/yt_qs3vbS7RXRQ/yt_qs3vbS7RXRQ__sent000248.txt,2402.979,2413.409,10.43,nữa. Thế rồi ông cũng quên luôn chuyện cái móc giới còn đã mọc lên che kín cái nêm gỗ đất bãi mà cắm cây gì xuống cũng,vtt,ready,aligned,https://www.youtube.com/watch?v=qs3vbS7RXRQ,Tuyển Tập Giọng Đọc Vàng của Đài Tiếng Nói Việt Nam - NSUT Kim Cúc - Đọc Truyện Đêm Khuya Hay Nhất
yt_qs3vbS7RXRQ,qs3vbS7RXRQ,yt_qs3vbS7RXRQ__sent000249,/data/processed/segments/auto_20260615_101148/yt_qs3vbS7RXRQ/yt_qs3vbS7RXRQ__sent000249.wav,/data/processed/segments/auto_20260615_101148/yt_qs3vbS7RXRQ/yt_qs3vbS7RXRQ__sent000249.txt,2413.219,2423.85,10.631,mọc lên xanh tốt. Vài hôm nữa có khi cái nêm gỗ mọc mầm cũng lên. Ông Sinh đã bắt đầu vặt lá đào tính toán hãm thế nào cho,vtt,ready,aligned,https://www.youtube.com/watch?v=qs3vbS7RXRQ,Tuyển Tập Giọng Đọc Vàng của Đài Tiếng Nói Việt Nam - NSUT Kim Cúc - Đọc Truyện Đêm Khuya Hay Nhất
yt_qs3vbS7RXRQ,qs3vbS7RXRQ,yt_qs3vbS7RXRQ__sent000250,/data/processed/segments/auto_20260615_101148/yt_qs3vbS7RXRQ/yt_qs3vbS7RXRQ__sent000250.wav,/data/processed/segments/auto_20260615_101148/yt_qs3vbS7RXRQ/yt_qs3vbS7RXRQ__sent000250.txt,2423.66,2434.85,11.19,kịp nở và dịp Tết. Năm nào tết đến ông cũng cắt mấy cành. cắm lên ban thờ cây hương biếu mấy ông đồng đội cũ nhà thông,vtt,ready,aligned,https://www.youtube.com/watch?v=qs3vbS7RXRQ,Tuyển Tập Giọng Đọc Vàng của Đài Tiếng Nói Việt Nam - NSUT Kim Cúc - Đọc Truyện Đêm Khuya Hay Nhất
yt_qs3vbS7RXRQ,qs3vbS7RXRQ,yt_qs3vbS7RXRQ__sent000251,/data/processed/segments/auto_20260615_101148/yt_qs3vbS7RXRQ/yt_qs3vbS7RXRQ__sent000251.wav,/data/processed/segments/auto_20260615_101148/yt_qs3vbS7RXRQ/yt_qs3vbS7RXRQ__sent000251.txt,2434.66,2446.33,11.67,gia năm nào ông cũng háo hức đảo quất hãm đào gầy thược dược cũng là vui thú tuổi giả nhưng người ta không để cho ông yên,vtt,ready,aligned,https://www.youtube.com/watch?v=qs3vbS7RXRQ,Tuyển Tập Giọng Đọc Vàng của Đài Tiếng Nói Việt Nam - NSUT Kim Cúc - Đọc Truyện Đêm Khuya Hay Nhất
yt_qs3vbS7RXRQ,qs3vbS7RXRQ,yt_qs3vbS7RXRQ__sent000252,/data/processed/segments/auto_20260615_101148/yt_qs3vbS7RXRQ/yt_qs3vbS7RXRQ__sent000252.wav,/data/processed/segments/auto_20260615_101148/yt_qs3vbS7RXRQ/yt_qs3vbS7RXRQ__sent000252.txt,2446.14,2455.73,9.59,thân lại có tiếng đập cửa lại anh cao gầy và anh lùn béo lần này không trắc địa công trình nữa mà trình hẳn bản,vtt,ready,aligned,https://www.youtube.com/watch?v=qs3vbS7RXRQ,Tuyển Tập Giọng Đọc Vàng của Đài Tiếng Nói Việt Nam - NSUT Kim Cúc - Đọc Truyện Đêm Khuya Hay Nhất
yt_qs3vbS7RXRQ,qs3vbS7RXRQ,yt_qs3vbS7RXRQ__sent000253,/data/processed/segments/auto_20260615_101148/yt_qs3vbS7RXRQ/yt_qs3vbS7RXRQ__sent000253.wav,/data/processed/segments/auto_20260615_101148/yt_qs3vbS7RXRQ/yt_qs3vbS7RXRQ__sent000253.txt,2455.54,2465.33,9.79,thiết kế anh cao gầy lục lọ cái cạp giả ra rồi kéo ra một tập giấy đặt trước mặt ông Sinh. Ông đi tìm cái kính lão rồi,vtt,ready,aligned,https://www.youtube.com/watch?v=qs3vbS7RXRQ,Tuyển Tập Giọng Đọc Vàng của Đài Tiếng Nói Việt Nam - NSUT Kim Cúc - Đọc Truyện Đêm Khuya Hay Nhất
yt_qs3vbS7RXRQ,qs3vbS7RXRQ,yt_qs3vbS7RXRQ__sent000254,/data/processed/segments/auto_20260615_101148/yt_qs3vbS7RXRQ/yt_qs3vbS7RXRQ__sent000254.wav,/data/processed/segments/auto_20260615_101148/yt_qs3vbS7RXRQ/yt_qs3vbS7RXRQ__sent000254.txt,2465.14,2475.77,10.63,ngó nghiêng vào tờ giấy chẳng thấy gì ngoài mấy nét dọc ngang và một con dấu đỏ chóét ở phía dưới. Đây nhá. Anh cao gầy thuyết minh,vtt,ready,aligned,https://www.youtube.com/watch?v=qs3vbS7RXRQ,Tuyển Tập Giọng Đọc Vàng của Đài Tiếng Nói Việt Nam - NSUT Kim Cúc - Đọc Truyện Đêm Khuya Hay Nhất
yt_qs3vbS7RXRQ,qs3vbS7RXRQ,yt_qs3vbS7RXRQ__sent000255,/data/processed/segments/auto_20260615_101148/yt_qs3vbS7RXRQ/yt_qs3vbS7RXRQ__sent000255.wav,/data/processed/segments/auto_20260615_101148/yt_qs3vbS7RXRQ/yt_qs3vbS7RXRQ__sent000255.txt,2475.58,2479.05,3.47,cái giải tô đậm này là con đường sắp mở.,vtt,ready,aligned,https://www.youtube.com/watch?v=qs3vbS7RXRQ,Tuyển Tập Giọng Đọc Vàng của Đài Tiếng Nói Việt Nam - NSUT Kim Cúc - Đọc Truyện Đêm Khuya Hay Nhất
yt_qs3vbS7RXRQ,qs3vbS7RXRQ,yt_qs3vbS7RXRQ__sent000256,/data/processed/segments/auto_20260615_101148/yt_qs3vbS7RXRQ/yt_qs3vbS7RXRQ__sent000256.wav,/data/processed/segments/auto_20260615_101148/yt_qs3vbS7RXRQ/yt_qs3vbS7RXRQ__sent000256.txt,2478.86,2489.65,10.79,Cái ô vuông vuông này là khu vườn nhà ta. Chấm đỏ này là cái mốc giới mà bọn con cắm hôm trước. Ông thấy không? Nhà mình chỉ còn lại một tí tẹo này nữa,vtt,ready,aligned,https://www.youtube.com/watch?v=qs3vbS7RXRQ,Tuyển Tập Giọng Đọc Vàng của Đài Tiếng Nói Việt Nam - NSUT Kim Cúc - Đọc Truyện Đêm Khuya Hay Nhất
yt_qs3vbS7RXRQ,qs3vbS7RXRQ,yt_qs3vbS7RXRQ__sent000257,/data/processed/segments/auto_20260615_101148/yt_qs3vbS7RXRQ/yt_qs3vbS7RXRQ__sent000257.wav,/data/processed/segments/auto_20260615_101148/yt_qs3vbS7RXRQ/yt_qs3vbS7RXRQ__sent000257.txt,2489.46,2491.37,1.91,thôi.,vtt,ready,aligned,https://www.youtube.com/watch?v=qs3vbS7RXRQ,Tuyển Tập Giọng Đọc Vàng của Đài Tiếng Nói Việt Nam - NSUT Kim Cúc - Đọc Truyện Đêm Khuya Hay Nhất
yt_qs3vbS7RXRQ,qs3vbS7RXRQ,yt_qs3vbS7RXRQ__sent000258,/data/processed/segments/auto_20260615_101148/yt_qs3vbS7RXRQ/yt_qs3vbS7RXRQ__sent000258.wav,/data/processed/segments/auto_20260615_101148/yt_qs3vbS7RXRQ/yt_qs3vbS7RXRQ__sent000258.txt,2491.096,2499.37,8.274,Ông XH nhìn kỹ vào chỗ ngón tay anh cao gầy đang chỉ trên tờ giấy thấy một cái tam giác dính vào một cái dài tô đậm.,vtt,ready,aligned,https://www.youtube.com/watch?v=qs3vbS7RXRQ,Tuyển Tập Giọng Đọc Vàng của Đài Tiếng Nói Việt Nam - NSUT Kim Cúc - Đọc Truyện Đêm Khuya Hay Nhất
yt_qs3vbS7RXRQ,qs3vbS7RXRQ,yt_qs3vbS7RXRQ__sent000259,/data/processed/segments/auto_20260615_101148/yt_qs3vbS7RXRQ/yt_qs3vbS7RXRQ__sent000259.wav,/data/processed/segments/auto_20260615_101148/yt_qs3vbS7RXRQ/yt_qs3vbS7RXRQ__sent000259.txt,2499.18,2508.73,9.55,Rồi ông gật gật đầu ra giấu rằng đã hiểu. Anh cao gầy nói khẽ như sợ ai đó nghe trộm. Con biết đất nhà mình chưa đủ,vtt,ready,aligned,https://www.youtube.com/watch?v=qs3vbS7RXRQ,Tuyển Tập Giọng Đọc Vàng của Đài Tiếng Nói Việt Nam - NSUT Kim Cúc - Đọc Truyện Đêm Khuya Hay Nhất
yt_qs3vbS7RXRQ,qs3vbS7RXRQ,yt_qs3vbS7RXRQ__sent000260,/data/processed/segments/auto_20260615_101148/yt_qs3vbS7RXRQ/yt_qs3vbS7RXRQ__sent000260.wav,/data/processed/segments/auto_20260615_101148/yt_qs3vbS7RXRQ/yt_qs3vbS7RXRQ__sent000260.txt,2508.54,2519.29,10.75,giấy tờ. Hồi ông ra đây lập vườn có xin phép ai đâu. Đến khi tính chuyện đền bù là phiền lắm đấy. Con nghĩ là ông nên sang nhượng cho người có thế lực để,vtt,ready,aligned,https://www.youtube.com/watch?v=qs3vbS7RXRQ,Tuyển Tập Giọng Đọc Vàng của Đài Tiếng Nói Việt Nam - NSUT Kim Cúc - Đọc Truyện Đêm Khuya Hay Nhất
yt_qs3vbS7RXRQ,qs3vbS7RXRQ,yt_qs3vbS7RXRQ__sent000261,/data/processed/segments/auto_20260615_101148/yt_qs3vbS7RXRQ/yt_qs3vbS7RXRQ__sent000261.wav,/data/processed/segments/auto_20260615_101148/yt_qs3vbS7RXRQ/yt_qs3vbS7RXRQ__sent000261.txt,2519.1,2530.33,11.23,"người ta chạy chọt giấy má, thương lượng với nhà đầu tư. Có tuổi rồi đổi sang nhà chung cư mà ở cho tiện ông ạ. Còn đồng nào thì để dưỡng già. Ông giải quyết",vtt,ready,aligned,https://www.youtube.com/watch?v=qs3vbS7RXRQ,Tuyển Tập Giọng Đọc Vàng của Đài Tiếng Nói Việt Nam - NSUT Kim Cúc - Đọc Truyện Đêm Khuya Hay Nhất
yt_qs3vbS7RXRQ,qs3vbS7RXRQ,yt_qs3vbS7RXRQ__sent000262,/data/processed/segments/auto_20260615_101148/yt_qs3vbS7RXRQ/yt_qs3vbS7RXRQ__sent000262.wav,/data/processed/segments/auto_20260615_101148/yt_qs3vbS7RXRQ/yt_qs3vbS7RXRQ__sent000262.txt,2530.14,2535.25,5.11,nhanh nhanh. Sắp giải phóng mặt bằng rồi đấy ông ạ.,vtt,ready,aligned,https://www.youtube.com/watch?v=qs3vbS7RXRQ,Tuyển Tập Giọng Đọc Vàng của Đài Tiếng Nói Việt Nam - NSUT Kim Cúc - Đọc Truyện Đêm Khuya Hay Nhất
yt_qs3vbS7RXRQ,qs3vbS7RXRQ,yt_qs3vbS7RXRQ__sent000263,/data/processed/segments/auto_20260615_101148/yt_qs3vbS7RXRQ/yt_qs3vbS7RXRQ__sent000263.wav,/data/processed/segments/auto_20260615_101148/yt_qs3vbS7RXRQ/yt_qs3vbS7RXRQ__sent000263.txt,2535.06,2544.649,9.589,"Chờ cho hai ông công sai đi khuất, ông Sinh mới vò đầu suy nghĩ, cứ tưởng là nó chỉ nói thế rồi thôi, ngồi đâu đã có",vtt,ready,aligned,https://www.youtube.com/watch?v=qs3vbS7RXRQ,Tuyển Tập Giọng Đọc Vàng của Đài Tiếng Nói Việt Nam - NSUT Kim Cúc - Đọc Truyện Đêm Khuya Hay Nhất
yt_qs3vbS7RXRQ,qs3vbS7RXRQ,yt_qs3vbS7RXRQ__sent000264,/data/processed/segments/auto_20260615_101148/yt_qs3vbS7RXRQ/yt_qs3vbS7RXRQ__sent000264.wav,/data/processed/segments/auto_20260615_101148/yt_qs3vbS7RXRQ/yt_qs3vbS7RXRQ__sent000264.txt,2544.459,2556.13,11.671,"thiết kế chi tiết, dấu má rõ ràng, thế thì còn biết làm sao đây? Không biết anh nào lại kẻ thẳng con đường và chính giữa nhà ông thế này lệch đi một chút không",vtt,ready,aligned,https://www.youtube.com/watch?v=qs3vbS7RXRQ,Tuyển Tập Giọng Đọc Vàng của Đài Tiếng Nói Việt Nam - NSUT Kim Cúc - Đọc Truyện Đêm Khuya Hay Nhất
yt_qs3vbS7RXRQ,qs3vbS7RXRQ,yt_qs3vbS7RXRQ__sent000265,/data/processed/segments/auto_20260615_101148/yt_qs3vbS7RXRQ/yt_qs3vbS7RXRQ__sent000265.wav,/data/processed/segments/auto_20260615_101148/yt_qs3vbS7RXRQ/yt_qs3vbS7RXRQ__sent000265.txt,2555.94,2557.649,1.709,được à?,vtt,ready,aligned,https://www.youtube.com/watch?v=qs3vbS7RXRQ,Tuyển Tập Giọng Đọc Vàng của Đài Tiếng Nói Việt Nam - NSUT Kim Cúc - Đọc Truyện Đêm Khuya Hay Nhất
yt_qs3vbS7RXRQ,qs3vbS7RXRQ,yt_qs3vbS7RXRQ__sent000266,/data/processed/segments/auto_20260615_101148/yt_qs3vbS7RXRQ/yt_qs3vbS7RXRQ__sent000266.wav,/data/processed/segments/auto_20260615_101148/yt_qs3vbS7RXRQ/yt_qs3vbS7RXRQ__sent000266.txt,2557.432,2569.409,11.977,Nhưng nói là nói thế thôi chứ bao năm nay ông đã quen chấp hành mọi loại giấy tờ có dấu đỏ. Ông biết rằng lần này ông cũng không thể nào cưỡng lại. May mắn,vtt,ready,aligned,https://www.youtube.com/watch?v=qs3vbS7RXRQ,Tuyển Tập Giọng Đọc Vàng của Đài Tiếng Nói Việt Nam - NSUT Kim Cúc - Đọc Truyện Đêm Khuya Hay Nhất
yt_qs3vbS7RXRQ,qs3vbS7RXRQ,yt_qs3vbS7RXRQ__sent000267,/data/processed/segments/auto_20260615_101148/yt_qs3vbS7RXRQ/yt_qs3vbS7RXRQ__sent000267.wav,/data/processed/segments/auto_20260615_101148/yt_qs3vbS7RXRQ/yt_qs3vbS7RXRQ__sent000267.txt,2569.219,2578.29,9.071,thay cho những chính thể có được những thần dân như ông Sinh suốt đời trung thành và tin tưởng. Thử hỏi làm việc gì,vtt,ready,aligned,https://www.youtube.com/watch?v=qs3vbS7RXRQ,Tuyển Tập Giọng Đọc Vàng của Đài Tiếng Nói Việt Nam - NSUT Kim Cúc - Đọc Truyện Đêm Khuya Hay Nhất
yt_qs3vbS7RXRQ,qs3vbS7RXRQ,yt_qs3vbS7RXRQ__sent000268,/data/processed/segments/auto_20260615_101148/yt_qs3vbS7RXRQ/yt_qs3vbS7RXRQ__sent000268.wav,/data/processed/segments/auto_20260615_101148/yt_qs3vbS7RXRQ/yt_qs3vbS7RXRQ__sent000268.txt,2578.1,2587.57,9.47,mà chẳng thành công. Nhưng cũng đáng sợ thay khi lòng tin của những người như ông Sinh bị đánh cắp.,vtt,ready,aligned,https://www.youtube.com/watch?v=qs3vbS7RXRQ,Tuyển Tập Giọng Đọc Vàng của Đài Tiếng Nói Việt Nam - NSUT Kim Cúc - Đọc Truyện Đêm Khuya Hay Nhất
yt_qs3vbS7RXRQ,qs3vbS7RXRQ,yt_qs3vbS7RXRQ__sent000269,/data/processed/segments/auto_20260615_101148/yt_qs3vbS7RXRQ/yt_qs3vbS7RXRQ__sent000269.wav,/data/processed/segments/auto_20260615_101148/yt_qs3vbS7RXRQ/yt_qs3vbS7RXRQ__sent000269.txt,2587.128,2598.77,11.642,trước sau thì cũng phải từ giã mảnh vườn của mình. Ông Sinh suy đi tính lại sau nhiều đêm thao thức. Mò sang mấy nhà hàng xóm lân cận dò hỏi thì họ kể y,vtt,ready,aligned,https://www.youtube.com/watch?v=qs3vbS7RXRQ,Tuyển Tập Giọng Đọc Vàng của Đài Tiếng Nói Việt Nam - NSUT Kim Cúc - Đọc Truyện Đêm Khuya Hay Nhất
yt_qs3vbS7RXRQ,qs3vbS7RXRQ,yt_qs3vbS7RXRQ__sent000270,/data/processed/segments/auto_20260615_101148/yt_qs3vbS7RXRQ/yt_qs3vbS7RXRQ__sent000270.wav,/data/processed/segments/auto_20260615_101148/yt_qs3vbS7RXRQ/yt_qs3vbS7RXRQ__sent000270.txt,2598.58,2609.61,11.03,trang chuyện nhà ông. Nghĩa là cũng anh cao gầy anh lùn béo cũng trác địa công trình cũng bàn thiết kế với giải tô đậm tô nhạt. Cuối cùng cực chẳng đã đành,vtt,ready,aligned,https://www.youtube.com/watch?v=qs3vbS7RXRQ,Tuyển Tập Giọng Đọc Vàng của Đài Tiếng Nói Việt Nam - NSUT Kim Cúc - Đọc Truyện Đêm Khuya Hay Nhất
yt_qs3vbS7RXRQ,qs3vbS7RXRQ,yt_qs3vbS7RXRQ__sent000271,/data/processed/segments/auto_20260615_101148/yt_qs3vbS7RXRQ/yt_qs3vbS7RXRQ__sent000271.wav,/data/processed/segments/auto_20260615_101148/yt_qs3vbS7RXRQ/yt_qs3vbS7RXRQ__sent000271.txt,2609.42,2619.73,10.31,"phải làm theo cách mà anh cao gầy đã mách nhỏ. Hôm chuyển nhà, ông thắp nhang rồi đứng rất lâu trước cây hương. Mái",vtt,ready,aligned,https://www.youtube.com/watch?v=qs3vbS7RXRQ,Tuyển Tập Giọng Đọc Vàng của Đài Tiếng Nói Việt Nam - NSUT Kim Cúc - Đọc Truyện Đêm Khuya Hay Nhất
yt_qs3vbS7RXRQ,qs3vbS7RXRQ,yt_qs3vbS7RXRQ__sent000272,/data/processed/segments/auto_20260615_101148/yt_qs3vbS7RXRQ/yt_qs3vbS7RXRQ__sent000272.wav,/data/processed/segments/auto_20260615_101148/yt_qs3vbS7RXRQ/yt_qs3vbS7RXRQ__sent000272.txt,2619.54,2629.25,9.71,"đầu bạc trắng lặng cúi trong hương khói, tuổi già hạt lệ như sương. Những giọt nước mắt hiếm hoi ứa ra nơi khóe mắt",vtt,ready,aligned,https://www.youtube.com/watch?v=qs3vbS7RXRQ,Tuyển Tập Giọng Đọc Vàng của Đài Tiếng Nói Việt Nam - NSUT Kim Cúc - Đọc Truyện Đêm Khuya Hay Nhất
yt_qs3vbS7RXRQ,qs3vbS7RXRQ,yt_qs3vbS7RXRQ__sent000273,/data/processed/segments/auto_20260615_101148/yt_qs3vbS7RXRQ/yt_qs3vbS7RXRQ__sent000273.wav,/data/processed/segments/auto_20260615_101148/yt_qs3vbS7RXRQ/yt_qs3vbS7RXRQ__sent000273.txt,2629.06,2633.209,4.149,trên gương mặt già nua sầu não.,vtt,ready,aligned,https://www.youtube.com/watch?v=qs3vbS7RXRQ,Tuyển Tập Giọng Đọc Vàng của Đài Tiếng Nói Việt Nam - NSUT Kim Cúc - Đọc Truyện Đêm Khuya Hay Nhất
