audio_id,video_id,segment_id,segment_file,transcript_file,start,end,duration,text,transcript_source,transcript_status,vad_status,quality_label,quality_score,quality_reasons,source_url,title
yt_gtLl7pqVgGs,gtLl7pqVgGs,yt_gtLl7pqVgGs__sent000097,/data/processed/segments/auto_20260624_080605/yt_gtLl7pqVgGs/yt_gtLl7pqVgGs__sent000097.wav,/data/processed/segments/auto_20260624_080605/yt_gtLl7pqVgGs/yt_gtLl7pqVgGs__sent000097.txt,1156.0,1170.99,14.99,tìm kiếm quy tập và xác định danh tính hài cốt liệt sĩ do chính phủ Việt Nam phát động. Rõ ràng đây là một cuộc đối thoại cực kỳ xong phẳng của những đối tác ngang hàng. Chúng ta sẵn sàng chìa tay giúp bạn giải quyết nỗi đau của họ nhưng họ cũng phải có trách nhiệm xoa dịu những vết thương còn rỉ máu trên đất nước chúng ta. Hợp tác quốc phòng Việt,vtt,ready,aligned,speech_clean,1.0,,https://www.youtube.com/watch?v=gtLl7pqVgGs,"HÙNG CAO - Quyền Bộ trưởng Hải quân Hoa Kỳ đến Quảng Trị nói: ""Hiểu hơn ai hết NỖI ĐAU CHIẾN TRANH"""
yt_gtLl7pqVgGs,gtLl7pqVgGs,yt_gtLl7pqVgGs__sent000098,/data/processed/segments/auto_20260624_080605/yt_gtLl7pqVgGs/yt_gtLl7pqVgGs__sent000098.wav,/data/processed/segments/auto_20260624_080605/yt_gtLl7pqVgGs/yt_gtLl7pqVgGs__sent000098.txt,1169.24,1182.87,13.63,trên đất nước chúng ta. Hợp tác quốc phòng Việt Nam Hoa Kỳ thời gian qua được đánh giá là hiệu quả thiết thực trải dài từ đào tạo quân y cho đến cứu trợ thảm họa. Đặc biệt trong bối cảnh tình hình địa chính trị trên thế giới có nhiều bi động. Việc quyền Bộ trưởng Hùng Cao nhấn mạnh mong muốn thúc đẩy hợp tác sâu sắc trong lĩnh,vtt,ready,aligned,speech_clean,1.0,,https://www.youtube.com/watch?v=gtLl7pqVgGs,"HÙNG CAO - Quyền Bộ trưởng Hải quân Hoa Kỳ đến Quảng Trị nói: ""Hiểu hơn ai hết NỖI ĐAU CHIẾN TRANH"""
yt_gtLl7pqVgGs,gtLl7pqVgGs,yt_gtLl7pqVgGs__sent000099,/data/processed/segments/auto_20260624_080605/yt_gtLl7pqVgGs/yt_gtLl7pqVgGs__sent000099.wav,/data/processed/segments/auto_20260624_080605/yt_gtLl7pqVgGs/yt_gtLl7pqVgGs__sent000099.txt,1181.16,1194.87,13.71,mong muốn thúc đẩy hợp tác sâu sắc trong lĩnh vực an ninh biển và hàng hải đã cho thấy tầm quan trọng chiến lược vùng biển Việt Nam. duy trì một vùng biển hòa bình ổn định và tự do hàng hải chính là quyền lợi cốt lõi để bảo vệ không gian sinh tồn của đất nước. Một điểm vô cùng sâu,vtt,ready,aligned,speech_clean,1.0,,https://www.youtube.com/watch?v=gtLl7pqVgGs,"HÙNG CAO - Quyền Bộ trưởng Hải quân Hoa Kỳ đến Quảng Trị nói: ""Hiểu hơn ai hết NỖI ĐAU CHIẾN TRANH"""
yt_gtLl7pqVgGs,gtLl7pqVgGs,yt_gtLl7pqVgGs__sent000100,/data/processed/segments/auto_20260624_080605/yt_gtLl7pqVgGs/yt_gtLl7pqVgGs__sent000100.wav,/data/processed/segments/auto_20260624_080605/yt_gtLl7pqVgGs/yt_gtLl7pqVgGs__sent000100.txt,1192.44,1206.029,13.589,sinh tồn của đất nước. Một điểm vô cùng sâu sắc thể hiện tầm nhìn tự chủ của chúng ta là việc đại tướng Phan Văn Giàng hoan nghênh Hoa Kỳ cử quan chức và các doanh nghiệp quốc phòng sang tham dự trưng bày sản phẩm tại triển lãm quốc phòng quốc tế Việt Nam lần thứ ba vào tháng 12 năm,vtt,ready,aligned,speech_clean,1.0,,https://www.youtube.com/watch?v=gtLl7pqVgGs,"HÙNG CAO - Quyền Bộ trưởng Hải quân Hoa Kỳ đến Quảng Trị nói: ""Hiểu hơn ai hết NỖI ĐAU CHIẾN TRANH"""
yt_gtLl7pqVgGs,gtLl7pqVgGs,yt_gtLl7pqVgGs__sent000101,/data/processed/segments/auto_20260624_080605/yt_gtLl7pqVgGs/yt_gtLl7pqVgGs__sent000101.wav,/data/processed/segments/auto_20260624_080605/yt_gtLl7pqVgGs/yt_gtLl7pqVgGs__sent000101.txt,1203.56,1218.71,15.15,quốc tế Việt Nam lần thứ ba vào tháng 12 năm 2026 tại Hà Nội. Đạo tế này là lời khẳng định đánh thép cho trường phái ngoại giao cây tre Việt Nam. Chúng ta đa phương hóa mối quan hệ không chọn bên nhưng sẵn sàng tiếp cận giao lưu với các nền công nghệ tiên tiến nhất. Muốn hòa bình bản thân phải mạnh. Việc mở cửa cho,vtt,ready,aligned,speech_clean,1.0,,https://www.youtube.com/watch?v=gtLl7pqVgGs,"HÙNG CAO - Quyền Bộ trưởng Hải quân Hoa Kỳ đến Quảng Trị nói: ""Hiểu hơn ai hết NỖI ĐAU CHIẾN TRANH"""
yt_gtLl7pqVgGs,gtLl7pqVgGs,yt_gtLl7pqVgGs__sent000102,/data/processed/segments/auto_20260624_080605/yt_gtLl7pqVgGs/yt_gtLl7pqVgGs__sent000102.wav,/data/processed/segments/auto_20260624_080605/yt_gtLl7pqVgGs/yt_gtLl7pqVgGs__sent000102.txt,1216.719,1231.87,15.151,"hòa bình bản thân phải mạnh. Việc mở cửa cho các tập đoàn quốc phòng lớn đến Việt Nam vừa thúc đẩy công nghiệp quốc phòng nội địa phát triển vừa tạo ra thế cân bằng chiến lược để bảo vệ Tổ quốc từ sớm từ xa. Người Việt mình lại có câu muốn đi nhanh thì đi một mình, muốn đi xa thì đi cùng nhau. Trong bối cảnh thế giới đang",vtt,ready,aligned,speech_clean,1.0,,https://www.youtube.com/watch?v=gtLl7pqVgGs,"HÙNG CAO - Quyền Bộ trưởng Hải quân Hoa Kỳ đến Quảng Trị nói: ""Hiểu hơn ai hết NỖI ĐAU CHIẾN TRANH"""
yt_gtLl7pqVgGs,gtLl7pqVgGs,yt_gtLl7pqVgGs__sent000103,/data/processed/segments/auto_20260624_080605/yt_gtLl7pqVgGs/yt_gtLl7pqVgGs__sent000103.wav,/data/processed/segments/auto_20260624_080605/yt_gtLl7pqVgGs/yt_gtLl7pqVgGs__sent000103.txt,1229.64,1243.95,14.31,"thì đi cùng nhau. Trong bối cảnh thế giới đang có nhiều biến động, những cuộc gặp mang tinh thần đối thoại, hợp tác và thiện trí như vậy luôn là điều đáng được ghi nhận. Đặc biệt, việc lãnh đạo cấp cao nhất của Việt Nam dành sự tiếp đón trang trọng đối với Hùng Cao còn cho thấy Việt Nam luôn nhất quán trong chính sách đối",vtt,ready,aligned,speech_clean,1.0,,https://www.youtube.com/watch?v=gtLl7pqVgGs,"HÙNG CAO - Quyền Bộ trưởng Hải quân Hoa Kỳ đến Quảng Trị nói: ""Hiểu hơn ai hết NỖI ĐAU CHIẾN TRANH"""
yt_gtLl7pqVgGs,gtLl7pqVgGs,yt_gtLl7pqVgGs__sent000104,/data/processed/segments/auto_20260624_080605/yt_gtLl7pqVgGs/yt_gtLl7pqVgGs__sent000104.wav,/data/processed/segments/auto_20260624_080605/yt_gtLl7pqVgGs/yt_gtLl7pqVgGs__sent000104.txt,1241.8,1255.07,13.27,"Việt Nam luôn nhất quán trong chính sách đối ngoại độc lập, tự chủ, đa phương hóa, đa dạng hóa, quan hệ quốc tế, coi trọng quan hệ với Hoa Kỳ trên cơ sở tôn trọng lẫn nhau, bình đẳng và cùng có lợi. Có thể nói hình ảnh Tổng Bí thư Chủ tịch nước Tô Lâm hay Bộ trưởng Bộ Quốc phòng",vtt,ready,aligned,speech_clean,1.0,,https://www.youtube.com/watch?v=gtLl7pqVgGs,"HÙNG CAO - Quyền Bộ trưởng Hải quân Hoa Kỳ đến Quảng Trị nói: ""Hiểu hơn ai hết NỖI ĐAU CHIẾN TRANH"""
yt_gtLl7pqVgGs,gtLl7pqVgGs,yt_gtLl7pqVgGs__sent000105,/data/processed/segments/auto_20260624_080605/yt_gtLl7pqVgGs/yt_gtLl7pqVgGs__sent000105.wav,/data/processed/segments/auto_20260624_080605/yt_gtLl7pqVgGs/yt_gtLl7pqVgGs__sent000105.txt,1253.2,1267.789,14.589,"Chủ tịch nước Tô Lâm hay Bộ trưởng Bộ Quốc phòng Phan Văn Giang trực tiếp đón quyền Bộ trưởng Hải quân Hoa Kỳ Hùng Cao không chỉ là một nghi thức ngoại giao, đó còn là biểu tượng của sự hòa giải của quá trình xây dựng lòng tin và của mong muốn cùng hướng tới tương lai. Và đối với",vtt,ready,aligned,speech_clean,1.0,,https://www.youtube.com/watch?v=gtLl7pqVgGs,"HÙNG CAO - Quyền Bộ trưởng Hải quân Hoa Kỳ đến Quảng Trị nói: ""Hiểu hơn ai hết NỖI ĐAU CHIẾN TRANH"""
yt_gtLl7pqVgGs,gtLl7pqVgGs,yt_gtLl7pqVgGs__sent000106,/data/processed/segments/auto_20260624_080605/yt_gtLl7pqVgGs/yt_gtLl7pqVgGs__sent000106.wav,/data/processed/segments/auto_20260624_080605/yt_gtLl7pqVgGs/yt_gtLl7pqVgGs__sent000106.txt,1265.8,1278.71,12.91,"muốn cùng hướng tới tương lai. Và đối với nhiều người Việt Nam, điều đáng chú ý nhất chính là việc hai quốc gia từng ở hai bên chiến tuyến nay lại đang cùng ngồi lại trao đổi những vấn đề thiết thực cùng hướng đến hòa bình, ổn định và sự phát triển thịnh vượng cho nhân dân",vtt,ready,aligned,speech_clean,1.0,,https://www.youtube.com/watch?v=gtLl7pqVgGs,"HÙNG CAO - Quyền Bộ trưởng Hải quân Hoa Kỳ đến Quảng Trị nói: ""Hiểu hơn ai hết NỖI ĐAU CHIẾN TRANH"""
yt_gtLl7pqVgGs,gtLl7pqVgGs,yt_gtLl7pqVgGs__sent000107,/data/processed/segments/auto_20260624_080605/yt_gtLl7pqVgGs/yt_gtLl7pqVgGs__sent000107.wav,/data/processed/segments/auto_20260624_080605/yt_gtLl7pqVgGs/yt_gtLl7pqVgGs__sent000107.txt,1277.2,1290.029,12.829,"và sự phát triển thịnh vượng cho nhân dân hai nước. Cuộc gặp gỡ giữa Tổng Bí thư Chủ tịch nước Tô Lâm và quyền bộ trưởng Hùng Cao hay là thông điệp của Đại tướng Phan Văn Giang trao đổi với ông Hùng Cao đã để lại một bài học ngoại giao vô cùng thấm thía. Muốn người khác tôn trọng mình, trước hết mình phải tự cường và",vtt,ready,aligned,speech_clean,1.0,,https://www.youtube.com/watch?v=gtLl7pqVgGs,"HÙNG CAO - Quyền Bộ trưởng Hải quân Hoa Kỳ đến Quảng Trị nói: ""Hiểu hơn ai hết NỖI ĐAU CHIẾN TRANH"""
yt_gtLl7pqVgGs,gtLl7pqVgGs,yt_gtLl7pqVgGs__sent000108,/data/processed/segments/auto_20260624_080605/yt_gtLl7pqVgGs/yt_gtLl7pqVgGs__sent000108.wav,/data/processed/segments/auto_20260624_080605/yt_gtLl7pqVgGs/yt_gtLl7pqVgGs__sent000108.txt,1288.32,1303.269,14.949,"tôn trọng mình, trước hết mình phải tự cường và bản lĩnh. Quá khứ là lịch sử, tương lai là vận mệnh. Sự tỉnh táo, sòng phẳng trong hợp tác quốc tế chính là chiếc chìa khóa để Việt Nam bảo vệ vững chắc chủ quyền lãnh thổ, mở rộng không gian phát triển và vững bước đi lên trên con đường xây dựng một đất nước hùng cường thịnh vượng. Còn bây giờ mời các bạn hãy",vtt,ready,aligned,speech_clean,1.0,,https://www.youtube.com/watch?v=gtLl7pqVgGs,"HÙNG CAO - Quyền Bộ trưởng Hải quân Hoa Kỳ đến Quảng Trị nói: ""Hiểu hơn ai hết NỖI ĐAU CHIẾN TRANH"""
yt_gtLl7pqVgGs,gtLl7pqVgGs,yt_gtLl7pqVgGs__sent000109,/data/processed/segments/auto_20260624_080605/yt_gtLl7pqVgGs/yt_gtLl7pqVgGs__sent000109.wav,/data/processed/segments/auto_20260624_080605/yt_gtLl7pqVgGs/yt_gtLl7pqVgGs__sent000109.txt,1301.599,1314.43,12.831,cường thịnh vượng. Còn bây giờ mời các bạn hãy cùng nhìn lại những gì mà ông Hùng Cao đã nói khi lần đầu quay trở lại Việt Nam vào tháng 11 năm 2025. Rất là hân hạnh được gặp anh Hùng Cao ở đây. Anh có thể cho biết cái cảm nghĩ của anh là một,vtt,ready,aligned,speech_clean,1.0,,https://www.youtube.com/watch?v=gtLl7pqVgGs,"HÙNG CAO - Quyền Bộ trưởng Hải quân Hoa Kỳ đến Quảng Trị nói: ""Hiểu hơn ai hết NỖI ĐAU CHIẾN TRANH"""
yt_gtLl7pqVgGs,gtLl7pqVgGs,yt_gtLl7pqVgGs__sent000110,/data/processed/segments/auto_20260624_080605/yt_gtLl7pqVgGs/yt_gtLl7pqVgGs__sent000110.wav,/data/processed/segments/auto_20260624_080605/yt_gtLl7pqVgGs/yt_gtLl7pqVgGs__sent000110.txt,1312.04,1328.19,16.15,Anh có thể cho biết cái cảm nghĩ của anh là một người phải nói là sau 50 năm mà khi mà anh trở lại Việt Nam không? >> Rồi xin chào Son và xin chào anh Huy và xin chào quý vị. Ờ n Hùng không có bao giờ mình mong mình biết là một ngày nào 50 năm sau mình đi di cư qua,vtt,ready,aligned,speech_clean,1.0,,https://www.youtube.com/watch?v=gtLl7pqVgGs,"HÙNG CAO - Quyền Bộ trưởng Hải quân Hoa Kỳ đến Quảng Trị nói: ""Hiểu hơn ai hết NỖI ĐAU CHIẾN TRANH"""
yt_gtLl7pqVgGs,gtLl7pqVgGs,yt_gtLl7pqVgGs__sent000111,/data/processed/segments/auto_20260624_080605/yt_gtLl7pqVgGs/yt_gtLl7pqVgGs__sent000111.wav,/data/processed/segments/auto_20260624_080605/yt_gtLl7pqVgGs/yt_gtLl7pqVgGs__sent000111.txt,1325.56,1338.029,12.469,ngày nào 50 năm sau mình đi di cư qua bên Mỹ á để nói chuyện với chính phủ Việt Nam và đại diện cho tổng thống Trump. >> Nếu phải chọn ra một tuyến đường giao thông nào khiến lĩnh Mỹ phải ám ảnh đến,vtt,ready,aligned,speech_clean,1.0,,https://www.youtube.com/watch?v=gtLl7pqVgGs,"HÙNG CAO - Quyền Bộ trưởng Hải quân Hoa Kỳ đến Quảng Trị nói: ""Hiểu hơn ai hết NỖI ĐAU CHIẾN TRANH"""
yt_gtLl7pqVgGs,gtLl7pqVgGs,yt_gtLl7pqVgGs__sent000112,/data/processed/segments/auto_20260624_080605/yt_gtLl7pqVgGs/yt_gtLl7pqVgGs__sent000112.wav,/data/processed/segments/auto_20260624_080605/yt_gtLl7pqVgGs/yt_gtLl7pqVgGs__sent000112.txt,1335.4,1351.07,15.67,"giao thông nào khiến lĩnh Mỹ phải ám ảnh đến ba đời trong suốt cuộc chiến tranh Việt Nam thì không có gì khác ngoài đường mòn Hồ Chí Minh. Con đường huyết mạch vận tải xuyên rừng Trường Sơn. Một bên là siêu cường với kho vũ khí tối tân, tiền",vtt,ready,aligned,speech_clean,1.0,,https://www.youtube.com/watch?v=gtLl7pqVgGs,"HÙNG CAO - Quyền Bộ trưởng Hải quân Hoa Kỳ đến Quảng Trị nói: ""Hiểu hơn ai hết NỖI ĐAU CHIẾN TRANH"""
yt_gtLl7pqVgGs,gtLl7pqVgGs,yt_gtLl7pqVgGs__sent000113,/data/processed/segments/auto_20260624_080605/yt_gtLl7pqVgGs/yt_gtLl7pqVgGs__sent000113.wav,/data/processed/segments/auto_20260624_080605/yt_gtLl7pqVgGs/yt_gtLl7pqVgGs__sent000113.txt,1347.92,1364.71,16.79,"là siêu cường với kho vũ khí tối tân, tiền tiêu như giác. Một bên là dân tộc nhỏ bé với đôi dép cao su và ý chí hà chết không chịu làm nô lệ. Kết quả là sau hàng chục năm chút xuống đây hàng triệu tấn bom, người Mỹ phải ngậm ngùi thừa",vtt,ready,aligned,speech_clean,1.0,,https://www.youtube.com/watch?v=gtLl7pqVgGs,"HÙNG CAO - Quyền Bộ trưởng Hải quân Hoa Kỳ đến Quảng Trị nói: ""Hiểu hơn ai hết NỖI ĐAU CHIẾN TRANH"""
yt_gtLl7pqVgGs,gtLl7pqVgGs,yt_gtLl7pqVgGs__sent000114,/data/processed/segments/auto_20260624_080605/yt_gtLl7pqVgGs/yt_gtLl7pqVgGs__sent000114.wav,/data/processed/segments/auto_20260624_080605/yt_gtLl7pqVgGs/yt_gtLl7pqVgGs__sent000114.txt,1361.76,1375.59,13.83,"triệu tấn bom, người Mỹ phải ngậm ngùi thừa nhận họ không thua trước công nghệ mà thua trước một kỳ quan vận tải được xây bằng máu và trí tuệ Việt Nam. Tại sao",vtt,ready,aligned,speech_clean,1.0,,https://www.youtube.com/watch?v=gtLl7pqVgGs,"HÙNG CAO - Quyền Bộ trưởng Hải quân Hoa Kỳ đến Quảng Trị nói: ""Hiểu hơn ai hết NỖI ĐAU CHIẾN TRANH"""
yt_gtLl7pqVgGs,gtLl7pqVgGs,yt_gtLl7pqVgGs__sent000115,/data/processed/segments/auto_20260624_080605/yt_gtLl7pqVgGs/yt_gtLl7pqVgGs__sent000115.wav,/data/processed/segments/auto_20260624_080605/yt_gtLl7pqVgGs/yt_gtLl7pqVgGs__sent000115.txt,1371.16,1381.149,9.989,xây bằng máu và trí tuệ Việt Nam. Tại sao lính Mỹ lại khiếp sợ ba đời khi nhắc đến đường mòn Hồ Chí Minh?,vtt,ready,aligned,speech_clean,1.0,,https://www.youtube.com/watch?v=gtLl7pqVgGs,"HÙNG CAO - Quyền Bộ trưởng Hải quân Hoa Kỳ đến Quảng Trị nói: ""Hiểu hơn ai hết NỖI ĐAU CHIẾN TRANH"""
yt_gtLl7pqVgGs,gtLl7pqVgGs,yt_gtLl7pqVgGs__sent000116,/data/processed/segments/auto_20260624_080605/yt_gtLl7pqVgGs/yt_gtLl7pqVgGs__sent000116.wav,/data/processed/segments/auto_20260624_080605/yt_gtLl7pqVgGs/yt_gtLl7pqVgGs__sent000116.txt,1378.0,1393.75,15.75,"đến đường mòn Hồ Chí Minh? Nguyên nhân đầu tiên khiến Mỹ ám ảnh khi nhắc đến tuyến đường mòn Hồ Chí Minh huyền thoại là bởi đây là con đường không bao giờ chết. Nói thẳng ra là sống dai như đỉa. Càng đánh càng mạnh, càng",vtt,ready,aligned,speech_clean,1.0,,https://www.youtube.com/watch?v=gtLl7pqVgGs,"HÙNG CAO - Quyền Bộ trưởng Hải quân Hoa Kỳ đến Quảng Trị nói: ""Hiểu hơn ai hết NỖI ĐAU CHIẾN TRANH"""
yt_gtLl7pqVgGs,gtLl7pqVgGs,yt_gtLl7pqVgGs__sent000117,/data/processed/segments/auto_20260624_080605/yt_gtLl7pqVgGs/yt_gtLl7pqVgGs__sent000117.wav,/data/processed/segments/auto_20260624_080605/yt_gtLl7pqVgGs/yt_gtLl7pqVgGs__sent000117.txt,1390.959,1408.31,17.351,"sống dai như đỉa. Càng đánh càng mạnh, càng phá càng thông. Dù bom rơi đạn nổ, tuyến đường vẫn âm thầm hoạt động bền bỉ chi viện cho chiến trường miền Nam. Ra đời giữa lúc chiến tranh ác liệt nhất vào ngày 19 tháng 0 năm 1959,",vtt,ready,aligned,speech_clean,1.0,,https://www.youtube.com/watch?v=gtLl7pqVgGs,"HÙNG CAO - Quyền Bộ trưởng Hải quân Hoa Kỳ đến Quảng Trị nói: ""Hiểu hơn ai hết NỖI ĐAU CHIẾN TRANH"""
yt_gtLl7pqVgGs,gtLl7pqVgGs,yt_gtLl7pqVgGs__sent000118,/data/processed/segments/auto_20260624_080605/yt_gtLl7pqVgGs/yt_gtLl7pqVgGs__sent000118.wav,/data/processed/segments/auto_20260624_080605/yt_gtLl7pqVgGs/yt_gtLl7pqVgGs__sent000118.txt,1403.68,1418.789,15.109,"nhất vào ngày 19 tháng 0 năm 1959, đoàn 559 được thành lập trong bối cảnh Mỹ đẩy mạnh chi viện cho chính quyền Sài Gòn. Ban đầu chỉ là đường gùi thô sơ sau mở",vtt,ready,aligned,speech_clean,1.0,,https://www.youtube.com/watch?v=gtLl7pqVgGs,"HÙNG CAO - Quyền Bộ trưởng Hải quân Hoa Kỳ đến Quảng Trị nói: ""Hiểu hơn ai hết NỖI ĐAU CHIẾN TRANH"""
yt_gtLl7pqVgGs,gtLl7pqVgGs,yt_gtLl7pqVgGs__sent000119,/data/processed/segments/auto_20260624_080605/yt_gtLl7pqVgGs/yt_gtLl7pqVgGs__sent000119.wav,/data/processed/segments/auto_20260624_080605/yt_gtLl7pqVgGs/yt_gtLl7pqVgGs__sent000119.txt,1415.0,1428.87,13.87,Gòn. Ban đầu chỉ là đường gùi thô sơ sau mở rộng thành hệ thống hơn 20.000 km đường bộ xuyên rừng vượt núi vượt suối từ lối mòn đã thành một đại lộ chiến tranh.,vtt,ready,aligned,speech_clean,1.0,,https://www.youtube.com/watch?v=gtLl7pqVgGs,"HÙNG CAO - Quyền Bộ trưởng Hải quân Hoa Kỳ đến Quảng Trị nói: ""Hiểu hơn ai hết NỖI ĐAU CHIẾN TRANH"""
yt_gtLl7pqVgGs,gtLl7pqVgGs,yt_gtLl7pqVgGs__sent000120,/data/processed/segments/auto_20260624_080605/yt_gtLl7pqVgGs/yt_gtLl7pqVgGs__sent000120.wav,/data/processed/segments/auto_20260624_080605/yt_gtLl7pqVgGs/yt_gtLl7pqVgGs__sent000120.txt,1424.52,1441.39,16.87,"lối mòn đã thành một đại lộ chiến tranh. rất nhiều lần bị máy bay Mỹ ném bom hủy diệt liên tục nhưng vẫn tồn tại một cách hiên ngang giữa đại ngàn. Mỹ ném 3 triệu tấn bom xuống Trường Sơn, gấp đôi tổng",vtt,ready,aligned,speech_clean,1.0,,https://www.youtube.com/watch?v=gtLl7pqVgGs,"HÙNG CAO - Quyền Bộ trưởng Hải quân Hoa Kỳ đến Quảng Trị nói: ""Hiểu hơn ai hết NỖI ĐAU CHIẾN TRANH"""
yt_gtLl7pqVgGs,gtLl7pqVgGs,yt_gtLl7pqVgGs__sent000121,/data/processed/segments/auto_20260624_080605/yt_gtLl7pqVgGs/yt_gtLl7pqVgGs__sent000121.wav,/data/processed/segments/auto_20260624_080605/yt_gtLl7pqVgGs/yt_gtLl7pqVgGs__sent000121.txt,1438.56,1452.83,14.27,"3 triệu tấn bom xuống Trường Sơn, gấp đôi tổng lượng bom dùng trong thế chiến thứ hai. Mỹ đánh phá liên tục hàng chục năm, dùng chất độc da cam, mưa nhân tạo, thuốc rụng lá để phá rừng nhưng vẫn không phá",vtt,ready,aligned,speech_clean,1.0,,https://www.youtube.com/watch?v=gtLl7pqVgGs,"HÙNG CAO - Quyền Bộ trưởng Hải quân Hoa Kỳ đến Quảng Trị nói: ""Hiểu hơn ai hết NỖI ĐAU CHIẾN TRANH"""
yt_gtLl7pqVgGs,gtLl7pqVgGs,yt_gtLl7pqVgGs__sent000122,/data/processed/segments/auto_20260624_080605/yt_gtLl7pqVgGs/yt_gtLl7pqVgGs__sent000122.wav,/data/processed/segments/auto_20260624_080605/yt_gtLl7pqVgGs/yt_gtLl7pqVgGs__sent000122.txt,1449.28,1466.149,16.869,"thuốc rụng lá để phá rừng nhưng vẫn không phá nổi được. Nhưng dù cho chúng có tàn phá cỡ nào thì hễ thả bom phá chỗ này ta mở chỗ khác, hễ tắc ta khơi lại. Con đường sống ra như đỉa chặt khúc này nó mọc khúc kia",vtt,ready,aligned,speech_clean,1.0,,https://www.youtube.com/watch?v=gtLl7pqVgGs,"HÙNG CAO - Quyền Bộ trưởng Hải quân Hoa Kỳ đến Quảng Trị nói: ""Hiểu hơn ai hết NỖI ĐAU CHIẾN TRANH"""
yt_gtLl7pqVgGs,gtLl7pqVgGs,yt_gtLl7pqVgGs__sent000123,/data/processed/segments/auto_20260624_080605/yt_gtLl7pqVgGs/yt_gtLl7pqVgGs__sent000123.wav,/data/processed/segments/auto_20260624_080605/yt_gtLl7pqVgGs/yt_gtLl7pqVgGs__sent000123.txt,1462.719,1478.19,15.471,"sống ra như đỉa chặt khúc này nó mọc khúc kia khiến Linh Mỹ vừa khiếp vừa nản vì cảm giác như mình đang đấm vào không khí. Không chỉ dừng lại ở đó, đường Hồ Chí Minh còn khiến lĩnh Mỹ khiếp sợ khi có một mạng lưới tràng chịt như trận đổ bát",vtt,ready,aligned,speech_clean,1.0,,https://www.youtube.com/watch?v=gtLl7pqVgGs,"HÙNG CAO - Quyền Bộ trưởng Hải quân Hoa Kỳ đến Quảng Trị nói: ""Hiểu hơn ai hết NỖI ĐAU CHIẾN TRANH"""
yt_gtLl7pqVgGs,gtLl7pqVgGs,yt_gtLl7pqVgGs__sent000124,/data/processed/segments/auto_20260624_080605/yt_gtLl7pqVgGs/yt_gtLl7pqVgGs__sent000124.wav,/data/processed/segments/auto_20260624_080605/yt_gtLl7pqVgGs/yt_gtLl7pqVgGs__sent000124.txt,1475.839,1490.71,14.871,"khi có một mạng lưới tràng chịt như trận đổ bát quái giữa rừng giả. dọc, 21 chục ngang và 3140 km đường kín, 600 km đường sông đường biển, 5000 km đường ống xăng dầu đường",vtt,ready,aligned,speech_clean,1.0,,https://www.youtube.com/watch?v=gtLl7pqVgGs,"HÙNG CAO - Quyền Bộ trưởng Hải quân Hoa Kỳ đến Quảng Trị nói: ""Hiểu hơn ai hết NỖI ĐAU CHIẾN TRANH"""
yt_gtLl7pqVgGs,gtLl7pqVgGs,yt_gtLl7pqVgGs__sent000125,/data/processed/segments/auto_20260624_080605/yt_gtLl7pqVgGs/yt_gtLl7pqVgGs__sent000125.wav,/data/processed/segments/auto_20260624_080605/yt_gtLl7pqVgGs/yt_gtLl7pqVgGs__sent000125.txt,1487.199,1502.83,15.631,"sông đường biển, 5000 km đường ống xăng dầu đường hàng không tài chính đường phụ mọc như nấm Mỹ cắt một chục ta có sẵn 10 chục dự phòng không thể tê liệt toàn hệ thống. Mỹ lập hàng rào điện tử Maknamara cắm",vtt,ready,aligned,speech_clean,1.0,,https://www.youtube.com/watch?v=gtLl7pqVgGs,"HÙNG CAO - Quyền Bộ trưởng Hải quân Hoa Kỳ đến Quảng Trị nói: ""Hiểu hơn ai hết NỖI ĐAU CHIẾN TRANH"""
yt_gtLl7pqVgGs,gtLl7pqVgGs,yt_gtLl7pqVgGs__sent000126,/data/processed/segments/auto_20260624_080605/yt_gtLl7pqVgGs/yt_gtLl7pqVgGs__sent000126.wav,/data/processed/segments/auto_20260624_080605/yt_gtLl7pqVgGs/yt_gtLl7pqVgGs__sent000126.txt,1499.52,1513.31,13.79,thống. Mỹ lập hàng rào điện tử Maknamara cắm cảm biến máy dò địa chấn nhưng ta phá bằng mẹo dân gian mưu trí và sự linh hoạt. Lính Mỹ gọi Trường Sơn là trận đồ bát quái sống bởi không thể nào xác định,vtt,ready,aligned,speech_clean,1.0,,https://www.youtube.com/watch?v=gtLl7pqVgGs,"HÙNG CAO - Quyền Bộ trưởng Hải quân Hoa Kỳ đến Quảng Trị nói: ""Hiểu hơn ai hết NỖI ĐAU CHIẾN TRANH"""
yt_gtLl7pqVgGs,gtLl7pqVgGs,yt_gtLl7pqVgGs__sent000127,/data/processed/segments/auto_20260624_080605/yt_gtLl7pqVgGs/yt_gtLl7pqVgGs__sent000127.wav,/data/processed/segments/auto_20260624_080605/yt_gtLl7pqVgGs/yt_gtLl7pqVgGs__sent000127.txt,1510.719,1525.31,14.591,"đồ bát quái sống bởi không thể nào xác định được đâu là hướng chính, đâu là đánh lạc hướng. Tuyến đường mòn đã trở thành nỗi ám ảnh không thể nào quên của những tên lính Mỹ khi không thấy ai đánh mà vẫn thua.",vtt,ready,aligned,speech_clean,1.0,,https://www.youtube.com/watch?v=gtLl7pqVgGs,"HÙNG CAO - Quyền Bộ trưởng Hải quân Hoa Kỳ đến Quảng Trị nói: ""Hiểu hơn ai hết NỖI ĐAU CHIẾN TRANH"""
yt_gtLl7pqVgGs,gtLl7pqVgGs,yt_gtLl7pqVgGs__sent000128,/data/processed/segments/auto_20260624_080605/yt_gtLl7pqVgGs/yt_gtLl7pqVgGs__sent000128.wav,/data/processed/segments/auto_20260624_080605/yt_gtLl7pqVgGs/yt_gtLl7pqVgGs__sent000128.txt,1523.719,1536.269,12.55,"vẫn thua. Không định vị được vị trí nhưng quân và đạn vẫn vào chiến trường đều đặt. Tuyến đường biển vượt sóng, tránh radar gần 2000 chuyến tàu gỗ nhỏ chở vũ khí cập bờ",vtt,ready,aligned,speech_clean,1.0,,https://www.youtube.com/watch?v=gtLl7pqVgGs,"HÙNG CAO - Quyền Bộ trưởng Hải quân Hoa Kỳ đến Quảng Trị nói: ""Hiểu hơn ai hết NỖI ĐAU CHIẾN TRANH"""
