audio_id,video_id,segment_id,segment_file,transcript_file,start,end,duration,text,transcript_source,transcript_status,vad_status,quality_label,quality_score,quality_reasons,source_url,title
yt_5ve-UYKvy9k,5ve-UYKvy9k,yt_5ve-UYKvy9k__sent000136,/data/processed/segments/auto_20260624_090505/yt_5ve-UYKvy9k/yt_5ve-UYKvy9k__sent000136.wav,/data/processed/segments/auto_20260624_090505/yt_5ve-UYKvy9k/yt_5ve-UYKvy9k__sent000136.txt,1439.28,1447.679,8.399,sĩ đã giúp đỡ người bệnh không kể ngày [âm nhạc],vtt,ready,aligned,speech_clean,1.0,,https://www.youtube.com/watch?v=5ve-UYKvy9k,Thời sự TỐI 24/8/2024
yt_5ve-UYKvy9k,5ve-UYKvy9k,yt_5ve-UYKvy9k__sent000137,/data/processed/segments/auto_20260624_090505/yt_5ve-UYKvy9k/yt_5ve-UYKvy9k__sent000137.wav,/data/processed/segments/auto_20260624_090505/yt_5ve-UYKvy9k/yt_5ve-UYKvy9k__sent000137.txt,1447.479,1465.59,18.111,[âm nhạc] đêm thưa quý vị và các bạn dựa vào lợi thế tiềm năng độc đáo của vùng nước trồi và những kết quả nghiên cứu về môi trường gần bờ độ mặn cùng với hệ sinh thái biển Ninh Thuận đang triển khai quy hoạch hướng đến phát triển nghề nuôi biển nuôi biển sâu hiệu quả và bình,vtt,ready,aligned,speech_clean,1.0,,https://www.youtube.com/watch?v=5ve-UYKvy9k,Thời sự TỐI 24/8/2024
yt_5ve-UYKvy9k,5ve-UYKvy9k,yt_5ve-UYKvy9k__sent000138,/data/processed/segments/auto_20260624_090505/yt_5ve-UYKvy9k/yt_5ve-UYKvy9k__sent000138.wav,/data/processed/segments/auto_20260624_090505/yt_5ve-UYKvy9k/yt_5ve-UYKvy9k__sent000138.txt,1460.44,1465.59,5.15,nuôi biển nuôi biển sâu hiệu quả và bình,vtt,ready,aligned,speech_clean,1.0,,https://www.youtube.com/watch?v=5ve-UYKvy9k,Thời sự TỐI 24/8/2024
yt_5ve-UYKvy9k,5ve-UYKvy9k,yt_5ve-UYKvy9k__sent000139,/data/processed/segments/auto_20260624_090505/yt_5ve-UYKvy9k/yt_5ve-UYKvy9k__sent000139.wav,/data/processed/segments/auto_20260624_090505/yt_5ve-UYKvy9k/yt_5ve-UYKvy9k__sent000139.txt,1460.44,1477.389,16.949,nuôi biển nuôi biển sâu hiệu quả và bình vững lần đầu tiên lại lòng nuôi biển cỡ lớn làm bằng vật liệu hdp đã được một doanh nghiệp trong nước Thiết kế thi công và cho phép nuôi ổn định ngay cả lúc sống Tò gió lớn thì chúng tôi sẽ sản,vtt,ready,aligned,speech_clean,1.0,,https://www.youtube.com/watch?v=5ve-UYKvy9k,Thời sự TỐI 24/8/2024
yt_5ve-UYKvy9k,5ve-UYKvy9k,yt_5ve-UYKvy9k__sent000140,/data/processed/segments/auto_20260624_090505/yt_5ve-UYKvy9k/yt_5ve-UYKvy9k__sent000140.wav,/data/processed/segments/auto_20260624_090505/yt_5ve-UYKvy9k/yt_5ve-UYKvy9k__sent000140.txt,1474.359,1489.789,15.43,ngay cả lúc sống Tò gió lớn thì chúng tôi sẽ sản xuất một số lòng và sau đó sẽ cho bà con thuê theo kiểu giảng theo năm thì đó là định hướng của chúng tôi để thúc đẩ các cái bà con vừa đang không thiếu vốn và vừa chưa có các cái điều kiện chuẩn để,vtt,ready,aligned,speech_clean,1.0,,https://www.youtube.com/watch?v=5ve-UYKvy9k,Thời sự TỐI 24/8/2024
yt_5ve-UYKvy9k,5ve-UYKvy9k,yt_5ve-UYKvy9k__sent000141,/data/processed/segments/auto_20260624_090505/yt_5ve-UYKvy9k/yt_5ve-UYKvy9k__sent000141.wav,/data/processed/segments/auto_20260624_090505/yt_5ve-UYKvy9k/yt_5ve-UYKvy9k__sent000141.txt,1486.68,1500.99,14.31,và vừa chưa có các cái điều kiện chuẩn để họ có thể vươn ra biển Mở để cùng làm thì chúng tôi mong muốn rằng chúng tôi sẽ tiếp cận được các cái nguồn lực để chúng tôi có thể hỗ trợ bà con trong cái thời gian đấy sau khi thử nghiệm mô hình nuôi mực nhảy thành công tại vùng biển,vtt,ready,aligned,speech_clean,1.0,,https://www.youtube.com/watch?v=5ve-UYKvy9k,Thời sự TỐI 24/8/2024
yt_5ve-UYKvy9k,5ve-UYKvy9k,yt_5ve-UYKvy9k__sent000142,/data/processed/segments/auto_20260624_090505/yt_5ve-UYKvy9k/yt_5ve-UYKvy9k__sent000142.wav,/data/processed/segments/auto_20260624_090505/yt_5ve-UYKvy9k/yt_5ve-UYKvy9k__sent000142.txt,1498.959,1514.07,15.111,mô hình nuôi mực nhảy thành công tại vùng biển X2 xã Thanh Hải huyện Ninh Hải tỉnh Ninh Thuận công ty cổ phần mực nhảy biển Đông Tiếp tục hoàn thiện quy trình nuôi để hướng đến hình thành các khu công nghiệp nuôi biển tại đây mới đây trong chuyến khảo sát quy hoạch nuôi biển của đồng,vtt,ready,aligned,speech_clean,1.0,,https://www.youtube.com/watch?v=5ve-UYKvy9k,Thời sự TỐI 24/8/2024
yt_5ve-UYKvy9k,5ve-UYKvy9k,yt_5ve-UYKvy9k__sent000143,/data/processed/segments/auto_20260624_090505/yt_5ve-UYKvy9k/yt_5ve-UYKvy9k__sent000143.wav,/data/processed/segments/auto_20260624_090505/yt_5ve-UYKvy9k/yt_5ve-UYKvy9k__sent000143.txt,1512.479,1523.43,10.951,chuyến khảo sát quy hoạch nuôi biển của đồng chí Nguyễn Đức Thanh Bí thư Tỉnh ủy Ninh Thuận doanh nghiệp mong tỉnh sớm ban hành cơ chế chính sách để đảm bảo cơ sở pháp lý giúp doanh nghiệp Yên tâm đầu tư phát triển nuôi,vtt,ready,aligned,speech_clean,1.0,,https://www.youtube.com/watch?v=5ve-UYKvy9k,Thời sự TỐI 24/8/2024
yt_5ve-UYKvy9k,5ve-UYKvy9k,yt_5ve-UYKvy9k__sent000144,/data/processed/segments/auto_20260624_090505/yt_5ve-UYKvy9k/yt_5ve-UYKvy9k__sent000144.wav,/data/processed/segments/auto_20260624_090505/yt_5ve-UYKvy9k/yt_5ve-UYKvy9k__sent000144.txt,1523.24,1538.11,14.87,nuôi biển cái đề án th nuôi thủy sản nước sau này à sẽ được tỉnh phê Việt vào cuối năm nay là sẽ xác lập ra những cái khu vực nuôi trồng thủy sản ở nhiều cấp độ khác nhau và những khu vực này thì sẽ không,vtt,ready,aligned,speech_clean,1.0,,https://www.youtube.com/watch?v=5ve-UYKvy9k,Thời sự TỐI 24/8/2024
yt_5ve-UYKvy9k,5ve-UYKvy9k,yt_5ve-UYKvy9k__sent000145,/data/processed/segments/auto_20260624_090505/yt_5ve-UYKvy9k/yt_5ve-UYKvy9k__sent000145.wav,/data/processed/segments/auto_20260624_090505/yt_5ve-UYKvy9k/yt_5ve-UYKvy9k__sent000145.txt,1534.359,1545.19,10.831,độ khác nhau và những khu vực này thì sẽ không Cạnh tranh với lại các cái khu vực khác trong quá trình phát triển kinh tế như là du lịch như là công nghiệp Vân,vtt,ready,aligned,speech_clean,1.0,,https://www.youtube.com/watch?v=5ve-UYKvy9k,Thời sự TỐI 24/8/2024
yt_5ve-UYKvy9k,5ve-UYKvy9k,yt_5ve-UYKvy9k__sent000146,/data/processed/segments/auto_20260624_090505/yt_5ve-UYKvy9k/yt_5ve-UYKvy9k__sent000146.wav,/data/processed/segments/auto_20260624_090505/yt_5ve-UYKvy9k/yt_5ve-UYKvy9k__sent000146.txt,1545.0,1559.63,14.63,Vân với 105 km bờ biển tỉnh Ninh Thuận đã ban hành quyết riêng về phát triển kinh tế biển đến năm 2030 theo đó Ninh Thuận cũng cam kết sẽ tạo điều quyền thuận lợi nhất đối với người dân và doanh nghiệp đầu tư vào nuôi biển và nuôi s qua đó Mở,vtt,ready,aligned,speech_clean,1.0,,https://www.youtube.com/watch?v=5ve-UYKvy9k,Thời sự TỐI 24/8/2024
yt_5ve-UYKvy9k,5ve-UYKvy9k,yt_5ve-UYKvy9k__sent000147,/data/processed/segments/auto_20260624_090505/yt_5ve-UYKvy9k/yt_5ve-UYKvy9k__sent000147.wav,/data/processed/segments/auto_20260624_090505/yt_5ve-UYKvy9k/yt_5ve-UYKvy9k__sent000147.txt,1556.44,1566.71,10.27,nghiệp đầu tư vào nuôi biển và nuôi s qua đó Mở ra cơ hội và giúp người dân nên Thuận thay đổi tư duy trong nuôi trồng thủy hải sản và làm dầu từ,vtt,ready,aligned,speech_clean,1.0,,https://www.youtube.com/watch?v=5ve-UYKvy9k,Thời sự TỐI 24/8/2024
yt_5ve-UYKvy9k,5ve-UYKvy9k,yt_5ve-UYKvy9k__sent000148,/data/processed/segments/auto_20260624_090505/yt_5ve-UYKvy9k/yt_5ve-UYKvy9k__sent000148.wav,/data/processed/segments/auto_20260624_090505/yt_5ve-UYKvy9k/yt_5ve-UYKvy9k__sent000148.txt,1563.0,1580.88,17.88,thủy hải sản và làm dầu từ biển những thông tin vừa rồi đã kết thúc gia đình thời sự buổi tối thứ Bảy trên kênh btb của đà phát thanh và truyền hình Phú Yên Cảm ơn quý vị đã dành thời gian theo dõi Xem lại chương trình quý vị có thể truy cập vào website www.bt.com,vtt,ready,aligned,speech_clean,1.0,,https://www.youtube.com/watch?v=5ve-UYKvy9k,Thời sự TỐI 24/8/2024
yt_etaS7gikIls,etaS7gikIls,yt_etaS7gikIls__sent000001,/data/processed/segments/auto_20260624_090505/yt_etaS7gikIls/yt_etaS7gikIls__sent000001.wav,/data/processed/segments/auto_20260624_090505/yt_etaS7gikIls/yt_etaS7gikIls__sent000001.txt,22.039,40.99,18.951,thì hôm nay mình đi làm về trễ cả nhà anh em buồn quá mình quay chút xíu trên đoạn đường đi để nói chuyện với cả nhà cho nó đỡ buồn ha bây giờ tới đèn xanh đèn đỏ mình dừng lại nè,vtt,ready,aligned,speech_clean,1.0,,https://www.youtube.com/watch?v=etaS7gikIls,Chuyện Vui Giọng Quảng Nam | Chuyện Cười Xứ Quảng @ ngaphanusa
yt_etaS7gikIls,etaS7gikIls,yt_etaS7gikIls__sent000002,/data/processed/segments/auto_20260624_090505/yt_etaS7gikIls/yt_etaS7gikIls__sent000002.wav,/data/processed/segments/auto_20260624_090505/yt_etaS7gikIls/yt_etaS7gikIls__sent000002.txt,38.62,51.95,13.33,dừng lại nè đi làm bây giờ 8 giờ hơn rồi mới bước ra khỏi chỗ làm nè cả nhà Nói chung cuộc sống ở bên đây nó cũng,vtt,ready,aligned,speech_clean,1.0,,https://www.youtube.com/watch?v=etaS7gikIls,Chuyện Vui Giọng Quảng Nam | Chuyện Cười Xứ Quảng @ ngaphanusa
yt_etaS7gikIls,etaS7gikIls,yt_etaS7gikIls__sent000003,/data/processed/segments/auto_20260624_090505/yt_etaS7gikIls/yt_etaS7gikIls__sent000003.wav,/data/processed/segments/auto_20260624_090505/yt_etaS7gikIls/yt_etaS7gikIls__sent000003.txt,49.019,63.42,14.401,nhà Nói chung cuộc sống ở bên đây nó cũng vất vả lắm Cả nhà ơi mình đi làm thì bây giờ mới ra khỏi chỗ làm nè Đôi lúc mình cũng về đúng giờ nhưng mà,vtt,ready,aligned,speech_clean,1.0,,https://www.youtube.com/watch?v=etaS7gikIls,Chuyện Vui Giọng Quảng Nam | Chuyện Cười Xứ Quảng @ ngaphanusa
yt_etaS7gikIls,etaS7gikIls,yt_etaS7gikIls__sent000004,/data/processed/segments/auto_20260624_090505/yt_etaS7gikIls/yt_etaS7gikIls__sent000004.wav,/data/processed/segments/auto_20260624_090505/yt_etaS7gikIls/yt_etaS7gikIls__sent000004.txt,57.28,76.07,18.79,chỗ làm nè Đôi lúc mình cũng về đúng giờ nhưng mà cũng đôi lúc đi ra cũng trễ Tại vì mình làm thì làm nail đó nên tùy theo cái lượng khách á khách mà vô trễ thì mình phải ở lại trễ,vtt,ready,aligned,speech_clean,1.0,,https://www.youtube.com/watch?v=etaS7gikIls,Chuyện Vui Giọng Quảng Nam | Chuyện Cười Xứ Quảng @ ngaphanusa
yt_etaS7gikIls,etaS7gikIls,yt_etaS7gikIls__sent000005,/data/processed/segments/auto_20260624_090505/yt_etaS7gikIls/yt_etaS7gikIls__sent000005.wav,/data/processed/segments/auto_20260624_090505/yt_etaS7gikIls/yt_etaS7gikIls__sent000005.txt,71.94,87.969,16.029,á khách mà vô trễ thì mình phải ở lại trễ mình làm đó cả nhà cho nên là đi về nó cũng bị trễ,vtt,ready,aligned,speech_clean,1.0,,https://www.youtube.com/watch?v=etaS7gikIls,Chuyện Vui Giọng Quảng Nam | Chuyện Cười Xứ Quảng @ ngaphanusa
yt_etaS7gikIls,etaS7gikIls,yt_etaS7gikIls__sent000006,/data/processed/segments/auto_20260624_090505/yt_etaS7gikIls/yt_etaS7gikIls__sent000006.wav,/data/processed/segments/auto_20260624_090505/yt_etaS7gikIls/yt_etaS7gikIls__sent000006.txt,77.459,100.069,22.61,nhà cho nên là đi về nó cũng bị trễ mình trên đường đi làm về thì chia sẻ đến cả nhà mình một câu chuyện vui về cái tiếng Quảng Nam về cái giọng,vtt,ready,aligned,speech_clean,1.0,,https://www.youtube.com/watch?v=etaS7gikIls,Chuyện Vui Giọng Quảng Nam | Chuyện Cười Xứ Quảng @ ngaphanusa
yt_etaS7gikIls,etaS7gikIls,yt_etaS7gikIls__sent000007,/data/processed/segments/auto_20260624_090505/yt_etaS7gikIls/yt_etaS7gikIls__sent000007.wav,/data/processed/segments/auto_20260624_090505/yt_etaS7gikIls/yt_etaS7gikIls__sent000007.txt,96.54,111.55,15.01,vui về cái tiếng Quảng Nam về cái giọng Quảng của quê mình ha thì tiếng Quảng Nam đôi lúc cũng gây rất là nhiều cái hiểu lầm khi người miền khác mà nghe được đó cả nhà,vtt,ready,aligned,speech_clean,1.0,,https://www.youtube.com/watch?v=etaS7gikIls,Chuyện Vui Giọng Quảng Nam | Chuyện Cười Xứ Quảng @ ngaphanusa
yt_etaS7gikIls,etaS7gikIls,yt_etaS7gikIls__sent000008,/data/processed/segments/auto_20260624_090505/yt_etaS7gikIls/yt_etaS7gikIls__sent000008.wav,/data/processed/segments/auto_20260624_090505/yt_etaS7gikIls/yt_etaS7gikIls__sent000008.txt,110.559,125.99,15.431,đó cả nhà thì hôm mình kể cái chuyện nào vui mà có thật chỉ có hai từ thôi Nhưng mà nó cũng mất có một khoảng thời đang giữa hai người đối thoại với nhau cũng khoảng 15 20 phút á Cả nhà mình có hai,vtt,ready,aligned,speech_clean,1.0,,https://www.youtube.com/watch?v=etaS7gikIls,Chuyện Vui Giọng Quảng Nam | Chuyện Cười Xứ Quảng @ ngaphanusa
yt_etaS7gikIls,etaS7gikIls,yt_etaS7gikIls__sent000009,/data/processed/segments/auto_20260624_090505/yt_etaS7gikIls/yt_etaS7gikIls__sent000009.wav,/data/processed/segments/auto_20260624_090505/yt_etaS7gikIls/yt_etaS7gikIls__sent000009.txt,122.14,135.71,13.57,cũng khoảng 15 20 phút á Cả nhà mình có hai từ bỏ mẹ ăn thôi ha Thì trong chuyện mình kể đây là có thật luôn đó thì cái chàng trai đó thì quen một cô gái xứ,vtt,ready,aligned,speech_clean,1.0,,https://www.youtube.com/watch?v=etaS7gikIls,Chuyện Vui Giọng Quảng Nam | Chuyện Cười Xứ Quảng @ ngaphanusa
yt_etaS7gikIls,etaS7gikIls,yt_etaS7gikIls__sent000010,/data/processed/segments/auto_20260624_090505/yt_etaS7gikIls/yt_etaS7gikIls__sent000010.wav,/data/processed/segments/auto_20260624_090505/yt_etaS7gikIls/yt_etaS7gikIls__sent000010.txt,131.32,149.809,18.489,cái chàng trai đó thì quen một cô gái xứ Quảng đó cả nhà thì khi chàng trai đó người miền Nam cô gái này thì khi về thăm quê thì anh chàng này thì muốn đi theo cô gái đó ra,vtt,ready,aligned,speech_clean,1.0,,https://www.youtube.com/watch?v=etaS7gikIls,Chuyện Vui Giọng Quảng Nam | Chuyện Cười Xứ Quảng @ ngaphanusa
yt_etaS7gikIls,etaS7gikIls,yt_etaS7gikIls__sent000011,/data/processed/segments/auto_20260624_090505/yt_etaS7gikIls/yt_etaS7gikIls__sent000011.wav,/data/processed/segments/auto_20260624_090505/yt_etaS7gikIls/yt_etaS7gikIls__sent000011.txt,144.88,160.93,16.05,anh chàng này thì muốn đi theo cô gái đó ra ngoài quê để thăm Cho biết gia đình đó thì khi chàng trai này ra ngoài quê thì,vtt,ready,aligned,speech_clean,1.0,,https://www.youtube.com/watch?v=etaS7gikIls,Chuyện Vui Giọng Quảng Nam | Chuyện Cười Xứ Quảng @ ngaphanusa
yt_etaS7gikIls,etaS7gikIls,yt_etaS7gikIls__sent000012,/data/processed/segments/auto_20260624_090505/yt_etaS7gikIls/yt_etaS7gikIls__sent000012.wav,/data/processed/segments/auto_20260624_090505/yt_etaS7gikIls/yt_etaS7gikIls__sent000012.txt,154.8,171.83,17.03,đó thì khi chàng trai này ra ngoài quê thì ba mẹ của cô gái thì mới đi ra chào đón thì cũng rất là nồng nhiệt thì cô gái thì lúc đó thì đã vào phía,vtt,ready,aligned,speech_clean,1.0,,https://www.youtube.com/watch?v=etaS7gikIls,Chuyện Vui Giọng Quảng Nam | Chuyện Cười Xứ Quảng @ ngaphanusa
yt_etaS7gikIls,etaS7gikIls,yt_etaS7gikIls__sent000013,/data/processed/segments/auto_20260624_090505/yt_etaS7gikIls/yt_etaS7gikIls__sent000013.wav,/data/processed/segments/auto_20260624_090505/yt_etaS7gikIls/yt_etaS7gikIls__sent000013.txt,168.52,183.85,15.33,thì cô gái thì lúc đó thì đã vào phía sau nhà rồi còn chàng trai thì còn ở trước phòng khách đó cả nhà cho nên giữa bố mẹ vợ tương lai dưới trần rễ tương lai có một cuộc đối thoại,vtt,ready,aligned,speech_clean,1.0,,https://www.youtube.com/watch?v=etaS7gikIls,Chuyện Vui Giọng Quảng Nam | Chuyện Cười Xứ Quảng @ ngaphanusa
yt_etaS7gikIls,etaS7gikIls,yt_etaS7gikIls__sent000014,/data/processed/segments/auto_20260624_090505/yt_etaS7gikIls/yt_etaS7gikIls__sent000014.wav,/data/processed/segments/auto_20260624_090505/yt_etaS7gikIls/yt_etaS7gikIls__sent000014.txt,180.88,197.17,16.29,tương lai có một cuộc đối thoại rất là vui luôn cả nhà thì đến đây thì mình cũng nói giọng Quảng nh cả nhà thì ông bố và mẹ mới hỏi chàng trai là,vtt,ready,aligned,speech_clean,1.0,,https://www.youtube.com/watch?v=etaS7gikIls,Chuyện Vui Giọng Quảng Nam | Chuyện Cười Xứ Quảng @ ngaphanusa
yt_etaS7gikIls,etaS7gikIls,yt_etaS7gikIls__sent000015,/data/processed/segments/auto_20260624_090505/yt_etaS7gikIls/yt_etaS7gikIls__sent000015.wav,/data/processed/segments/auto_20260624_090505/yt_etaS7gikIls/yt_etaS7gikIls__sent000015.txt,190.08,209.63,19.55,nhà thì ông bố và mẹ mới hỏi chàng trai là con con ra đây bằng máy bay ha Thì chàng trai mới trả lời là Dạ không con Đi ra đây mình,vtt,ready,aligned,speech_clean,1.0,,https://www.youtube.com/watch?v=etaS7gikIls,Chuyện Vui Giọng Quảng Nam | Chuyện Cười Xứ Quảng @ ngaphanusa
yt_etaS7gikIls,etaS7gikIls,yt_etaS7gikIls__sent000016,/data/processed/segments/auto_20260624_090505/yt_etaS7gikIls/yt_etaS7gikIls__sent000016.wav,/data/processed/segments/auto_20260624_090505/yt_etaS7gikIls/yt_etaS7gikIls__sent000016.txt,204.48,220.67,16.19,mới trả lời là Dạ không con Đi ra đây mình con Chứ con không có đi với má ba con cái bố mẹ vợ tương lai mới hỏi lại không ý,vtt,ready,aligned,speech_clean,1.0,,https://www.youtube.com/watch?v=etaS7gikIls,Chuyện Vui Giọng Quảng Nam | Chuyện Cười Xứ Quảng @ ngaphanusa
yt_etaS7gikIls,etaS7gikIls,yt_etaS7gikIls__sent000017,/data/processed/segments/auto_20260624_090505/yt_etaS7gikIls/yt_etaS7gikIls__sent000017.wav,/data/processed/segments/auto_20260624_090505/yt_etaS7gikIls/yt_etaS7gikIls__sent000017.txt,215.22,233.449,18.229,cái bố mẹ vợ tương lai mới hỏi lại không ý muốn của là con đi ra bằng má ba ha tiếp tục trả lời là Dạ không chỉ có mình con thôi thì cái ông bà này cũng rất là,vtt,ready,aligned,speech_clean,1.0,,https://www.youtube.com/watch?v=etaS7gikIls,Chuyện Vui Giọng Quảng Nam | Chuyện Cười Xứ Quảng @ ngaphanusa
yt_etaS7gikIls,etaS7gikIls,yt_etaS7gikIls__sent000018,/data/processed/segments/auto_20260624_090505/yt_etaS7gikIls/yt_etaS7gikIls__sent000018.wav,/data/processed/segments/auto_20260624_090505/yt_etaS7gikIls/yt_etaS7gikIls__sent000018.txt,230.44,243.85,13.41,tiếp tục trả lời là Dạ không chỉ có mình con thôi thì cái ông bà này cũng rất là bực mình Tao hổng mi là Mi đi ra bằng má ba hả chàng trai này vẫn tiếp tục trả lời cứ Dạ không Dạ không,vtt,ready,aligned,speech_clean,1.0,,https://www.youtube.com/watch?v=etaS7gikIls,Chuyện Vui Giọng Quảng Nam | Chuyện Cười Xứ Quảng @ ngaphanusa
yt_etaS7gikIls,etaS7gikIls,yt_etaS7gikIls__sent000019,/data/processed/segments/auto_20260624_090505/yt_etaS7gikIls/yt_etaS7gikIls__sent000019.wav,/data/processed/segments/auto_20260624_090505/yt_etaS7gikIls/yt_etaS7gikIls__sent000019.txt,240.819,256.61,15.791,cứ Dạ không Dạ không lời qua tiếng lại thì vẫn không giải quyết được vấn đề thì lúc đó thì cô gái ở trong phòng thì mới bước ra thì thấy tình hình cũng rất là căng trong cái cuộc đối thoại thì cô gái mới thảy,vtt,ready,aligned,speech_clean,1.0,,https://www.youtube.com/watch?v=etaS7gikIls,Chuyện Vui Giọng Quảng Nam | Chuyện Cười Xứ Quảng @ ngaphanusa
yt_etaS7gikIls,etaS7gikIls,yt_etaS7gikIls__sent000020,/data/processed/segments/auto_20260624_090505/yt_etaS7gikIls/yt_etaS7gikIls__sent000020.wav,/data/processed/segments/auto_20260624_090505/yt_etaS7gikIls/yt_etaS7gikIls__sent000020.txt,253.899,267.11,13.211,cái cuộc đối thoại thì cô gái mới thảy chuyện gì thì hai bên mình nói chuyện nhưng mà không hiểu nhau đó cả nhà thì anh chàng này nói thì chắc là cầu cứu cô gái ha thì,vtt,ready,aligned,speech_clean,1.0,,https://www.youtube.com/watch?v=etaS7gikIls,Chuyện Vui Giọng Quảng Nam | Chuyện Cười Xứ Quảng @ ngaphanusa
yt_etaS7gikIls,etaS7gikIls,yt_etaS7gikIls__sent000021,/data/processed/segments/auto_20260624_090505/yt_etaS7gikIls/yt_etaS7gikIls__sent000021.wav,/data/processed/segments/auto_20260624_090505/yt_etaS7gikIls/yt_etaS7gikIls__sent000021.txt,264.059,279.77,15.711,này nói thì chắc là cầu cứu cô gái ha thì ông già bà già mới hỏi lại thì ta hụi hắn là mi hắn đi ra đây bằng máy ba mà hắn cứ không biết mà ta biết Mi đi ra mi đi về thì cùng lần thì mi nói mày về má ba mày mua vé máy bay đi về,vtt,ready,aligned,speech_clean,1.0,,https://www.youtube.com/watch?v=etaS7gikIls,Chuyện Vui Giọng Quảng Nam | Chuyện Cười Xứ Quảng @ ngaphanusa
yt_etaS7gikIls,etaS7gikIls,yt_etaS7gikIls__sent000022,/data/processed/segments/auto_20260624_090505/yt_etaS7gikIls/yt_etaS7gikIls__sent000022.wav,/data/processed/segments/auto_20260624_090505/yt_etaS7gikIls/yt_etaS7gikIls__sent000022.txt,277.48,291.71,14.23,mi nói mày về má ba mày mua vé máy bay đi về thì ta hụi hết rồi đi má ba hả Mà hắn không có chịu hắn không có chịu mà hắn cứ không Cái thằng này đi rồi đi rồi ta chấm Không được rồi Ừm để kiểu chi mà ta mới hũ mà không có chiên cũng không hết trơn là răng của,vtt,ready,aligned,speech_clean,1.0,,https://www.youtube.com/watch?v=etaS7gikIls,Chuyện Vui Giọng Quảng Nam | Chuyện Cười Xứ Quảng @ ngaphanusa
yt_etaS7gikIls,etaS7gikIls,yt_etaS7gikIls__sent000023,/data/processed/segments/auto_20260624_090505/yt_etaS7gikIls/yt_etaS7gikIls__sent000023.wav,/data/processed/segments/auto_20260624_090505/yt_etaS7gikIls/yt_etaS7gikIls__sent000023.txt,289.84,304.73,14.89,không có chiên cũng không hết trơn là răng của cái chừng đó mà không hiểu nữa là răng thì cô gái nghe ông già Mình nói vậy thì Cô ôm bụng cười ngất ngây luôn thì ông già bà già cũng không hiểu chuyện gì mà,vtt,ready,aligned,speech_clean,1.0,,https://www.youtube.com/watch?v=etaS7gikIls,Chuyện Vui Giọng Quảng Nam | Chuyện Cười Xứ Quảng @ ngaphanusa
yt_etaS7gikIls,etaS7gikIls,yt_etaS7gikIls__sent000024,/data/processed/segments/auto_20260624_090505/yt_etaS7gikIls/yt_etaS7gikIls__sent000024.wav,/data/processed/segments/auto_20260624_090505/yt_etaS7gikIls/yt_etaS7gikIls__sent000024.txt,302.86,317.57,14.71,ông già bà già cũng không hiểu chuyện gì mà con gái mình nói lại cười đến vậy thì đến lượt cô gái mới giải thích cho chàng trai hiểu là không ba má em hỏi anh là anh đi ra bằng máy bay hay là anh đi,vtt,ready,aligned,speech_clean,1.0,,https://www.youtube.com/watch?v=etaS7gikIls,Chuyện Vui Giọng Quảng Nam | Chuyện Cười Xứ Quảng @ ngaphanusa
yt_etaS7gikIls,etaS7gikIls,yt_etaS7gikIls__sent000025,/data/processed/segments/auto_20260624_090505/yt_etaS7gikIls/yt_etaS7gikIls__sent000025.wav,/data/processed/segments/auto_20260624_090505/yt_etaS7gikIls/yt_etaS7gikIls__sent000025.txt,313.42,327.17,13.75,là anh đi ra bằng máy bay hay là anh đi xe đò thì chàng trai lúc này mới ngớ người ra thì mới trả lời Dạ liên tục thì sợ ông già vợ dẫn nên là cái Dạ con đi bằng máy bay con đi,vtt,ready,aligned,speech_clean,1.0,,https://www.youtube.com/watch?v=etaS7gikIls,Chuyện Vui Giọng Quảng Nam | Chuyện Cười Xứ Quảng @ ngaphanusa
yt_etaS7gikIls,etaS7gikIls,yt_etaS7gikIls__sent000026,/data/processed/segments/auto_20260624_090505/yt_etaS7gikIls/yt_etaS7gikIls__sent000026.wav,/data/processed/segments/auto_20260624_090505/yt_etaS7gikIls/yt_etaS7gikIls__sent000026.txt,325.059,341.51,16.451,nên là cái Dạ con đi bằng máy bay con đi bằng máy bay Cả nhà có biết không Thì cái từ Quảng Nam Á là má ba thì mình không có nói là giống như ở trong người miền Nam là nói bằng má hoặc,vtt,ready,aligned,speech_clean,1.0,,https://www.youtube.com/watch?v=etaS7gikIls,Chuyện Vui Giọng Quảng Nam | Chuyện Cười Xứ Quảng @ ngaphanusa
yt_etaS7gikIls,etaS7gikIls,yt_etaS7gikIls__sent000027,/data/processed/segments/auto_20260624_090505/yt_etaS7gikIls/yt_etaS7gikIls__sent000027.wav,/data/processed/segments/auto_20260624_090505/yt_etaS7gikIls/yt_etaS7gikIls__sent000027.txt,337.779,352.15,14.371,trong người miền Nam là nói bằng má hoặc là ba má nhưng mà ở người miền Trung thì cứ má ba má ba má ba thì giống như là máy bay vậy cả nhà máy bay,vtt,ready,aligned,speech_clean,1.0,,https://www.youtube.com/watch?v=etaS7gikIls,Chuyện Vui Giọng Quảng Nam | Chuyện Cười Xứ Quảng @ ngaphanusa
