audio_id,video_id,segment_id,segment_file,transcript_file,start,end,duration,text,transcript_source,transcript_status,vad_status,quality_label,quality_score,quality_reasons,source_url,title
yt_TEQDrCE3puc,TEQDrCE3puc,yt_TEQDrCE3puc__sent000036,/data/processed/segments/auto_20260624_090505/yt_TEQDrCE3puc/yt_TEQDrCE3puc__sent000036.wav,/data/processed/segments/auto_20260624_090505/yt_TEQDrCE3puc/yt_TEQDrCE3puc__sent000036.txt,355.16,368.27,13.11,Dạ lấp sấp nước chuẩn bị đổ ải Đây là thời điểm yêu thích của lũ mục đồng khi cho trâu bò thoải mái đi ăn để còn tụ tập mò cua Tát cá Chúng tôi đến một con,vtt,ready,aligned,speech_clean,1.0,,https://www.youtube.com/watch?v=TEQDrCE3puc,30 Phút Đọc Truyện Đêm Khuya VOV Đài Tiếng Nói Việt Nam | Gió Đồng Đêm Năm Ấy - TG: Hoàng Kiến Bình
yt_TEQDrCE3puc,TEQDrCE3puc,yt_TEQDrCE3puc__sent000037,/data/processed/segments/auto_20260624_090505/yt_TEQDrCE3puc/yt_TEQDrCE3puc__sent000037.wav,/data/processed/segments/auto_20260624_090505/yt_TEQDrCE3puc/yt_TEQDrCE3puc__sent000037.txt,363.64,380.029,16.389,tụ tập mò cua Tát cá Chúng tôi đến một con ngòi nối thông với sông hóa là nguồn cung cấp nước chính cho cánh đồng của làng chúng tôi cứ để nguyên quần áo lội xuống bắt đầu công việc loại rong chị em,vtt,ready,aligned,speech_clean,1.0,,https://www.youtube.com/watch?v=TEQDrCE3puc,30 Phút Đọc Truyện Đêm Khuya VOV Đài Tiếng Nói Việt Nam | Gió Đồng Đêm Năm Ấy - TG: Hoàng Kiến Bình
yt_TEQDrCE3puc,TEQDrCE3puc,yt_TEQDrCE3puc__sent000038,/data/processed/segments/auto_20260624_090505/yt_TEQDrCE3puc/yt_TEQDrCE3puc__sent000038.wav,/data/processed/segments/auto_20260624_090505/yt_TEQDrCE3puc/yt_TEQDrCE3puc__sent000038.txt,376.559,383.589,7.03,lội xuống bắt đầu công việc loại rong chị em tôi lấy là Tóc Tiên nước trong ngòi sâu,vtt,ready,aligned,speech_clean,1.0,,https://www.youtube.com/watch?v=TEQDrCE3puc,30 Phút Đọc Truyện Đêm Khuya VOV Đài Tiếng Nói Việt Nam | Gió Đồng Đêm Năm Ấy - TG: Hoàng Kiến Bình
yt_TEQDrCE3puc,TEQDrCE3puc,yt_TEQDrCE3puc__sent000039,/data/processed/segments/auto_20260624_090505/yt_TEQDrCE3puc/yt_TEQDrCE3puc__sent000039.wav,/data/processed/segments/auto_20260624_090505/yt_TEQDrCE3puc/yt_TEQDrCE3puc__sent000039.txt,379.839,394.79,14.951,chị em tôi lấy là Tóc Tiên nước trong ngòi sâu chỉ độ 1 mét nhưng muốn lấy rong thì phải cúi người ngập nước đến cổ luồn hai tay xuống đáy bùn nhổ từng cụm lên rũ cho sạch bùn Khi nào Chìa ra những bộ rễ,vtt,ready,aligned,speech_clean,1.0,,https://www.youtube.com/watch?v=TEQDrCE3puc,30 Phút Đọc Truyện Đêm Khuya VOV Đài Tiếng Nói Việt Nam | Gió Đồng Đêm Năm Ấy - TG: Hoàng Kiến Bình
yt_TEQDrCE3puc,TEQDrCE3puc,yt_TEQDrCE3puc__sent000040,/data/processed/segments/auto_20260624_090505/yt_TEQDrCE3puc/yt_TEQDrCE3puc__sent000040.wav,/data/processed/segments/auto_20260624_090505/yt_TEQDrCE3puc/yt_TEQDrCE3puc__sent000040.txt,391.839,401.469,9.63,rũ cho sạch bùn Khi nào Chìa ra những bộ rễ trắng ngần cùng búi rong dài hàng nửa mét thì cho vào rổ xề và đưa lên bờ hai,vtt,ready,aligned,speech_clean,1.0,,https://www.youtube.com/watch?v=TEQDrCE3puc,30 Phút Đọc Truyện Đêm Khuya VOV Đài Tiếng Nói Việt Nam | Gió Đồng Đêm Năm Ấy - TG: Hoàng Kiến Bình
yt_TEQDrCE3puc,TEQDrCE3puc,yt_TEQDrCE3puc__sent000041,/data/processed/segments/auto_20260624_090505/yt_TEQDrCE3puc/yt_TEQDrCE3puc__sent000041.wav,/data/processed/segments/auto_20260624_090505/yt_TEQDrCE3puc/yt_TEQDrCE3puc__sent000041.txt,396.96,411.99,15.03,nửa mét thì cho vào rổ xề và đưa lên bờ hai chị em rất vui vì gặp trúng đám rong mọc dày chải rộng loáng cái đã lấy được lượng lớn xếp đủ cho xe đạp thồ Trước,vtt,ready,aligned,speech_clean,1.0,,https://www.youtube.com/watch?v=TEQDrCE3puc,30 Phút Đọc Truyện Đêm Khuya VOV Đài Tiếng Nói Việt Nam | Gió Đồng Đêm Năm Ấy - TG: Hoàng Kiến Bình
yt_TEQDrCE3puc,TEQDrCE3puc,yt_TEQDrCE3puc__sent000042,/data/processed/segments/auto_20260624_090505/yt_TEQDrCE3puc/yt_TEQDrCE3puc__sent000042.wav,/data/processed/segments/auto_20260624_090505/yt_TEQDrCE3puc/yt_TEQDrCE3puc__sent000042.txt,408.16,426.15,17.99,được lượng lớn xếp đủ cho xe đạp thồ Trước khi lên bờ chúng tôi lội ra chỗ nước trong kỳ cọ bùn đất đột nhiên tôi thấy chị riêng rú lên rồi cứ nhảy như choi trên mặt nước Dũng ơi địa đa,vtt,ready,aligned,speech_clean,1.0,,https://www.youtube.com/watch?v=TEQDrCE3puc,30 Phút Đọc Truyện Đêm Khuya VOV Đài Tiếng Nói Việt Nam | Gió Đồng Đêm Năm Ấy - TG: Hoàng Kiến Bình
yt_TEQDrCE3puc,TEQDrCE3puc,yt_TEQDrCE3puc__sent000043,/data/processed/segments/auto_20260624_090505/yt_TEQDrCE3puc/yt_TEQDrCE3puc__sent000043.wav,/data/processed/segments/auto_20260624_090505/yt_TEQDrCE3puc/yt_TEQDrCE3puc__sent000043.txt,420.76,435.71,14.95,choi trên mặt nước Dũng ơi địa đa chị riêng cuống cuồng kêu lên tôi lao ra chỗ chị đâu Nó ở đâu lên bờ Mau chả cần,vtt,ready,aligned,speech_clean,1.0,,https://www.youtube.com/watch?v=TEQDrCE3puc,30 Phút Đọc Truyện Đêm Khuya VOV Đài Tiếng Nói Việt Nam | Gió Đồng Đêm Năm Ấy - TG: Hoàng Kiến Bình
yt_TEQDrCE3puc,TEQDrCE3puc,yt_TEQDrCE3puc__sent000044,/data/processed/segments/auto_20260624_090505/yt_TEQDrCE3puc/yt_TEQDrCE3puc__sent000044.wav,/data/processed/segments/auto_20260624_090505/yt_TEQDrCE3puc/yt_TEQDrCE3puc__sent000044.txt,429.92,443.11,13.19,ra chỗ chị đâu Nó ở đâu lên bờ Mau chả cần Tôi giục thì chị riêng đã lao lên bờ hai tay giữ ngực mặt tái mét vì sợ hãi tôi,vtt,ready,aligned,speech_clean,1.0,,https://www.youtube.com/watch?v=TEQDrCE3puc,30 Phút Đọc Truyện Đêm Khuya VOV Đài Tiếng Nói Việt Nam | Gió Đồng Đêm Năm Ấy - TG: Hoàng Kiến Bình
yt_TEQDrCE3puc,TEQDrCE3puc,yt_TEQDrCE3puc__sent000045,/data/processed/segments/auto_20260624_090505/yt_TEQDrCE3puc/yt_TEQDrCE3puc__sent000045.wav,/data/processed/segments/auto_20260624_090505/yt_TEQDrCE3puc/yt_TEQDrCE3puc__sent000045.txt,438.679,454.15,15.471,bờ hai tay giữ ngực mặt tái mét vì sợ hãi tôi hiểu ra sự tình trong lúc dìm mình xuống nước nhổ xong một con đa đã chui qua kẽ hở Trên Cổ Áo chị và cắm cái vòi tham lam vào cơ thể,vtt,ready,aligned,speech_clean,1.0,,https://www.youtube.com/watch?v=TEQDrCE3puc,30 Phút Đọc Truyện Đêm Khuya VOV Đài Tiếng Nói Việt Nam | Gió Đồng Đêm Năm Ấy - TG: Hoàng Kiến Bình
yt_TEQDrCE3puc,TEQDrCE3puc,yt_TEQDrCE3puc__sent000046,/data/processed/segments/auto_20260624_090505/yt_TEQDrCE3puc/yt_TEQDrCE3puc__sent000046.wav,/data/processed/segments/auto_20260624_090505/yt_TEQDrCE3puc/yt_TEQDrCE3puc__sent000046.txt,453.96,464.589,10.629,thể chị a chị phải cởi cái áo ra thì em mới bắt được chứ hai tay chị riêng run rẩy tuốt chiếc áo phông cổ tròn qua đầu,vtt,ready,aligned,speech_clean,1.0,,https://www.youtube.com/watch?v=TEQDrCE3puc,30 Phút Đọc Truyện Đêm Khuya VOV Đài Tiếng Nói Việt Nam | Gió Đồng Đêm Năm Ấy - TG: Hoàng Kiến Bình
yt_TEQDrCE3puc,TEQDrCE3puc,yt_TEQDrCE3puc__sent000047,/data/processed/segments/auto_20260624_090505/yt_TEQDrCE3puc/yt_TEQDrCE3puc__sent000047.wav,/data/processed/segments/auto_20260624_090505/yt_TEQDrCE3puc/yt_TEQDrCE3puc__sent000047.txt,464.399,477.869,13.47,đầu tôi cũng chết khiếp vì nhìn thấy con địa Châu đen xì to tướng bám chặt vào một bên Vú chỉ một đầu vòi của nó Khuất Sau lớp vải của chiếc áo xu chiêng có lẽ con,vtt,ready,aligned,speech_clean,1.0,,https://www.youtube.com/watch?v=TEQDrCE3puc,30 Phút Đọc Truyện Đêm Khuya VOV Đài Tiếng Nói Việt Nam | Gió Đồng Đêm Năm Ấy - TG: Hoàng Kiến Bình
yt_TEQDrCE3puc,TEQDrCE3puc,yt_TEQDrCE3puc__sent000048,/data/processed/segments/auto_20260624_090505/yt_TEQDrCE3puc/yt_TEQDrCE3puc__sent000048.wav,/data/processed/segments/auto_20260624_090505/yt_TEQDrCE3puc/yt_TEQDrCE3puc__sent000048.txt,473.679,485.029,11.35,Khuất Sau lớp vải của chiếc áo xu chiêng có lẽ con đĩa đã hút nhiều mắng thân hình Nó căng mọng lên chị riêng gần như lả đi vì sợ,vtt,ready,aligned,speech_clean,1.0,,https://www.youtube.com/watch?v=TEQDrCE3puc,30 Phút Đọc Truyện Đêm Khuya VOV Đài Tiếng Nói Việt Nam | Gió Đồng Đêm Năm Ấy - TG: Hoàng Kiến Bình
yt_TEQDrCE3puc,TEQDrCE3puc,yt_TEQDrCE3puc__sent000049,/data/processed/segments/auto_20260624_090505/yt_TEQDrCE3puc/yt_TEQDrCE3puc__sent000049.wav,/data/processed/segments/auto_20260624_090505/yt_TEQDrCE3puc/yt_TEQDrCE3puc__sent000049.txt,484.839,498.55,13.711,sợ tôi đưa tay gỡ một đầu của con đìa nó bám rất chắc phải dùng một lực mạnh mới được không thấy máu chảy ra Chắc đây là đầu rác bám tôi giật mạnh nhưng cái đầu,vtt,ready,aligned,speech_clean,1.0,,https://www.youtube.com/watch?v=TEQDrCE3puc,30 Phút Đọc Truyện Đêm Khuya VOV Đài Tiếng Nói Việt Nam | Gió Đồng Đêm Năm Ấy - TG: Hoàng Kiến Bình
yt_TEQDrCE3puc,TEQDrCE3puc,yt_TEQDrCE3puc__sent000050,/data/processed/segments/auto_20260624_090505/yt_TEQDrCE3puc/yt_TEQDrCE3puc__sent000050.wav,/data/processed/segments/auto_20260624_090505/yt_TEQDrCE3puc/yt_TEQDrCE3puc__sent000050.txt,494.6,511.35,16.75,là đầu rác bám tôi giật mạnh nhưng cái đầu hút máu bám chắc loà hoay kiểu gì vẫn không rời ra sau cùng tôi phải tóm phần thân của con đĩa qua lớp vải của chiếc áo xu chiêng giật con đỉa bị bật ra,vtt,ready,aligned,speech_clean,1.0,,https://www.youtube.com/watch?v=TEQDrCE3puc,30 Phút Đọc Truyện Đêm Khuya VOV Đài Tiếng Nói Việt Nam | Gió Đồng Đêm Năm Ấy - TG: Hoàng Kiến Bình
yt_TEQDrCE3puc,TEQDrCE3puc,yt_TEQDrCE3puc__sent000051,/data/processed/segments/auto_20260624_090505/yt_TEQDrCE3puc/yt_TEQDrCE3puc__sent000051.wav,/data/processed/segments/auto_20260624_090505/yt_TEQDrCE3puc/yt_TEQDrCE3puc__sent000051.txt,507.2,520.11,12.91,chiếc áo xu chiêng giật con đỉa bị bật ra nhưng không may chiếc áo xu chiêng cũng bị giật tung một dòng máu đỏ loang ra một bên vú từ chỗ mồm con đìa hút,vtt,ready,aligned,speech_clean,1.0,,https://www.youtube.com/watch?v=TEQDrCE3puc,30 Phút Đọc Truyện Đêm Khuya VOV Đài Tiếng Nói Việt Nam | Gió Đồng Đêm Năm Ấy - TG: Hoàng Kiến Bình
yt_TEQDrCE3puc,TEQDrCE3puc,yt_TEQDrCE3puc__sent000052,/data/processed/segments/auto_20260624_090505/yt_TEQDrCE3puc/yt_TEQDrCE3puc__sent000052.wav,/data/processed/segments/auto_20260624_090505/yt_TEQDrCE3puc/yt_TEQDrCE3puc__sent000052.txt,519.92,531.07,11.15,hút máu tôi như chết lặng lần đầu tiên trong đời tôi được nhìn thấy rõ ràng một bầu ngực con gái lồ lộ thấy rõ cả những mạch,vtt,ready,aligned,speech_clean,1.0,,https://www.youtube.com/watch?v=TEQDrCE3puc,30 Phút Đọc Truyện Đêm Khuya VOV Đài Tiếng Nói Việt Nam | Gió Đồng Đêm Năm Ấy - TG: Hoàng Kiến Bình
yt_TEQDrCE3puc,TEQDrCE3puc,yt_TEQDrCE3puc__sent000053,/data/processed/segments/auto_20260624_090505/yt_TEQDrCE3puc/yt_TEQDrCE3puc__sent000053.wav,/data/processed/segments/auto_20260624_090505/yt_TEQDrCE3puc/yt_TEQDrCE3puc__sent000053.txt,527.0,534.91,7.91,bầu ngực con gái lồ lộ thấy rõ cả những mạch máu xanh dưới làn da trắng nõn của cặp vú Thanh,vtt,ready,aligned,speech_clean,1.0,,https://www.youtube.com/watch?v=TEQDrCE3puc,30 Phút Đọc Truyện Đêm Khuya VOV Đài Tiếng Nói Việt Nam | Gió Đồng Đêm Năm Ấy - TG: Hoàng Kiến Bình
yt_TEQDrCE3puc,TEQDrCE3puc,yt_TEQDrCE3puc__sent000054,/data/processed/segments/auto_20260624_090505/yt_TEQDrCE3puc/yt_TEQDrCE3puc__sent000054.wav,/data/processed/segments/auto_20260624_090505/yt_TEQDrCE3puc/yt_TEQDrCE3puc__sent000054.txt,534.72,548.069,13.349,Thanh Tân xấu hổ tôi quay ra chỗ vừa ném con đĩa trong lúc chị riêng giật mình hoàn hồn Tìm mặc lại áo mặt chị cũng đỏ bừng lên vì,vtt,ready,aligned,speech_clean,1.0,,https://www.youtube.com/watch?v=TEQDrCE3puc,30 Phút Đọc Truyện Đêm Khuya VOV Đài Tiếng Nói Việt Nam | Gió Đồng Đêm Năm Ấy - TG: Hoàng Kiến Bình
yt_TEQDrCE3puc,TEQDrCE3puc,yt_TEQDrCE3puc__sent000055,/data/processed/segments/auto_20260624_090505/yt_TEQDrCE3puc/yt_TEQDrCE3puc__sent000055.wav,/data/processed/segments/auto_20260624_090505/yt_TEQDrCE3puc/yt_TEQDrCE3puc__sent000055.txt,547.879,551.949,4.07,vì ngượng Tôi bước vào năm học lớp 11 Thời,vtt,ready,aligned,speech_clean,1.0,,https://www.youtube.com/watch?v=TEQDrCE3puc,30 Phút Đọc Truyện Đêm Khuya VOV Đài Tiếng Nói Việt Nam | Gió Đồng Đêm Năm Ấy - TG: Hoàng Kiến Bình
yt_TEQDrCE3puc,TEQDrCE3puc,yt_TEQDrCE3puc__sent000056,/data/processed/segments/auto_20260624_090505/yt_TEQDrCE3puc/yt_TEQDrCE3puc__sent000056.wav,/data/processed/segments/auto_20260624_090505/yt_TEQDrCE3puc/yt_TEQDrCE3puc__sent000056.txt,547.879,565.03,17.151,vì ngượng Tôi bước vào năm học lớp 11 Thời gian này tôi ít gặp chị riêng nhưng hễ cứ có thời gian và biết tôi không bận học thế nào chị cũng dù tôi đi ra đồng làng khi thì bắt cua ốc hôm lại đi đánh rọng Xúc,vtt,ready,aligned,speech_clean,1.0,,https://www.youtube.com/watch?v=TEQDrCE3puc,30 Phút Đọc Truyện Đêm Khuya VOV Đài Tiếng Nói Việt Nam | Gió Đồng Đêm Năm Ấy - TG: Hoàng Kiến Bình
yt_TEQDrCE3puc,TEQDrCE3puc,yt_TEQDrCE3puc__sent000057,/data/processed/segments/auto_20260624_090505/yt_TEQDrCE3puc/yt_TEQDrCE3puc__sent000057.wav,/data/processed/segments/auto_20260624_090505/yt_TEQDrCE3puc/yt_TEQDrCE3puc__sent000057.txt,562.96,565.03,2.07,đánh rọng Xúc,vtt,ready,aligned,speech_clean,1.0,,https://www.youtube.com/watch?v=TEQDrCE3puc,30 Phút Đọc Truyện Đêm Khuya VOV Đài Tiếng Nói Việt Nam | Gió Đồng Đêm Năm Ấy - TG: Hoàng Kiến Bình
yt_TEQDrCE3puc,TEQDrCE3puc,yt_TEQDrCE3puc__sent000058,/data/processed/segments/auto_20260624_090505/yt_TEQDrCE3puc/yt_TEQDrCE3puc__sent000058.wav,/data/processed/segments/auto_20260624_090505/yt_TEQDrCE3puc/yt_TEQDrCE3puc__sent000058.txt,564.84,578.71,13.87,Xúc cá một thời gian sau tôi nghe Phong Thanh chuyện tình y chị và anh Cường có vấn đề lâu rồi không thấy chị kể chuyện về anh Cường Tôi cũng không tiện,vtt,ready,aligned,speech_clean,1.0,,https://www.youtube.com/watch?v=TEQDrCE3puc,30 Phút Đọc Truyện Đêm Khuya VOV Đài Tiếng Nói Việt Nam | Gió Đồng Đêm Năm Ấy - TG: Hoàng Kiến Bình
yt_TEQDrCE3puc,TEQDrCE3puc,yt_TEQDrCE3puc__sent000059,/data/processed/segments/auto_20260624_090505/yt_TEQDrCE3puc/yt_TEQDrCE3puc__sent000059.wav,/data/processed/segments/auto_20260624_090505/yt_TEQDrCE3puc/yt_TEQDrCE3puc__sent000059.txt,574.879,587.509,12.63,chuyện về anh Cường Tôi cũng không tiện hỏi Nguyên nhân là từ lão hoán bố chị lão hoán rất hay uống rượu bình thường,vtt,ready,aligned,speech_clean,1.0,,https://www.youtube.com/watch?v=TEQDrCE3puc,30 Phút Đọc Truyện Đêm Khuya VOV Đài Tiếng Nói Việt Nam | Gió Đồng Đêm Năm Ấy - TG: Hoàng Kiến Bình
yt_TEQDrCE3puc,TEQDrCE3puc,yt_TEQDrCE3puc__sent000060,/data/processed/segments/auto_20260624_090505/yt_TEQDrCE3puc/yt_TEQDrCE3puc__sent000060.wav,/data/processed/segments/auto_20260624_090505/yt_TEQDrCE3puc/yt_TEQDrCE3puc__sent000060.txt,584.0,597.19,13.19,chị lão hoán rất hay uống rượu bình thường lúc không rượu thì lão hoán là một nông dân cần cù chịu khó gia đình lão lúc nào cũng thuộc dạng kinh tế khá giả của làng,vtt,ready,aligned,speech_clean,1.0,,https://www.youtube.com/watch?v=TEQDrCE3puc,30 Phút Đọc Truyện Đêm Khuya VOV Đài Tiếng Nói Việt Nam | Gió Đồng Đêm Năm Ấy - TG: Hoàng Kiến Bình
yt_TEQDrCE3puc,TEQDrCE3puc,yt_TEQDrCE3puc__sent000061,/data/processed/segments/auto_20260624_090505/yt_TEQDrCE3puc/yt_TEQDrCE3puc__sent000061.wav,/data/processed/segments/auto_20260624_090505/yt_TEQDrCE3puc/yt_TEQDrCE3puc__sent000061.txt,593.56,608.509,14.949,nào cũng thuộc dạng kinh tế khá giả của làng nhưng khi say thì lão Như thnh một người khác cứ rượu vào là lão lèm bèm chửi vợ con bà chung mẹ chị riêng cũng vào dạng,vtt,ready,aligned,speech_clean,1.0,,https://www.youtube.com/watch?v=TEQDrCE3puc,30 Phút Đọc Truyện Đêm Khuya VOV Đài Tiếng Nói Việt Nam | Gió Đồng Đêm Năm Ấy - TG: Hoàng Kiến Bình
yt_TEQDrCE3puc,TEQDrCE3puc,yt_TEQDrCE3puc__sent000062,/data/processed/segments/auto_20260624_090505/yt_TEQDrCE3puc/yt_TEQDrCE3puc__sent000062.wav,/data/processed/segments/auto_20260624_090505/yt_TEQDrCE3puc/yt_TEQDrCE3puc__sent000062.txt,604.4,615.47,11.07,vợ con bà chung mẹ chị riêng cũng vào dạng đành hanh ghê gớm Lúc đầu cũng bốp chát lại thế là lão hoán cứ vớ cái gì đập cái,vtt,ready,aligned,speech_clean,1.0,,https://www.youtube.com/watch?v=TEQDrCE3puc,30 Phút Đọc Truyện Đêm Khuya VOV Đài Tiếng Nói Việt Nam | Gió Đồng Đêm Năm Ấy - TG: Hoàng Kiến Bình
yt_TEQDrCE3puc,TEQDrCE3puc,yt_TEQDrCE3puc__sent000063,/data/processed/segments/auto_20260624_090505/yt_TEQDrCE3puc/yt_TEQDrCE3puc__sent000063.wav,/data/processed/segments/auto_20260624_090505/yt_TEQDrCE3puc/yt_TEQDrCE3puc__sent000063.txt,612.04,618.509,6.469,chát lại thế là lão hoán cứ vớ cái gì đập cái đó đuổi đánh vợ làm náo loạn cả,vtt,ready,aligned,speech_clean,1.0,,https://www.youtube.com/watch?v=TEQDrCE3puc,30 Phút Đọc Truyện Đêm Khuya VOV Đài Tiếng Nói Việt Nam | Gió Đồng Đêm Năm Ấy - TG: Hoàng Kiến Bình
yt_TEQDrCE3puc,TEQDrCE3puc,yt_TEQDrCE3puc__sent000064,/data/processed/segments/auto_20260624_090505/yt_TEQDrCE3puc/yt_TEQDrCE3puc__sent000064.wav,/data/processed/segments/auto_20260624_090505/yt_TEQDrCE3puc/yt_TEQDrCE3puc__sent000064.txt,618.319,629.59,11.271,cả xóm sau mấy lần như vậy rút kinh nghiệm lão say cứ để cho lão chửi không ai chấp lời và lảng đi chỗ khác Chửi mãi thấy,vtt,ready,aligned,speech_clean,1.0,,https://www.youtube.com/watch?v=TEQDrCE3puc,30 Phút Đọc Truyện Đêm Khuya VOV Đài Tiếng Nói Việt Nam | Gió Đồng Đêm Năm Ấy - TG: Hoàng Kiến Bình
yt_TEQDrCE3puc,TEQDrCE3puc,yt_TEQDrCE3puc__sent000065,/data/processed/segments/auto_20260624_090505/yt_TEQDrCE3puc/yt_TEQDrCE3puc__sent000065.wav,/data/processed/segments/auto_20260624_090505/yt_TEQDrCE3puc/yt_TEQDrCE3puc__sent000065.txt,625.52,640.19,14.67,chấp lời và lảng đi chỗ khác Chửi mãi thấy chán lão hoán rời nhà đêm hôm mò mẫm đi Gõ Cửa nhà Những người đàn bà góa hoặc là nhỡ nhàng cũng có khi gặp được bà nào,vtt,ready,aligned,speech_clean,1.0,,https://www.youtube.com/watch?v=TEQDrCE3puc,30 Phút Đọc Truyện Đêm Khuya VOV Đài Tiếng Nói Việt Nam | Gió Đồng Đêm Năm Ấy - TG: Hoàng Kiến Bình
yt_TEQDrCE3puc,TEQDrCE3puc,yt_TEQDrCE3puc__sent000066,/data/processed/segments/auto_20260624_090505/yt_TEQDrCE3puc/yt_TEQDrCE3puc__sent000066.wav,/data/processed/segments/auto_20260624_090505/yt_TEQDrCE3puc/yt_TEQDrCE3puc__sent000066.txt,636.36,650.23,13.87,hoặc là nhỡ nhàng cũng có khi gặp được bà nào khát tình thì được mở cửa cho vào nhưng gặp phải những bà đàng hoàng và để chứng minh là người đoan chính thì các bà xỉa,vtt,ready,aligned,speech_clean,1.0,,https://www.youtube.com/watch?v=TEQDrCE3puc,30 Phút Đọc Truyện Đêm Khuya VOV Đài Tiếng Nói Việt Nam | Gió Đồng Đêm Năm Ấy - TG: Hoàng Kiến Bình
yt_TEQDrCE3puc,TEQDrCE3puc,yt_TEQDrCE3puc__sent000067,/data/processed/segments/auto_20260624_090505/yt_TEQDrCE3puc/yt_TEQDrCE3puc__sent000067.wav,/data/processed/segments/auto_20260624_090505/yt_TEQDrCE3puc/yt_TEQDrCE3puc__sent000067.txt,646.8,653.43,6.63,chứng minh là người đoan chính thì các bà xỉa sói Cho Cả làng cả tổng nghe đương nhiên,vtt,ready,aligned,speech_clean,1.0,,https://www.youtube.com/watch?v=TEQDrCE3puc,30 Phút Đọc Truyện Đêm Khuya VOV Đài Tiếng Nói Việt Nam | Gió Đồng Đêm Năm Ấy - TG: Hoàng Kiến Bình
yt_TEQDrCE3puc,TEQDrCE3puc,yt_TEQDrCE3puc__sent000068,/data/processed/segments/auto_20260624_090505/yt_TEQDrCE3puc/yt_TEQDrCE3puc__sent000068.wav,/data/processed/segments/auto_20260624_090505/yt_TEQDrCE3puc/yt_TEQDrCE3puc__sent000068.txt,650.04,668.15,18.11,xỉa sói Cho Cả làng cả tổng nghe đương nhiên là gia đình tử tế gia giáo lại có tí chức sắc như gia đình nhà bác cương bố anh Cường làm sao Muốn thông gia với thành phần đêm cứ như là mèo hoang chó dại gia đình Bắc Cương đã bắn tin hủy,vtt,ready,aligned,speech_clean,1.0,,https://www.youtube.com/watch?v=TEQDrCE3puc,30 Phút Đọc Truyện Đêm Khuya VOV Đài Tiếng Nói Việt Nam | Gió Đồng Đêm Năm Ấy - TG: Hoàng Kiến Bình
yt_TEQDrCE3puc,TEQDrCE3puc,yt_TEQDrCE3puc__sent000069,/data/processed/segments/auto_20260624_090505/yt_TEQDrCE3puc/yt_TEQDrCE3puc__sent000069.wav,/data/processed/segments/auto_20260624_090505/yt_TEQDrCE3puc/yt_TEQDrCE3puc__sent000069.txt,663.6,679.47,15.87,chó dại gia đình Bắc Cương đã bắn tin hủy hôn một hôm chị riêng rủ tôi ra bờ đập nơi có hàng phi lao chỗ lấy rong dạo trước rồi chị khóc vừa khóc vừa gấp,vtt,ready,aligned,speech_clean,1.0,,https://www.youtube.com/watch?v=TEQDrCE3puc,30 Phút Đọc Truyện Đêm Khuya VOV Đài Tiếng Nói Việt Nam | Gió Đồng Đêm Năm Ấy - TG: Hoàng Kiến Bình
yt_TEQDrCE3puc,TEQDrCE3puc,yt_TEQDrCE3puc__sent000070,/data/processed/segments/auto_20260624_090505/yt_TEQDrCE3puc/yt_TEQDrCE3puc__sent000070.wav,/data/processed/segments/auto_20260624_090505/yt_TEQDrCE3puc/yt_TEQDrCE3puc__sent000070.txt,675.04,688.19,13.15,dạo trước rồi chị khóc vừa khóc vừa gấp những bức thư mà anh Cường Gửi cho chị thành những con thuyền giấy và thả trôi trên dòng nước rồi tôi nghe tin chị,vtt,ready,aligned,speech_clean,1.0,,https://www.youtube.com/watch?v=TEQDrCE3puc,30 Phút Đọc Truyện Đêm Khuya VOV Đài Tiếng Nói Việt Nam | Gió Đồng Đêm Năm Ấy - TG: Hoàng Kiến Bình
yt_TEQDrCE3puc,TEQDrCE3puc,yt_TEQDrCE3puc__sent000071,/data/processed/segments/auto_20260624_090505/yt_TEQDrCE3puc/yt_TEQDrCE3puc__sent000071.wav,/data/processed/segments/auto_20260624_090505/yt_TEQDrCE3puc/yt_TEQDrCE3puc__sent000071.txt,684.199,697.269,13.07,trôi trên dòng nước rồi tôi nghe tin chị riêng sách đi ngỗng và các đồ lễ mà ngày trước anh Cường đã đem đến nhà chị hôm Tết Đoan Ngọ đến trả cho nhà bác cương,vtt,ready,aligned,speech_clean,1.0,,https://www.youtube.com/watch?v=TEQDrCE3puc,30 Phút Đọc Truyện Đêm Khuya VOV Đài Tiếng Nói Việt Nam | Gió Đồng Đêm Năm Ấy - TG: Hoàng Kiến Bình
yt_TEQDrCE3puc,TEQDrCE3puc,yt_TEQDrCE3puc__sent000072,/data/processed/segments/auto_20260624_090505/yt_TEQDrCE3puc/yt_TEQDrCE3puc__sent000072.wav,/data/processed/segments/auto_20260624_090505/yt_TEQDrCE3puc/yt_TEQDrCE3puc__sent000072.txt,697.079,709.99,12.911,cương Chiều tối hôm ấy tôi đến nhà chị riêng để xác nhận cái tin chị trả lễ gây xôn xao làng trên xóm dưới cửa nhà mở nhưng trong nhà Ngoài sân vắng tanh đoán lão,vtt,ready,aligned,speech_clean,1.0,,https://www.youtube.com/watch?v=TEQDrCE3puc,30 Phút Đọc Truyện Đêm Khuya VOV Đài Tiếng Nói Việt Nam | Gió Đồng Đêm Năm Ấy - TG: Hoàng Kiến Bình
yt_TEQDrCE3puc,TEQDrCE3puc,yt_TEQDrCE3puc__sent000073,/data/processed/segments/auto_20260624_090505/yt_TEQDrCE3puc/yt_TEQDrCE3puc__sent000073.wav,/data/processed/segments/auto_20260624_090505/yt_TEQDrCE3puc/yt_TEQDrCE3puc__sent000073.txt,706.079,723.19,17.111,nhưng trong nhà Ngoài sân vắng tanh đoán lão hoán lại say rượu Tôi toan về bỗng dưng nghe thấy tiếng ú ớ phía sau nhà tắm chỗ bờ giếng Tôi nghe thấy tiếng chị riêng khóc lóc van xin con xin bố đừng làm,vtt,ready,aligned,speech_clean,1.0,,https://www.youtube.com/watch?v=TEQDrCE3puc,30 Phút Đọc Truyện Đêm Khuya VOV Đài Tiếng Nói Việt Nam | Gió Đồng Đêm Năm Ấy - TG: Hoàng Kiến Bình
yt_TEQDrCE3puc,TEQDrCE3puc,yt_TEQDrCE3puc__sent000074,/data/processed/segments/auto_20260624_090505/yt_TEQDrCE3puc/yt_TEQDrCE3puc__sent000074.wav,/data/processed/segments/auto_20260624_090505/yt_TEQDrCE3puc/yt_TEQDrCE3puc__sent000074.txt,718.6,735.15,16.55,riêng khóc lóc van xin con xin bố đừng làm thế mày Chiều bố một tí thì có sao rồi tiếng chị riêng kêu cứu như bị nghẹn lại tôi xô cửa nhà tắm xông vào,vtt,ready,aligned,speech_clean,1.0,,https://www.youtube.com/watch?v=TEQDrCE3puc,30 Phút Đọc Truyện Đêm Khuya VOV Đài Tiếng Nói Việt Nam | Gió Đồng Đêm Năm Ấy - TG: Hoàng Kiến Bình
