audio_id,video_id,segment_id,segment_file,transcript_file,start,end,duration,text,transcript_source,transcript_status,vad_status,quality_label,quality_score,quality_reasons,source_url,title
yt_ZeGMfv2lZQA,ZeGMfv2lZQA,yt_ZeGMfv2lZQA__sent000121,/data/processed/segments/auto_20260624_082536/yt_ZeGMfv2lZQA/yt_ZeGMfv2lZQA__sent000121.wav,/data/processed/segments/auto_20260624_082536/yt_ZeGMfv2lZQA/yt_ZeGMfv2lZQA__sent000121.txt,1334.52,1349.39,14.87,phổ thông. Bộ Y tế vừa có văn bản gửi Ủy ban nhân dân các tỉnh thành phố trực thuộc Trung ương về việc tăng cường công tác phòng chống tai nạn thượng tích và phòng chống đổi nước trẻ em trong dịp hè mùa mơ bảo năm 2026 nhất là tại các khu vực sông,vtt,ready,aligned,speech_clean,1.0,,https://www.youtube.com/watch?v=ZeGMfv2lZQA,Thời sự trưa 20/05/2026 || “THÁNG NGHE DÂN NÓI” - DIỄN ĐÀN THÁO GỠ NHỮNG VẤN ĐỀ “NÓNG” TẠI TP. HUẾ
yt_ZeGMfv2lZQA,ZeGMfv2lZQA,yt_ZeGMfv2lZQA__sent000122,/data/processed/segments/auto_20260624_082536/yt_ZeGMfv2lZQA/yt_ZeGMfv2lZQA__sent000122.wav,/data/processed/segments/auto_20260624_082536/yt_ZeGMfv2lZQA/yt_ZeGMfv2lZQA__sent000122.txt,1346.16,1355.39,9.23,"bảo năm 2026 nhất là tại các khu vực sông suối, ao hồ vùng gặp luộc công trình chởa nước và các điểm vui chơi tự phát.",vtt,ready,aligned,speech_clean,1.0,,https://www.youtube.com/watch?v=ZeGMfv2lZQA,Thời sự trưa 20/05/2026 || “THÁNG NGHE DÂN NÓI” - DIỄN ĐÀN THÁO GỠ NHỮNG VẤN ĐỀ “NÓNG” TẠI TP. HUẾ
yt_ZeGMfv2lZQA,ZeGMfv2lZQA,yt_ZeGMfv2lZQA__sent000123,/data/processed/segments/auto_20260624_082536/yt_ZeGMfv2lZQA/yt_ZeGMfv2lZQA__sent000123.wav,/data/processed/segments/auto_20260624_082536/yt_ZeGMfv2lZQA/yt_ZeGMfv2lZQA__sent000123.txt,1351.28,1367.269,15.989,"công trình chởa nước và các điểm vui chơi tự phát. Bối y tế yêu cầu tăng cường truyền thông giáo dục nhằm nâng cao nhận thức, trách nhiệm của gia đình, nhà trường và cộng đồng, đồng thời cảnh báo sớm các nguy cơ tai nạn trong dịp hè và mùa mưa bảo, hướng dẫn trẻ em kỹ năng an toàn, kỹ",vtt,ready,aligned,speech_clean,1.0,,https://www.youtube.com/watch?v=ZeGMfv2lZQA,Thời sự trưa 20/05/2026 || “THÁNG NGHE DÂN NÓI” - DIỄN ĐÀN THÁO GỠ NHỮNG VẤN ĐỀ “NÓNG” TẠI TP. HUẾ
yt_ZeGMfv2lZQA,ZeGMfv2lZQA,yt_ZeGMfv2lZQA__sent000124,/data/processed/segments/auto_20260624_082536/yt_ZeGMfv2lZQA/yt_ZeGMfv2lZQA__sent000124.wav,/data/processed/segments/auto_20260624_082536/yt_ZeGMfv2lZQA/yt_ZeGMfv2lZQA__sent000124.txt,1364.959,1380.269,15.31,"bảo, hướng dẫn trẻ em kỹ năng an toàn, kỹ năng phòm tránh đuổi nước và kỹ năng ứng phó khi gặp tình huống nguy hiểm. Các địa phương cũng cần ra soát, phát hiện và khắc phục kịp thời các khu vực có nguy cơ cao như ao hồ, sông suối, hồ nước, vùng ngập sâu, công trình xây",vtt,ready,aligned,speech_clean,1.0,,https://www.youtube.com/watch?v=ZeGMfv2lZQA,Thời sự trưa 20/05/2026 || “THÁNG NGHE DÂN NÓI” - DIỄN ĐÀN THÁO GỠ NHỮNG VẤN ĐỀ “NÓNG” TẠI TP. HUẾ
yt_ZeGMfv2lZQA,ZeGMfv2lZQA,yt_ZeGMfv2lZQA__sent000125,/data/processed/segments/auto_20260624_082536/yt_ZeGMfv2lZQA/yt_ZeGMfv2lZQA__sent000125.wav,/data/processed/segments/auto_20260624_082536/yt_ZeGMfv2lZQA/yt_ZeGMfv2lZQA__sent000125.txt,1378.04,1390.71,12.67,"hồ nước, vùng ngập sâu, công trình xây dựng, công trình chữa nước. Đồng thời thực hiện việc cắm biển cảnh báo, ro chắng, tăng cường kiểm tra và bố trí lực lượng nhắc nhở tại các điểm nguy hiểm. Bên cạnh đó, Bộ Y tế nhận mạnh việc tổ",vtt,ready,aligned,speech_clean,1.0,,https://www.youtube.com/watch?v=ZeGMfv2lZQA,Thời sự trưa 20/05/2026 || “THÁNG NGHE DÂN NÓI” - DIỄN ĐÀN THÁO GỠ NHỮNG VẤN ĐỀ “NÓNG” TẠI TP. HUẾ
yt_ZeGMfv2lZQA,ZeGMfv2lZQA,yt_ZeGMfv2lZQA__sent000126,/data/processed/segments/auto_20260624_082536/yt_ZeGMfv2lZQA/yt_ZeGMfv2lZQA__sent000126.wav,/data/processed/segments/auto_20260624_082536/yt_ZeGMfv2lZQA/yt_ZeGMfv2lZQA__sent000126.txt,1388.52,1403.23,14.71,"hiểm. Bên cạnh đó, Bộ Y tế nhận mạnh việc tổ chức các hoạt động hè an toàn làm mạnh cho trẻ em, khuyến khích dài bơi an toàn và trang bị kỹ năng sinh tồn giữa nước, kỹ năng phòng tránh tai nạn thương tích và thiên tai mưa bảo. Các địa phương ưu tiên triển khai cho trẻ em vùng khó khăn",vtt,ready,aligned,speech_clean,1.0,,https://www.youtube.com/watch?v=ZeGMfv2lZQA,Thời sự trưa 20/05/2026 || “THÁNG NGHE DÂN NÓI” - DIỄN ĐÀN THÁO GỠ NHỮNG VẤN ĐỀ “NÓNG” TẠI TP. HUẾ
yt_ZeGMfv2lZQA,ZeGMfv2lZQA,yt_ZeGMfv2lZQA__sent000127,/data/processed/segments/auto_20260624_082536/yt_ZeGMfv2lZQA/yt_ZeGMfv2lZQA__sent000127.wav,/data/processed/segments/auto_20260624_082536/yt_ZeGMfv2lZQA/yt_ZeGMfv2lZQA__sent000127.txt,1400.959,1409.87,8.911,phương ưu tiên triển khai cho trẻ em vùng khó khăn và khu vực thường xuyên xảy ra đuổi nước nhằm giảm thiểu thấp nhất các vụ tai nạn đáng tiếc.,vtt,ready,aligned,speech_clean,1.0,,https://www.youtube.com/watch?v=ZeGMfv2lZQA,Thời sự trưa 20/05/2026 || “THÁNG NGHE DÂN NÓI” - DIỄN ĐÀN THÁO GỠ NHỮNG VẤN ĐỀ “NÓNG” TẠI TP. HUẾ
yt_ZeGMfv2lZQA,ZeGMfv2lZQA,yt_ZeGMfv2lZQA__sent000128,/data/processed/segments/auto_20260624_082536/yt_ZeGMfv2lZQA/yt_ZeGMfv2lZQA__sent000128.wav,/data/processed/segments/auto_20260624_082536/yt_ZeGMfv2lZQA/yt_ZeGMfv2lZQA__sent000128.txt,1409.68,1422.11,12.43,tiếc. Bây giờ là những thông tin về thừa tiết trong ngày. Do chịu ảnh hưởng của rảnh áp tấp có trục quả Bắc Bộ hoạt động yếu nên thành phố Huế ngày hôm nay mê thay đổi đến,vtt,ready,aligned,speech_clean,1.0,,https://www.youtube.com/watch?v=ZeGMfv2lZQA,Thời sự trưa 20/05/2026 || “THÁNG NGHE DÂN NÓI” - DIỄN ĐÀN THÁO GỠ NHỮNG VẤN ĐỀ “NÓNG” TẠI TP. HUẾ
yt_ZeGMfv2lZQA,ZeGMfv2lZQA,yt_ZeGMfv2lZQA__sent000129,/data/processed/segments/auto_20260624_082536/yt_ZeGMfv2lZQA/yt_ZeGMfv2lZQA__sent000129.wav,/data/processed/segments/auto_20260624_082536/yt_ZeGMfv2lZQA/yt_ZeGMfv2lZQA__sent000129.txt,1420.359,1435.71,15.351,"nên thành phố Huế ngày hôm nay mê thay đổi đến nhiều mây ngày nắng. Chiều tối và đêm có mưa rào và dông rã rác. Trong cơn dông cần đề phòng lúc sét mưa đá, mưa lớn cùng bộ và gió giật mạnh. Nhiệt độ cao nhất trong ngày dao động nhẹ phổ biến từ 33 đến 35 độ vùng núi các xã a lưỡi 31",vtt,ready,aligned,speech_clean,1.0,,https://www.youtube.com/watch?v=ZeGMfv2lZQA,Thời sự trưa 20/05/2026 || “THÁNG NGHE DÂN NÓI” - DIỄN ĐÀN THÁO GỠ NHỮNG VẤN ĐỀ “NÓNG” TẠI TP. HUẾ
yt_ZeGMfv2lZQA,ZeGMfv2lZQA,yt_ZeGMfv2lZQA__sent000130,/data/processed/segments/auto_20260624_082536/yt_ZeGMfv2lZQA/yt_ZeGMfv2lZQA__sent000130.wav,/data/processed/segments/auto_20260624_082536/yt_ZeGMfv2lZQA/yt_ZeGMfv2lZQA__sent000130.txt,1432.0,1446.43,14.43,"từ 33 đến 35 độ vùng núi các xã a lưỡi 31 đến 33 độ. Nhiệt độ thẩm nhất đêm nay phổ biến từ 25 đến 27 độ, vùng núi các xã a [âm nhạc] lưỡi 22 đến 24 độ ẩm 60 đến 97%. Thời tiết biển có mưa rào và",vtt,ready,aligned,speech_clean,1.0,,https://www.youtube.com/watch?v=ZeGMfv2lZQA,Thời sự trưa 20/05/2026 || “THÁNG NGHE DÂN NÓI” - DIỄN ĐÀN THÁO GỠ NHỮNG VẤN ĐỀ “NÓNG” TẠI TP. HUẾ
yt_ZeGMfv2lZQA,ZeGMfv2lZQA,yt_ZeGMfv2lZQA__sent000131,/data/processed/segments/auto_20260624_082536/yt_ZeGMfv2lZQA/yt_ZeGMfv2lZQA__sent000131.wav,/data/processed/segments/auto_20260624_082536/yt_ZeGMfv2lZQA/yt_ZeGMfv2lZQA__sent000131.txt,1443.44,1458.11,14.67,"60 đến 97%. Thời tiết biển có mưa rào và dông và nơi giỏ đông đến đông nam cấp 3 cấp 4 sóng biển cao từ 0,25 đến [âm nhạc] 1,25 m tình trạng biển bình thường",vtt,ready,aligned,speech_clean,1.0,,https://www.youtube.com/watch?v=ZeGMfv2lZQA,Thời sự trưa 20/05/2026 || “THÁNG NGHE DÂN NÓI” - DIỄN ĐÀN THÁO GỠ NHỮNG VẤN ĐỀ “NÓNG” TẠI TP. HUẾ
yt_ZeGMfv2lZQA,ZeGMfv2lZQA,yt_ZeGMfv2lZQA__sent000132,/data/processed/segments/auto_20260624_082536/yt_ZeGMfv2lZQA/yt_ZeGMfv2lZQA__sent000132.wav,/data/processed/segments/auto_20260624_082536/yt_ZeGMfv2lZQA/yt_ZeGMfv2lZQA__sent000132.txt,1452.76,1469.47,16.71,bình thường phần của chương trình là những tin tức quốc tế. Quân đội Iran ngày 19 tháng 5 cảnh báo sẽ mở các mặt trờn mới đạp trạm Mỹ nếu Washington nổi lại các cuộc tấn công nhằm vào nước này.,vtt,ready,aligned,speech_clean,1.0,,https://www.youtube.com/watch?v=ZeGMfv2lZQA,Thời sự trưa 20/05/2026 || “THÁNG NGHE DÂN NÓI” - DIỄN ĐÀN THÁO GỠ NHỮNG VẤN ĐỀ “NÓNG” TẠI TP. HUẾ
yt_ZeGMfv2lZQA,ZeGMfv2lZQA,yt_ZeGMfv2lZQA__sent000133,/data/processed/segments/auto_20260624_082536/yt_ZeGMfv2lZQA/yt_ZeGMfv2lZQA__sent000133.wav,/data/processed/segments/auto_20260624_082536/yt_ZeGMfv2lZQA/yt_ZeGMfv2lZQA__sent000133.txt,1466.079,1480.99,14.911,cuộc tấn công nhằm vào nước này. Người phát ngôn quân đội Iran Mohammad Akaminia khẳng định nếu đối thủ tiến hành động gây hấn Iran sẽ mở các mặt trận mới với các biện pháp mới. Theo ông Iran đã sử dụng quảng thời gian,vtt,ready,aligned,speech_clean,1.0,,https://www.youtube.com/watch?v=ZeGMfv2lZQA,Thời sự trưa 20/05/2026 || “THÁNG NGHE DÂN NÓI” - DIỄN ĐÀN THÁO GỠ NHỮNG VẤN ĐỀ “NÓNG” TẠI TP. HUẾ
yt_ZeGMfv2lZQA,ZeGMfv2lZQA,yt_ZeGMfv2lZQA__sent000134,/data/processed/segments/auto_20260624_082536/yt_ZeGMfv2lZQA/yt_ZeGMfv2lZQA__sent000134.wav,/data/processed/segments/auto_20260624_082536/yt_ZeGMfv2lZQA/yt_ZeGMfv2lZQA__sent000134.txt,1479.0,1493.87,14.87,"Theo ông Iran đã sử dụng quảng thời gian lượng bắn để tăng cường năng lực chiến đấu. Ngoài ra, ông Araminia khẳng định Iran sẽ tiếp tục quản lý eo biển Hotmood, đồng thời cho rằng Mỹ có ý sự lựa chọn ngoài việc tôn trọng Iran và tuân thủ các quyền hợp pháp của nước",vtt,ready,aligned,speech_clean,1.0,,https://www.youtube.com/watch?v=ZeGMfv2lZQA,Thời sự trưa 20/05/2026 || “THÁNG NGHE DÂN NÓI” - DIỄN ĐÀN THÁO GỠ NHỮNG VẤN ĐỀ “NÓNG” TẠI TP. HUẾ
yt_ZeGMfv2lZQA,ZeGMfv2lZQA,yt_ZeGMfv2lZQA__sent000135,/data/processed/segments/auto_20260624_082536/yt_ZeGMfv2lZQA/yt_ZeGMfv2lZQA__sent000135.wav,/data/processed/segments/auto_20260624_082536/yt_ZeGMfv2lZQA/yt_ZeGMfv2lZQA__sent000135.txt,1491.92,1506.909,14.989,"và tuân thủ các quyền hợp pháp của nước Cộng hòa Hội giáo. Duyên bộ trên được đưa ra sau khi Tổng thống Mỹ Donald Trump tuyên bố hủy kế hoạch tận công Iran vào ngày 19 tháng , sau khi lãnh đạo ba nước khu vực Trung Đồng đề nghị ông tạm hoảng. Liên quan tới các nỗ lực",vtt,ready,aligned,speech_clean,1.0,,https://www.youtube.com/watch?v=ZeGMfv2lZQA,Thời sự trưa 20/05/2026 || “THÁNG NGHE DÂN NÓI” - DIỄN ĐÀN THÁO GỠ NHỮNG VẤN ĐỀ “NÓNG” TẠI TP. HUẾ
yt_ZeGMfv2lZQA,ZeGMfv2lZQA,yt_ZeGMfv2lZQA__sent000136,/data/processed/segments/auto_20260624_082536/yt_ZeGMfv2lZQA/yt_ZeGMfv2lZQA__sent000136.wav,/data/processed/segments/auto_20260624_082536/yt_ZeGMfv2lZQA/yt_ZeGMfv2lZQA__sent000136.txt,1504.079,1517.389,13.31,"nghị ông tạm hoảng. Liên quan tới các nỗ lực ngoại giao nhằm thúc đẩy một thỏa thuận giữa Mỹ và Iran, Bộ Ngoại giao Qatar cùng ngà nhấn mạnh cần có thêm thời gian cho các nỗ lực trung gian mà Pakistan đang tiến hành để thúc đẩy đổi thoại",vtt,ready,aligned,speech_clean,1.0,,https://www.youtube.com/watch?v=ZeGMfv2lZQA,Thời sự trưa 20/05/2026 || “THÁNG NGHE DÂN NÓI” - DIỄN ĐÀN THÁO GỠ NHỮNG VẤN ĐỀ “NÓNG” TẠI TP. HUẾ
yt_ZeGMfv2lZQA,ZeGMfv2lZQA,yt_ZeGMfv2lZQA__sent000137,/data/processed/segments/auto_20260624_082536/yt_ZeGMfv2lZQA/yt_ZeGMfv2lZQA__sent000137.wav,/data/processed/segments/auto_20260624_082536/yt_ZeGMfv2lZQA/yt_ZeGMfv2lZQA__sent000137.txt,1515.32,1530.63,15.31,Pakistan đang tiến hành để thúc đẩy đổi thoại giữa Teheran và Washington. Qatar cũng bày tỏ ủng hộ các nỗ lực ngoại giao đang được Pakistan thực hiện khi thể hiện sự nghiêm túc trong việc đưa các bên lại gần nhau và tìm kiếm giải pháp.,vtt,ready,aligned,speech_clean,1.0,,https://www.youtube.com/watch?v=ZeGMfv2lZQA,Thời sự trưa 20/05/2026 || “THÁNG NGHE DÂN NÓI” - DIỄN ĐÀN THÁO GỠ NHỮNG VẤN ĐỀ “NÓNG” TẠI TP. HUẾ
yt_ZeGMfv2lZQA,ZeGMfv2lZQA,yt_ZeGMfv2lZQA__sent000138,/data/processed/segments/auto_20260624_082536/yt_ZeGMfv2lZQA/yt_ZeGMfv2lZQA__sent000138.wav,/data/processed/segments/auto_20260624_082536/yt_ZeGMfv2lZQA/yt_ZeGMfv2lZQA__sent000138.txt,1526.16,1542.87,16.71,bên lại gần nhau và tìm kiếm giải pháp. Nghị viện Châu Âu ngày 19 tháng 5 đã thông qua quyết định tăng cấp đôi thủy quang đối với thép nhập khẩu nhằm bảo vệ ngành thép đang gặp khó khăn của liên minh châu Âu trở thép giá rẻ từ Trung Quốc.,vtt,ready,aligned,speech_clean,1.0,,https://www.youtube.com/watch?v=ZeGMfv2lZQA,Thời sự trưa 20/05/2026 || “THÁNG NGHE DÂN NÓI” - DIỄN ĐÀN THÁO GỠ NHỮNG VẤN ĐỀ “NÓNG” TẠI TP. HUẾ
yt_ZeGMfv2lZQA,ZeGMfv2lZQA,yt_ZeGMfv2lZQA__sent000139,/data/processed/segments/auto_20260624_082536/yt_ZeGMfv2lZQA/yt_ZeGMfv2lZQA__sent000139.wav,/data/processed/segments/auto_20260624_082536/yt_ZeGMfv2lZQA/yt_ZeGMfv2lZQA__sent000139.txt,1539.64,1555.149,15.509,"từ Trung Quốc. >> Với tỉ lệ 606 phiếu thuận và 16 phiếu chống, các nhà lập pháp EU đã thông qua kế hoạch nâng thuế nhập khẩu thép lên 50% đồng thời cắt giảm 47% khối lượng thép được phép nhập khẩu trước khi bị áp",vtt,ready,aligned,speech_clean,1.0,,https://www.youtube.com/watch?v=ZeGMfv2lZQA,Thời sự trưa 20/05/2026 || “THÁNG NGHE DÂN NÓI” - DIỄN ĐÀN THÁO GỠ NHỮNG VẤN ĐỀ “NÓNG” TẠI TP. HUẾ
yt_ZeGMfv2lZQA,ZeGMfv2lZQA,yt_ZeGMfv2lZQA__sent000140,/data/processed/segments/auto_20260624_082536/yt_ZeGMfv2lZQA/yt_ZeGMfv2lZQA__sent000140.wav,/data/processed/segments/auto_20260624_082536/yt_ZeGMfv2lZQA/yt_ZeGMfv2lZQA__sent000140.txt,1552.8,1568.35,15.55,"khối lượng thép được phép nhập khẩu trước khi bị áp thuế. Theo các biện pháp mới, hàng ngạch nhập khẩu miễn thuế sẽ giảm xuống còn 18,3 triệu tấn mỗi năm, tương đương tổng lượng thép mà EU nhập khẩu trong năm 2013. EU lựa chọn mất thời gian năm 2013",vtt,ready,aligned,speech_clean,1.0,,https://www.youtube.com/watch?v=ZeGMfv2lZQA,Thời sự trưa 20/05/2026 || “THÁNG NGHE DÂN NÓI” - DIỄN ĐÀN THÁO GỠ NHỮNG VẤN ĐỀ “NÓNG” TẠI TP. HUẾ
yt_ZeGMfv2lZQA,ZeGMfv2lZQA,yt_ZeGMfv2lZQA__sent000141,/data/processed/segments/auto_20260624_082536/yt_ZeGMfv2lZQA/yt_ZeGMfv2lZQA__sent000141.wav,/data/processed/segments/auto_20260624_082536/yt_ZeGMfv2lZQA/yt_ZeGMfv2lZQA__sent000141.txt,1564.4,1579.149,14.749,"năm 2013. EU lựa chọn mất thời gian năm 2013 vì cho rằng thị trường bắt đầu mất cân bằng từ thời điểm đó do tình trạng dư thừa sản xuất chủ yếu liên quan tới Trung Quốc, quốc gia hiện sản xuất hơn một nửa lượng thép toàn cầu. Các nghị sĩ",vtt,ready,aligned,speech_clean,1.0,,https://www.youtube.com/watch?v=ZeGMfv2lZQA,Thời sự trưa 20/05/2026 || “THÁNG NGHE DÂN NÓI” - DIỄN ĐÀN THÁO GỠ NHỮNG VẤN ĐỀ “NÓNG” TẠI TP. HUẾ
yt_ZeGMfv2lZQA,ZeGMfv2lZQA,yt_ZeGMfv2lZQA__sent000142,/data/processed/segments/auto_20260624_082536/yt_ZeGMfv2lZQA/yt_ZeGMfv2lZQA__sent000142.wav,/data/processed/segments/auto_20260624_082536/yt_ZeGMfv2lZQA/yt_ZeGMfv2lZQA__sent000142.txt,1576.16,1591.549,15.389,"hơn một nửa lượng thép toàn cầu. Các nghị sĩ thúc đẩy kế hoạch trên cho rằng Châu Âu cần một ngành công nghiệp mạnh, có khả năng cạnh tranh và việc chống lại các tác động thương mại tiêu cực do dư thừa công suất toàn cầu là điều yếu. Các biện pháp này sẽ chính thức trở thành luật",vtt,ready,aligned,speech_clean,1.0,,https://www.youtube.com/watch?v=ZeGMfv2lZQA,Thời sự trưa 20/05/2026 || “THÁNG NGHE DÂN NÓI” - DIỄN ĐÀN THÁO GỠ NHỮNG VẤN ĐỀ “NÓNG” TẠI TP. HUẾ
yt_ZeGMfv2lZQA,ZeGMfv2lZQA,yt_ZeGMfv2lZQA__sent000143,/data/processed/segments/auto_20260624_082536/yt_ZeGMfv2lZQA/yt_ZeGMfv2lZQA__sent000143.wav,/data/processed/segments/auto_20260624_082536/yt_ZeGMfv2lZQA/yt_ZeGMfv2lZQA__sent000143.txt,1589.599,1598.63,9.031,Các biện pháp này sẽ chính thức trở thành luật sau khi được các nữ thành viên EU về chuẩn và dự kiện có hiệu lực từ ngày 01 tháng tới.,vtt,ready,aligned,speech_clean,1.0,,https://www.youtube.com/watch?v=ZeGMfv2lZQA,Thời sự trưa 20/05/2026 || “THÁNG NGHE DÂN NÓI” - DIỄN ĐÀN THÁO GỠ NHỮNG VẤN ĐỀ “NÓNG” TẠI TP. HUẾ
yt_ZeGMfv2lZQA,ZeGMfv2lZQA,yt_ZeGMfv2lZQA__sent000144,/data/processed/segments/auto_20260624_082536/yt_ZeGMfv2lZQA/yt_ZeGMfv2lZQA__sent000144.wav,/data/processed/segments/auto_20260624_082536/yt_ZeGMfv2lZQA/yt_ZeGMfv2lZQA__sent000144.txt,1595.68,1613.31,17.63,01 tháng tới. Chính phủ Thái Lan ngày 19 tháng 5 đã thông báo quy định các giảm mạnh thời gian lưu trú miễn thị thực đối với khách du lịch đến từ hơn 90 quốc gia và vùng lãnh thổ nhằm ngăn chặn làn sóng tội phạm liên quan người nước ngoài đang có xu hướng giao tăng.,vtt,ready,aligned,speech_clean,1.0,,https://www.youtube.com/watch?v=ZeGMfv2lZQA,Thời sự trưa 20/05/2026 || “THÁNG NGHE DÂN NÓI” - DIỄN ĐÀN THÁO GỠ NHỮNG VẤN ĐỀ “NÓNG” TẠI TP. HUẾ
yt_ZeGMfv2lZQA,ZeGMfv2lZQA,yt_ZeGMfv2lZQA__sent000145,/data/processed/segments/auto_20260624_082536/yt_ZeGMfv2lZQA/yt_ZeGMfv2lZQA__sent000145.wav,/data/processed/segments/auto_20260624_082536/yt_ZeGMfv2lZQA/yt_ZeGMfv2lZQA__sent000145.txt,1609.56,1624.35,14.79,đang có xu hướng giao tăng. >> Bộ Du lịch Thái Lan nêu rõ thời gian miễn thị thực mới sẽ được xem xét và quyết định cụ thể đối với từng quốc gia. Phân lớn công dân nước ngoài sẽ chỉ được lưu trụ tối đa 30 ngày thay vì 60 ngày,vtt,ready,aligned,speech_clean,1.0,,https://www.youtube.com/watch?v=ZeGMfv2lZQA,Thời sự trưa 20/05/2026 || “THÁNG NGHE DÂN NÓI” - DIỄN ĐÀN THÁO GỠ NHỮNG VẤN ĐỀ “NÓNG” TẠI TP. HUẾ
yt_ZeGMfv2lZQA,ZeGMfv2lZQA,yt_ZeGMfv2lZQA__sent000146,/data/processed/segments/auto_20260624_082536/yt_ZeGMfv2lZQA/yt_ZeGMfv2lZQA__sent000146.wav,/data/processed/segments/auto_20260624_082536/yt_ZeGMfv2lZQA/yt_ZeGMfv2lZQA__sent000146.txt,1621.52,1635.51,13.99,được lưu trụ tối đa 30 ngày thay vì 60 ngày như trước đây. Thậm chí công dân của một số quốc gia và vùng lãnh thổ có thể chỉ được lưu trụ trong vòng 15 ngày. Quyết định này sẽ tác động trực tiếp đến du cách từ hơn 90 quốc gia và vùng lãnh thổ,vtt,ready,aligned,speech_clean,1.0,,https://www.youtube.com/watch?v=ZeGMfv2lZQA,Thời sự trưa 20/05/2026 || “THÁNG NGHE DÂN NÓI” - DIỄN ĐÀN THÁO GỠ NHỮNG VẤN ĐỀ “NÓNG” TẠI TP. HUẾ
yt_ZeGMfv2lZQA,ZeGMfv2lZQA,yt_ZeGMfv2lZQA__sent000147,/data/processed/segments/auto_20260624_082536/yt_ZeGMfv2lZQA/yt_ZeGMfv2lZQA__sent000147.wav,/data/processed/segments/auto_20260624_082536/yt_ZeGMfv2lZQA/yt_ZeGMfv2lZQA__sent000147.txt,1632.88,1648.47,15.59,"đến du cách từ hơn 90 quốc gia và vùng lãnh thổ đang được hưởng chính sách ưu đãi hiện hành trong đó có Mỹ, Israel và một số nước Nam Mỹ và 29 quốc gia thuộc hội của châu Âu. Các quy định mới sẽ có hiệu lực sau 15 ngày kể từ ngày được công bố trên",vtt,ready,aligned,speech_clean,1.0,,https://www.youtube.com/watch?v=ZeGMfv2lZQA,Thời sự trưa 20/05/2026 || “THÁNG NGHE DÂN NÓI” - DIỄN ĐÀN THÁO GỠ NHỮNG VẤN ĐỀ “NÓNG” TẠI TP. HUẾ
yt_ZeGMfv2lZQA,ZeGMfv2lZQA,yt_ZeGMfv2lZQA__sent000148,/data/processed/segments/auto_20260624_082536/yt_ZeGMfv2lZQA/yt_ZeGMfv2lZQA__sent000148.wav,/data/processed/segments/auto_20260624_082536/yt_ZeGMfv2lZQA/yt_ZeGMfv2lZQA__sent000148.txt,1645.92,1660.19,14.27,"lực sau 15 ngày kể từ ngày được công bố trên công báo hoàng gia. Quyết định được đưa ra trong bối cảnh ngành du lịch vốn đóng góp hơn 10% vào GDP của Thái Lan vẫn chưa thể phục hồi về mức trước đại dịch Covid-19. Dù vậy, chính phủ Thái Lan vẫn",vtt,ready,aligned,speech_clean,1.0,,https://www.youtube.com/watch?v=ZeGMfv2lZQA,Thời sự trưa 20/05/2026 || “THÁNG NGHE DÂN NÓI” - DIỄN ĐÀN THÁO GỠ NHỮNG VẤN ĐỀ “NÓNG” TẠI TP. HUẾ
yt_ZeGMfv2lZQA,ZeGMfv2lZQA,yt_ZeGMfv2lZQA__sent000149,/data/processed/segments/auto_20260624_082536/yt_ZeGMfv2lZQA/yt_ZeGMfv2lZQA__sent000149.wav,/data/processed/segments/auto_20260624_082536/yt_ZeGMfv2lZQA/yt_ZeGMfv2lZQA__sent000149.txt,1657.359,1673.12,15.761,"đại dịch Covid-19. Dù vậy, chính phủ Thái Lan vẫn kỳ vọng sẽ đón khoảng 33,5 triệu lượt du khách nước ngoài trong năm nay, tăng nhẹ so với mức gần 33 triệu lượt của năm ngoái. >> 29 tháng , tổ chức y tế thế giới vô đã",vtt,ready,aligned,speech_clean,1.0,,https://www.youtube.com/watch?v=ZeGMfv2lZQA,Thời sự trưa 20/05/2026 || “THÁNG NGHE DÂN NÓI” - DIỄN ĐÀN THÁO GỠ NHỮNG VẤN ĐỀ “NÓNG” TẠI TP. HUẾ
yt_ZeGMfv2lZQA,ZeGMfv2lZQA,yt_ZeGMfv2lZQA__sent000150,/data/processed/segments/auto_20260624_082536/yt_ZeGMfv2lZQA/yt_ZeGMfv2lZQA__sent000150.wav,/data/processed/segments/auto_20260624_082536/yt_ZeGMfv2lZQA/yt_ZeGMfv2lZQA__sent000150.txt,1666.719,1682.909,16.19,"của năm ngoái. >> 29 tháng , tổ chức y tế thế giới vô đã bày tỏ quang ngại về quy mô và tốc độ lê lan của virus Ebola tại Cộng hòa giáo dụ Congo vốn đã hiện 131 người thiệt mạng.",vtt,ready,aligned,speech_clean,1.0,,https://www.youtube.com/watch?v=ZeGMfv2lZQA,Thời sự trưa 20/05/2026 || “THÁNG NGHE DÂN NÓI” - DIỄN ĐÀN THÁO GỠ NHỮNG VẤN ĐỀ “NÓNG” TẠI TP. HUẾ
yt_ZeGMfv2lZQA,ZeGMfv2lZQA,yt_ZeGMfv2lZQA__sent000151,/data/processed/segments/auto_20260624_082536/yt_ZeGMfv2lZQA/yt_ZeGMfv2lZQA__sent000151.wav,/data/processed/segments/auto_20260624_082536/yt_ZeGMfv2lZQA/yt_ZeGMfv2lZQA__sent000151.txt,1682.719,1696.43,13.711,"mạng. Phá biểu tại kỳ họp đà hội đồng y tế thế giới lân thứ 79 diễn ra ở Ja, Thụy Sĩ, tổng giám đốc WHO Terros Admanom GBUS bày tỏ quang ngại sâu sắc về quy mô và tốc độ lây lan của dịch bệnh. Ông nhấn",vtt,ready,aligned,speech_clean,1.0,,https://www.youtube.com/watch?v=ZeGMfv2lZQA,Thời sự trưa 20/05/2026 || “THÁNG NGHE DÂN NÓI” - DIỄN ĐÀN THÁO GỠ NHỮNG VẤN ĐỀ “NÓNG” TẠI TP. HUẾ
yt_ZeGMfv2lZQA,ZeGMfv2lZQA,yt_ZeGMfv2lZQA__sent000152,/data/processed/segments/auto_20260624_082536/yt_ZeGMfv2lZQA/yt_ZeGMfv2lZQA__sent000152.wav,/data/processed/segments/auto_20260624_082536/yt_ZeGMfv2lZQA/yt_ZeGMfv2lZQA__sent000152.txt,1693.88,1707.47,13.59,mô và tốc độ lây lan của dịch bệnh. Ông nhấn mạnh rằng việc tuyên bố mức cảnh báo cao thử hai theo quyết định y tế quốc thể về virus Ebola không phải là một quyết định dễ dàng. Và báo ô đã tuyên bố sự gia tăng đột biển các ca nhiễm virus Ebola,vtt,ready,aligned,speech_clean,1.0,,https://www.youtube.com/watch?v=ZeGMfv2lZQA,Thời sự trưa 20/05/2026 || “THÁNG NGHE DÂN NÓI” - DIỄN ĐÀN THÁO GỠ NHỮNG VẤN ĐỀ “NÓNG” TẠI TP. HUẾ
yt_ZeGMfv2lZQA,ZeGMfv2lZQA,yt_ZeGMfv2lZQA__sent000153,/data/processed/segments/auto_20260624_082536/yt_ZeGMfv2lZQA/yt_ZeGMfv2lZQA__sent000153.wav,/data/processed/segments/auto_20260624_082536/yt_ZeGMfv2lZQA/yt_ZeGMfv2lZQA__sent000153.txt,1705.04,1720.47,15.43,sự gia tăng đột biển các ca nhiễm virus Ebola có tính lây lan cao là tình trạng khẩn cấp y tế toàn cầu. và tổ chức một cuộc họp khẩn cấp về cuộc khủng hoảng này trong ngày 19 tháng 5. Hiện chưa có vắc xin hoặc phương pháp điều trị đặc hiệu đối với chủng virus gây ra được bung,vtt,ready,aligned,speech_clean,1.0,,https://www.youtube.com/watch?v=ZeGMfv2lZQA,Thời sự trưa 20/05/2026 || “THÁNG NGHE DÂN NÓI” - DIỄN ĐÀN THÁO GỠ NHỮNG VẤN ĐỀ “NÓNG” TẠI TP. HUẾ
