audio_id,video_id,segment_id,segment_file,transcript_file,start,end,duration,text,transcript_source,transcript_status,vad_status,quality_label,quality_score,quality_reasons,source_url,title
yt_Gafu0-_oNPo,Gafu0-_oNPo,yt_Gafu0-_oNPo__sent000124,/data/processed/segments/auto_20260624_082536/yt_Gafu0-_oNPo/yt_Gafu0-_oNPo__sent000124.wav,/data/processed/segments/auto_20260624_082536/yt_Gafu0-_oNPo/yt_Gafu0-_oNPo__sent000124.txt,1414.32,1429.63,15.31,"tối đa thiệt hại. Mới đây, mưa lớn kéo dài tại khu vực miền núi thuộc thành phố Đà Nẵng đã khiến mực nước của các sông như sông Vu Gia và sông Côn dâng cao nhanh chóng. Khu vật xã Thượng Đức là điểm bị ảnh hưởng nặng nề. Sáng 27 tháng 10, hơn",vtt,ready,aligned,speech_clean,1.0,,https://www.youtube.com/watch?v=Gafu0-_oNPo,"Góc thời sự: Tiếng nổ chấn động Đà Nẵng, quả đồi đổ sụp san phẳng nhiều nơi trong tích tắc"
yt_Gafu0-_oNPo,Gafu0-_oNPo,yt_Gafu0-_oNPo__sent000125,/data/processed/segments/auto_20260624_082536/yt_Gafu0-_oNPo/yt_Gafu0-_oNPo__sent000125.wav,/data/processed/segments/auto_20260624_082536/yt_Gafu0-_oNPo/yt_Gafu0-_oNPo__sent000125.txt,1427.4,1442.149,14.749,"bị ảnh hưởng nặng nề. Sáng 27 tháng 10, hơn 2120 căn nhà với khoảng 4300 người dân đã bị ngập và chia cắt hoàn toàn giữa dòng nước. Tại xã Thượng Đức, nhiều tuyến đường chính dẫn vào trung tâm bị ngập sâu từ 0,8 m tới hơn 1 m. Xe máy không thể lưu",vtt,ready,aligned,speech_clean,1.0,,https://www.youtube.com/watch?v=Gafu0-_oNPo,"Góc thời sự: Tiếng nổ chấn động Đà Nẵng, quả đồi đổ sụp san phẳng nhiều nơi trong tích tắc"
yt_Gafu0-_oNPo,Gafu0-_oNPo,yt_Gafu0-_oNPo__sent000126,/data/processed/segments/auto_20260624_082536/yt_Gafu0-_oNPo/yt_Gafu0-_oNPo__sent000126.wav,/data/processed/segments/auto_20260624_082536/yt_Gafu0-_oNPo/yt_Gafu0-_oNPo__sent000126.txt,1438.959,1452.47,13.511,"sâu từ 0,8 m tới hơn 1 m. Xe máy không thể lưu thông. Người dân phải dùng xuồng ghe để di chuyển và vận chuyển nhu yếu phẩm. Các thôn như Đại Mỹ, Thạnh Đại, Thái Chấn Sơn, Trúc Hà, Tân An, Hà Dục Tây,",vtt,ready,aligned,speech_clean,1.0,,https://www.youtube.com/watch?v=Gafu0-_oNPo,"Góc thời sự: Tiếng nổ chấn động Đà Nẵng, quả đồi đổ sụp san phẳng nhiều nơi trong tích tắc"
yt_Gafu0-_oNPo,Gafu0-_oNPo,yt_Gafu0-_oNPo__sent000127,/data/processed/segments/auto_20260624_082536/yt_Gafu0-_oNPo/yt_Gafu0-_oNPo__sent000127.wav,/data/processed/segments/auto_20260624_082536/yt_Gafu0-_oNPo/yt_Gafu0-_oNPo__sent000127.txt,1448.599,1465.51,16.911,"Thái Chấn Sơn, Trúc Hà, Tân An, Hà Dục Tây, tỉnh Đông Tây, Hà Dục Đông. Khu hà dục Bắc cũ đã bị ngập sâu và bị chia cắt. Theo số liệu từ đài khí tượng thủy văn Trung Bộ, vào 8:00 sáng ngày 27 tháng 10, mực nước sông Vu Gia tại hội khách",vtt,ready,aligned,speech_clean,1.0,,https://www.youtube.com/watch?v=Gafu0-_oNPo,"Góc thời sự: Tiếng nổ chấn động Đà Nẵng, quả đồi đổ sụp san phẳng nhiều nơi trong tích tắc"
yt_Gafu0-_oNPo,Gafu0-_oNPo,yt_Gafu0-_oNPo__sent000128,/data/processed/segments/auto_20260624_082536/yt_Gafu0-_oNPo/yt_Gafu0-_oNPo__sent000128.wav,/data/processed/segments/auto_20260624_082536/yt_Gafu0-_oNPo/yt_Gafu0-_oNPo__sent000128.txt,1462.68,1476.11,13.43,"tháng 10, mực nước sông Vu Gia tại hội khách đạt 16,25 m, vượt mức báo động hai khoảng 0,75 m tại Ái Nghĩa đạt 9,08 m, vượt mức báo động 3 khoảng 0,08 m. Sông",vtt,ready,aligned,speech_clean,1.0,,https://www.youtube.com/watch?v=Gafu0-_oNPo,"Góc thời sự: Tiếng nổ chấn động Đà Nẵng, quả đồi đổ sụp san phẳng nhiều nơi trong tích tắc"
yt_Gafu0-_oNPo,Gafu0-_oNPo,yt_Gafu0-_oNPo__sent000129,/data/processed/segments/auto_20260624_082536/yt_Gafu0-_oNPo/yt_Gafu0-_oNPo__sent000129.wav,/data/processed/segments/auto_20260624_082536/yt_Gafu0-_oNPo/yt_Gafu0-_oNPo__sent000129.txt,1472.76,1487.789,15.029,"m, vượt mức báo động 3 khoảng 0,08 m. Sông Thu Bồn tại Nông Sơn đạt 16,42 m, vượt báo động ba khoảng 1,42 m. Cơ quan khí tượng cảnh báo trong vòng 6 đến 12 giờ tới lũ trên các sông Vu gia thu bồn sẽ",vtt,ready,aligned,speech_clean,1.0,,https://www.youtube.com/watch?v=Gafu0-_oNPo,"Góc thời sự: Tiếng nổ chấn động Đà Nẵng, quả đồi đổ sụp san phẳng nhiều nơi trong tích tắc"
yt_Gafu0-_oNPo,Gafu0-_oNPo,yt_Gafu0-_oNPo__sent000130,/data/processed/segments/auto_20260624_082536/yt_Gafu0-_oNPo/yt_Gafu0-_oNPo__sent000130.wav,/data/processed/segments/auto_20260624_082536/yt_Gafu0-_oNPo/yt_Gafu0-_oNPo__sent000130.txt,1484.8,1501.71,16.91,giờ tới lũ trên các sông Vu gia thu bồn sẽ lên mức trên báo động ba. Sông hàng duy trì trên báo động ba ngập lục tại Thượng Đức chỉ là phần nổi của tình hình. Nhiều xã miền núi khác của Đà Nẵng cũng ghi nhận cảnh nước dân cao chia các giao thông và cô lập dân cư do m lớn kết hợp,vtt,ready,aligned,speech_clean,1.0,,https://www.youtube.com/watch?v=Gafu0-_oNPo,"Góc thời sự: Tiếng nổ chấn động Đà Nẵng, quả đồi đổ sụp san phẳng nhiều nơi trong tích tắc"
yt_Gafu0-_oNPo,Gafu0-_oNPo,yt_Gafu0-_oNPo__sent000131,/data/processed/segments/auto_20260624_082536/yt_Gafu0-_oNPo/yt_Gafu0-_oNPo__sent000131.wav,/data/processed/segments/auto_20260624_082536/yt_Gafu0-_oNPo/yt_Gafu0-_oNPo__sent000131.txt,1498.959,1512.63,13.671,các giao thông và cô lập dân cư do m lớn kết hợp với việc các hộ thủy điện ở thượng nguồn đang xả lũ với lưu lượng lớn nguy cơ ngập sâu lũ quét sặc lỡ đất tại các sườn dốc vùng núi được đánh giá rất cao. Trước sự diễn biến phức tạp chính quyền,vtt,ready,aligned,speech_clean,1.0,,https://www.youtube.com/watch?v=Gafu0-_oNPo,"Góc thời sự: Tiếng nổ chấn động Đà Nẵng, quả đồi đổ sụp san phẳng nhiều nơi trong tích tắc"
yt_Gafu0-_oNPo,Gafu0-_oNPo,yt_Gafu0-_oNPo__sent000132,/data/processed/segments/auto_20260624_082536/yt_Gafu0-_oNPo/yt_Gafu0-_oNPo__sent000132.wav,/data/processed/segments/auto_20260624_082536/yt_Gafu0-_oNPo/yt_Gafu0-_oNPo__sent000132.txt,1510.64,1525.389,14.749,cao. Trước sự diễn biến phức tạp chính quyền xã Thượng Đức đã huy động lực lượng hỗ trợ người dân sơ tán và di chuyển đồ đạt tới các khu vực cao hơn đồng thời phong tỏa nhiều đoạn đường để bảo đảm an toàn. Cơ quan chức năng cảnh báo người dân không tự ý di chuyển qua các khu vực,vtt,ready,aligned,speech_clean,1.0,,https://www.youtube.com/watch?v=Gafu0-_oNPo,"Góc thời sự: Tiếng nổ chấn động Đà Nẵng, quả đồi đổ sụp san phẳng nhiều nơi trong tích tắc"
yt_Gafu0-_oNPo,Gafu0-_oNPo,yt_Gafu0-_oNPo__sent000133,/data/processed/segments/auto_20260624_082536/yt_Gafu0-_oNPo/yt_Gafu0-_oNPo__sent000133.wav,/data/processed/segments/auto_20260624_082536/yt_Gafu0-_oNPo/yt_Gafu0-_oNPo__sent000133.txt,1523.359,1530.99,7.631,"dân không tự ý di chuyển qua các khu vực ngập sâu mất sóng, mất điện cần tuân thủ chỉ dẫn của lực lượng tại chỗ.",vtt,ready,aligned,speech_clean,1.0,,https://www.youtube.com/watch?v=Gafu0-_oNPo,"Góc thời sự: Tiếng nổ chấn động Đà Nẵng, quả đồi đổ sụp san phẳng nhiều nơi trong tích tắc"
yt_Gafu0-_oNPo,Gafu0-_oNPo,yt_Gafu0-_oNPo__sent000134,/data/processed/segments/auto_20260624_082536/yt_Gafu0-_oNPo/yt_Gafu0-_oNPo__sent000134.wav,/data/processed/segments/auto_20260624_082536/yt_Gafu0-_oNPo/yt_Gafu0-_oNPo__sent000134.txt,1527.64,1543.029,15.389,"thủ chỉ dẫn của lực lượng tại chỗ. Theo Ban chỉ huy phòng thủ dân sự thành phố Huế, do ảnh hưởng của không khí lạnh tăng cường kết hợp với nhiễu động trong đới gió đông trên cao, trên địa bàn đang xảy ra mưa đặc biệt to trên diện rộng. Đây là đợt mưa lớn thứ ba liên tiếp kể",vtt,ready,aligned,speech_clean,1.0,,https://www.youtube.com/watch?v=Gafu0-_oNPo,"Góc thời sự: Tiếng nổ chấn động Đà Nẵng, quả đồi đổ sụp san phẳng nhiều nơi trong tích tắc"
yt_Gafu0-_oNPo,Gafu0-_oNPo,yt_Gafu0-_oNPo__sent000135,/data/processed/segments/auto_20260624_082536/yt_Gafu0-_oNPo/yt_Gafu0-_oNPo__sent000135.wav,/data/processed/segments/auto_20260624_082536/yt_Gafu0-_oNPo/yt_Gafu0-_oNPo__sent000135.txt,1540.92,1555.11,14.19,"rộng. Đây là đợt mưa lớn thứ ba liên tiếp kể từ ngày 15 tháng 10. Theo thống kê, từ 13 gi ngày 25 tháng 10 đến 4 gi ngày 27 tháng 10, tổng lượng mưa phổ biến tại khu vực đạt từ 250 đến 450 mm. Một số nơi ghi nhận lượng mưa cực lớn như đỉnh",vtt,ready,aligned,speech_clean,1.0,,https://www.youtube.com/watch?v=Gafu0-_oNPo,"Góc thời sự: Tiếng nổ chấn động Đà Nẵng, quả đồi đổ sụp san phẳng nhiều nơi trong tích tắc"
yt_Gafu0-_oNPo,Gafu0-_oNPo,yt_Gafu0-_oNPo__sent000136,/data/processed/segments/auto_20260624_082536/yt_Gafu0-_oNPo/yt_Gafu0-_oNPo__sent000136.wav,/data/processed/segments/auto_20260624_082536/yt_Gafu0-_oNPo/yt_Gafu0-_oNPo__sent000136.txt,1552.92,1570.269,17.349,"Một số nơi ghi nhận lượng mưa cực lớn như đỉnh Bạch Mã 1426 mm, Khe Tre 700 mm, Hương Sơn 589 mm. Đáng chú ý tại trạm Nam Đông, lượng mưa giờ lớn nhất đo được lên đến 104,6 mm/h trong khoảng 24 gi đến 1",vtt,ready,aligned,speech_clean,1.0,,https://www.youtube.com/watch?v=Gafu0-_oNPo,"Góc thời sự: Tiếng nổ chấn động Đà Nẵng, quả đồi đổ sụp san phẳng nhiều nơi trong tích tắc"
yt_Gafu0-_oNPo,Gafu0-_oNPo,yt_Gafu0-_oNPo__sent000137,/data/processed/segments/auto_20260624_082536/yt_Gafu0-_oNPo/yt_Gafu0-_oNPo__sent000137.wav,/data/processed/segments/auto_20260624_082536/yt_Gafu0-_oNPo/yt_Gafu0-_oNPo__sent000137.txt,1565.839,1580.11,14.271,"lên đến 104,6 mm/h trong khoảng 24 gi đến 1 gi ngày 27 tháng 10. Dự báo từ sáng 27 đến sáng 29 tháng 10, khu vực thành phố Huế tiếp tục có mưa to đến rất to. Vùng núi có nơi mưa đặc biệt to. Tổng lượng",vtt,ready,aligned,speech_clean,1.0,,https://www.youtube.com/watch?v=Gafu0-_oNPo,"Góc thời sự: Tiếng nổ chấn động Đà Nẵng, quả đồi đổ sụp san phẳng nhiều nơi trong tích tắc"
yt_Gafu0-_oNPo,Gafu0-_oNPo,yt_Gafu0-_oNPo__sent000138,/data/processed/segments/auto_20260624_082536/yt_Gafu0-_oNPo/yt_Gafu0-_oNPo__sent000138.wav,/data/processed/segments/auto_20260624_082536/yt_Gafu0-_oNPo/yt_Gafu0-_oNPo__sent000138.txt,1577.479,1591.35,13.871,"to. Vùng núi có nơi mưa đặc biệt to. Tổng lượng mưa đợt này phổ biến từ 250 đến 500 mm, có nơi vượt 700 mm. Lúc 7:00 sáng ngày 27 tháng 10, mực nước đo được tại một số trạm như sau: Trên sông Bộ tại trạm Phú",vtt,ready,aligned,speech_clean,1.0,,https://www.youtube.com/watch?v=Gafu0-_oNPo,"Góc thời sự: Tiếng nổ chấn động Đà Nẵng, quả đồi đổ sụp san phẳng nhiều nơi trong tích tắc"
yt_Gafu0-_oNPo,Gafu0-_oNPo,yt_Gafu0-_oNPo__sent000139,/data/processed/segments/auto_20260624_082536/yt_Gafu0-_oNPo/yt_Gafu0-_oNPo__sent000139.wav,/data/processed/segments/auto_20260624_082536/yt_Gafu0-_oNPo/yt_Gafu0-_oNPo__sent000139.txt,1588.479,1603.59,15.111,"một số trạm như sau: Trên sông Bộ tại trạm Phú Ốc đạt 4,52 m, cao hơn báo đoạn ba là 0,02 m. Trên sông Hương tại trạm Kim Long đạt 3,58 m, cao hơn báo động ba là 0,08 m. Trong khi đó, trên sông Vu Gia,",vtt,ready,aligned,speech_clean,1.0,,https://www.youtube.com/watch?v=Gafu0-_oNPo,"Góc thời sự: Tiếng nổ chấn động Đà Nẵng, quả đồi đổ sụp san phẳng nhiều nơi trong tích tắc"
yt_Gafu0-_oNPo,Gafu0-_oNPo,yt_Gafu0-_oNPo__sent000140,/data/processed/segments/auto_20260624_082536/yt_Gafu0-_oNPo/yt_Gafu0-_oNPo__sent000140.wav,/data/processed/segments/auto_20260624_082536/yt_Gafu0-_oNPo/yt_Gafu0-_oNPo__sent000140.txt,1600.44,1615.95,15.51,"là 0,08 m. Trong khi đó, trên sông Vu Gia, Đà Nẵng tại trạm Ái Nghĩa, mực nước ở mức báo rộng 3 9,01 m và trên sông Thu Bồn tại trạm Nông Sơn đạt 16,42 m, cao hơn báo động ba là 1,42 m. Tại trạm Câu",vtt,ready,aligned,speech_clean,1.0,,https://www.youtube.com/watch?v=Gafu0-_oNPo,"Góc thời sự: Tiếng nổ chấn động Đà Nẵng, quả đồi đổ sụp san phẳng nhiều nơi trong tích tắc"
yt_Gafu0-_oNPo,Gafu0-_oNPo,yt_Gafu0-_oNPo__sent000141,/data/processed/segments/auto_20260624_082536/yt_Gafu0-_oNPo/yt_Gafu0-_oNPo__sent000141.wav,/data/processed/segments/auto_20260624_082536/yt_Gafu0-_oNPo/yt_Gafu0-_oNPo__sent000141.txt,1612.4,1628.149,15.749,"cao hơn báo động ba là 1,42 m. Tại trạm Câu Lâu đạt 3,71 m, thấp hơn báo rộng ba là 0,29 m. Dự báo trong 6 giờ tới lũ trên các sông ở thành phố Huế sẽ tiếp tục lên nhanh. Tại trạm Phú Ốc, mực nước có khả",vtt,ready,aligned,speech_clean,1.0,,https://www.youtube.com/watch?v=Gafu0-_oNPo,"Góc thời sự: Tiếng nổ chấn động Đà Nẵng, quả đồi đổ sụp san phẳng nhiều nơi trong tích tắc"
yt_Gafu0-_oNPo,Gafu0-_oNPo,yt_Gafu0-_oNPo__sent000142,/data/processed/segments/auto_20260624_082536/yt_Gafu0-_oNPo/yt_Gafu0-_oNPo__sent000142.wav,/data/processed/segments/auto_20260624_082536/yt_Gafu0-_oNPo/yt_Gafu0-_oNPo__sent000142.txt,1625.079,1639.269,14.19,"tục lên nhanh. Tại trạm Phú Ốc, mực nước có khả năng vượt mức lũ đỉnh lịch sử năm 2020 5,24 mừ 0,05 đến 0,10 m. Còn tại trạm Kim Long, mực nước có thể cao hơn báo",vtt,ready,aligned,speech_clean,1.0,,https://www.youtube.com/watch?v=Gafu0-_oNPo,"Góc thời sự: Tiếng nổ chấn động Đà Nẵng, quả đồi đổ sụp san phẳng nhiều nơi trong tích tắc"
yt_Gafu0-_oNPo,Gafu0-_oNPo,yt_Gafu0-_oNPo__sent000143,/data/processed/segments/auto_20260624_082536/yt_Gafu0-_oNPo/yt_Gafu0-_oNPo__sent000143.wav,/data/processed/segments/auto_20260624_082536/yt_Gafu0-_oNPo/yt_Gafu0-_oNPo__sent000143.txt,1637.04,1651.549,14.509,"trạm Kim Long, mực nước có thể cao hơn báo động ba khoảng 1,10 m. Trên sông Vu Gia, lũ duy trì trên mức bá đồng bà, mưa lũ lớn khiến hệ thống giao thông trên địa bàn bị ảnh hưởng nghiêm trọng. Quốc lộ 49B qua các phường Phong Dinh, Phong",vtt,ready,aligned,speech_clean,1.0,,https://www.youtube.com/watch?v=Gafu0-_oNPo,"Góc thời sự: Tiếng nổ chấn động Đà Nẵng, quả đồi đổ sụp san phẳng nhiều nơi trong tích tắc"
yt_Gafu0-_oNPo,Gafu0-_oNPo,yt_Gafu0-_oNPo__sent000144,/data/processed/segments/auto_20260624_082536/yt_Gafu0-_oNPo/yt_Gafu0-_oNPo__sent000144.wav,/data/processed/segments/auto_20260624_082536/yt_Gafu0-_oNPo/yt_Gafu0-_oNPo__sent000144.txt,1648.68,1664.389,15.709,"lộ 49B qua các phường Phong Dinh, Phong Phú, Dương Nổ ngập sâu từ 0,1 đến 0,4 m. Lực lượng chức năng đã rào chắn và cấm xe lưu thông trên Quốc lộ 49 đoạn tại km 2300 phường Thủy Xuân xảy ra sạc trược",vtt,ready,aligned,speech_clean,1.0,,https://www.youtube.com/watch?v=Gafu0-_oNPo,"Góc thời sự: Tiếng nổ chấn động Đà Nẵng, quả đồi đổ sụp san phẳng nhiều nơi trong tích tắc"
yt_Gafu0-_oNPo,Gafu0-_oNPo,yt_Gafu0-_oNPo__sent000145,/data/processed/segments/auto_20260624_082536/yt_Gafu0-_oNPo/yt_Gafu0-_oNPo__sent000145.wav,/data/processed/segments/auto_20260624_082536/yt_Gafu0-_oNPo/yt_Gafu0-_oNPo__sent000145.txt,1660.88,1674.43,13.55,"km 2300 phường Thủy Xuân xảy ra sạc trược tali ly âm và nhiều điểm sạc lỡ khác. Tại quốc lộ 1, nước lũ dâng cao trạng qua đoạn qua xã Phú Lộc song các phương tiện vẫn có thể di chuyển. Nhiều tuyến",vtt,ready,aligned,speech_clean,1.0,,https://www.youtube.com/watch?v=Gafu0-_oNPo,"Góc thời sự: Tiếng nổ chấn động Đà Nẵng, quả đồi đổ sụp san phẳng nhiều nơi trong tích tắc"
yt_Gafu0-_oNPo,Gafu0-_oNPo,yt_Gafu0-_oNPo__sent000146,/data/processed/segments/auto_20260624_082536/yt_Gafu0-_oNPo/yt_Gafu0-_oNPo__sent000146.wav,/data/processed/segments/auto_20260624_082536/yt_Gafu0-_oNPo/yt_Gafu0-_oNPo__sent000146.txt,1672.12,1686.83,14.71,phương tiện vẫn có thể di chuyển. Nhiều tuyến đường tỉnh bị ngập sâu không thể lưu thông. Đặc biệt đường tỉnh 21 Điền Hương đoạn từ km 9+00 đến km 10 + 500. bị sói lỡ hư hỏng hoàn,vtt,ready,aligned,speech_clean,1.0,,https://www.youtube.com/watch?v=Gafu0-_oNPo,"Góc thời sự: Tiếng nổ chấn động Đà Nẵng, quả đồi đổ sụp san phẳng nhiều nơi trong tích tắc"
yt_Gafu0-_oNPo,Gafu0-_oNPo,yt_Gafu0-_oNPo__sent000147,/data/processed/segments/auto_20260624_082536/yt_Gafu0-_oNPo/yt_Gafu0-_oNPo__sent000147.wav,/data/processed/segments/auto_20260624_082536/yt_Gafu0-_oNPo/yt_Gafu0-_oNPo__sent000147.txt,1682.24,1700.509,18.269,"9+00 đến km 10 + 500. bị sói lỡ hư hỏng hoàn toàn. Một số tuyến đường qua các xã Hóa Châu, Quảng Điện bị ngập từ 0,5 đến 1 m và đã được rào chắng cấm xe di chuyển. Trong khu vực nội đô, các tuyến đường Ngô Đức Kế, Nguyễn Chí Diễu, Đặng Dung,",vtt,ready,aligned,speech_clean,1.0,,https://www.youtube.com/watch?v=Gafu0-_oNPo,"Góc thời sự: Tiếng nổ chấn động Đà Nẵng, quả đồi đổ sụp san phẳng nhiều nơi trong tích tắc"
yt_Gafu0-_oNPo,Gafu0-_oNPo,yt_Gafu0-_oNPo__sent000148,/data/processed/segments/auto_20260624_082536/yt_Gafu0-_oNPo/yt_Gafu0-_oNPo__sent000148.wav,/data/processed/segments/auto_20260624_082536/yt_Gafu0-_oNPo/yt_Gafu0-_oNPo__sent000148.txt,1697.359,1710.389,13.03,"đường Ngô Đức Kế, Nguyễn Chí Diễu, Đặng Dung, Tố Hữu, Hà Huy Tập ngập phổ biến từ 0,3 đến 0,5 m. Tại xã Khe Tre xảy ra sạc lỡ máy t ly dương ở ngã rẻ từ đường cao tốc",vtt,ready,aligned,speech_clean,1.0,,https://www.youtube.com/watch?v=Gafu0-_oNPo,"Góc thời sự: Tiếng nổ chấn động Đà Nẵng, quả đồi đổ sụp san phẳng nhiều nơi trong tích tắc"
yt_Gafu0-_oNPo,Gafu0-_oNPo,yt_Gafu0-_oNPo__sent000149,/data/processed/segments/auto_20260624_082536/yt_Gafu0-_oNPo/yt_Gafu0-_oNPo__sent000149.wav,/data/processed/segments/auto_20260624_082536/yt_Gafu0-_oNPo/yt_Gafu0-_oNPo__sent000149.txt,1707.52,1722.83,15.31,lỡ máy t ly dương ở ngã rẻ từ đường cao tốc vào trung tâm xã. Chính quyền địa phương đã phối hợp xử lý và ngăn phương tiện lưu thông. Khu vực đeo số 5 thôn Lộc Hưng được cảnh báo có nguy cơ sạc lỡ cao có thể cô lập khoảng 40 hộ dân. Đáng chú,vtt,ready,aligned,speech_clean,1.0,,https://www.youtube.com/watch?v=Gafu0-_oNPo,"Góc thời sự: Tiếng nổ chấn động Đà Nẵng, quả đồi đổ sụp san phẳng nhiều nơi trong tích tắc"
yt_Gafu0-_oNPo,Gafu0-_oNPo,yt_Gafu0-_oNPo__sent000150,/data/processed/segments/auto_20260624_082536/yt_Gafu0-_oNPo/yt_Gafu0-_oNPo__sent000150.wav,/data/processed/segments/auto_20260624_082536/yt_Gafu0-_oNPo/yt_Gafu0-_oNPo__sent000150.txt,1719.839,1735.43,15.591,"cao có thể cô lập khoảng 40 hộ dân. Đáng chú ý, tình trạng sạc lỡ bờ biển đang diễn biến đặc biệt nghiêm trọng tại phường Thuận An đoạn qua tổ dân phố Hòa Duân bị sạc lỡ dài khoảng 1 km. Biển xâm thực sâu vào đất điện 50 đến 70 m. đe dọa hạ",vtt,ready,aligned,speech_clean,1.0,,https://www.youtube.com/watch?v=Gafu0-_oNPo,"Góc thời sự: Tiếng nổ chấn động Đà Nẵng, quả đồi đổ sụp san phẳng nhiều nơi trong tích tắc"
yt_Gafu0-_oNPo,Gafu0-_oNPo,yt_Gafu0-_oNPo__sent000151,/data/processed/segments/auto_20260624_082536/yt_Gafu0-_oNPo/yt_Gafu0-_oNPo__sent000151.wav,/data/processed/segments/auto_20260624_082536/yt_Gafu0-_oNPo/yt_Gafu0-_oNPo__sent000151.txt,1732.44,1746.789,14.349,"thực sâu vào đất điện 50 đến 70 m. đe dọa hạ tần và có nguy cơ hình thành cửa biển mới. Bờ biển qua xã Vinh Lộc cũng bị xâm thựt 10 đến 30 m trên chiều dài khoảng 2 km. Sáng sớm 27 tháng 10, nước lũ ào ạc",vtt,ready,aligned,speech_clean,1.0,,https://www.youtube.com/watch?v=Gafu0-_oNPo,"Góc thời sự: Tiếng nổ chấn động Đà Nẵng, quả đồi đổ sụp san phẳng nhiều nơi trong tích tắc"
yt_Gafu0-_oNPo,Gafu0-_oNPo,yt_Gafu0-_oNPo__sent000152,/data/processed/segments/auto_20260624_082536/yt_Gafu0-_oNPo/yt_Gafu0-_oNPo__sent000152.wav,/data/processed/segments/auto_20260624_082536/yt_Gafu0-_oNPo/yt_Gafu0-_oNPo__sent000152.txt,1743.199,1758.549,15.35,"khoảng 2 km. Sáng sớm 27 tháng 10, nước lũ ào ạc tràn qua tuyến cao tốc La Sơn, Túy Loan, đoạn Huế, Đà Nẵng tại vị trí km 14 gây nguy hiểm cho phương tiện lưu thông. Ban chỉ huy phòng thủ dân sự Huế đã kích hoạt hệ thống còi hú cảnh báo thiên tai",vtt,ready,aligned,speech_clean,1.0,,https://www.youtube.com/watch?v=Gafu0-_oNPo,"Góc thời sự: Tiếng nổ chấn động Đà Nẵng, quả đồi đổ sụp san phẳng nhiều nơi trong tích tắc"
yt_Gafu0-_oNPo,Gafu0-_oNPo,yt_Gafu0-_oNPo__sent000153,/data/processed/segments/auto_20260624_082536/yt_Gafu0-_oNPo/yt_Gafu0-_oNPo__sent000153.wav,/data/processed/segments/auto_20260624_082536/yt_Gafu0-_oNPo/yt_Gafu0-_oNPo__sent000153.txt,1755.8,1771.149,15.349,"kích hoạt hệ thống còi hú cảnh báo thiên tai tại khu vực tòa nhà trung tâm hành chính tập trung phường Vĩ Dạ. để thông báo người dân chủ động ứng phó khi nước lũ tiếp tục dâng cao. Do ảnh hưởng của mưa lớn kéo dài, mực nước cắt sông lên nhanh, nhiều tuyến đường tại các xã,",vtt,ready,aligned,speech_clean,1.0,,https://www.youtube.com/watch?v=Gafu0-_oNPo,"Góc thời sự: Tiếng nổ chấn động Đà Nẵng, quả đồi đổ sụp san phẳng nhiều nơi trong tích tắc"
yt_Gafu0-_oNPo,Gafu0-_oNPo,yt_Gafu0-_oNPo__sent000154,/data/processed/segments/auto_20260624_082536/yt_Gafu0-_oNPo/yt_Gafu0-_oNPo__sent000154.wav,/data/processed/segments/auto_20260624_082536/yt_Gafu0-_oNPo/yt_Gafu0-_oNPo__sent000154.txt,1769.079,1783.549,14.47,"sông lên nhanh, nhiều tuyến đường tại các xã, phường viện Ngọc Sâu gây cản trở việc đến trường của học sinh. Thực hiện chỉ đạo của Ủy ban nhân dân thành phố Huế, Sở Giáo dục và Đào tạo đã cho toàn bộ học sinh nghĩ học trong ngày 27 tháng 10 để đảm bảo an toàn. Ngành giáo dục yêu",vtt,ready,aligned,speech_clean,1.0,,https://www.youtube.com/watch?v=Gafu0-_oNPo,"Góc thời sự: Tiếng nổ chấn động Đà Nẵng, quả đồi đổ sụp san phẳng nhiều nơi trong tích tắc"
yt_Gafu0-_oNPo,Gafu0-_oNPo,yt_Gafu0-_oNPo__sent000155,/data/processed/segments/auto_20260624_082536/yt_Gafu0-_oNPo/yt_Gafu0-_oNPo__sent000155.wav,/data/processed/segments/auto_20260624_082536/yt_Gafu0-_oNPo/yt_Gafu0-_oNPo__sent000155.txt,1781.04,1795.71,14.67,"10 để đảm bảo an toàn. Ngành giáo dục yêu cầu các trường học và cơ sở giáo dục chủ động triển khai biện pháp bảo vệ cơ sở vật chất, kiểm tra hệ thống điện, tường rào, cây xanh trong khuôn viên. Đồng thời các đơn vị cần thông báo kịp thời đến phụ huynh và học sinh về lịch nghỉ",vtt,ready,aligned,speech_clean,1.0,,https://www.youtube.com/watch?v=Gafu0-_oNPo,"Góc thời sự: Tiếng nổ chấn động Đà Nẵng, quả đồi đổ sụp san phẳng nhiều nơi trong tích tắc"
yt_Gafu0-_oNPo,Gafu0-_oNPo,yt_Gafu0-_oNPo__sent000156,/data/processed/segments/auto_20260624_082536/yt_Gafu0-_oNPo/yt_Gafu0-_oNPo__sent000156.wav,/data/processed/segments/auto_20260624_082536/yt_Gafu0-_oNPo/yt_Gafu0-_oNPo__sent000156.txt,1793.479,1807.11,13.631,"kịp thời đến phụ huynh và học sinh về lịch nghỉ học để chủ động phòng tránh mưa lũ, đảm bảo an tàn tuyệt đối trong thời tiết phức tạp. >> Mới đây, tại khu vực đầu cầu Caz trên tuyến quốc lộ 24C giáp danh giữa xã Trà",vtt,ready,aligned,speech_clean,1.0,,https://www.youtube.com/watch?v=Gafu0-_oNPo,"Góc thời sự: Tiếng nổ chấn động Đà Nẵng, quả đồi đổ sụp san phẳng nhiều nơi trong tích tắc"
